review_bucket,comment_text,source_weak_label,source_confidence,source_depression_score,phobert_label,probability,prob_normal,prob_depression,need_review,suggested_label,final_label,reviewer_note,row_id,text_hash
low_confidence,"Thanks a vì clip này, e đã từng cảm giác rằng công việc hiện tại là do năm đó mình vừa ra trg, mình cần việc nên làm đại và e rất chán khi đi làm nhưng dần dần e nhận ra đc công việc này đã nuôi e ntn, đã giúp e quen biết thêm nhiều ng ntn, đã tập cho e thói quen trc khi nói hay gửi email phải đọc đi đọc lại, nghĩ đi nghĩ lại ra sao...e cảm thấy nó chọn e là có lý do của nó. Nhiều người nói 28t như e ng ta đã start up rồi còn e thì sao chưa làm, e vẫn chỉ cười r nói lại là bgio chưa phải lúc e làm đc như vậy, mỗi ng sẽ có khoảng thời gian thành công riêng chỉ là sớm hay muộn thôi, nhưng sớm hay muộn thì nó sẽ đến miễn là e ko bỏ nó là đc",uncertain,low,0,normal,0.5615,0.5615,0.4385,True,normal,,,s8-0654,3fb47cab23
low_confidence,Mục tiêu lớn nhất của mình là đỗ đại học,uncertain,low,0,normal,0.5616,0.5616,0.4384,True,normal,,,s8-0655,7da742cbd7
low_confidence,Gặp nhà chồng như thế này nen bo đừng nhẫn nhịn 😢 quá tàn nhẫn gặp quả báo thôi,uncertain,low,0,depression,0.5616,0.4384,0.5616,True,depression,,,s8-0656,1c27cd764f
low_confidence,Ai đó đã nợ tôi một lễ đường,uncertain,low,0,depression,0.5616,0.4385,0.5616,True,depression,,,s8-0657,2646cc01ab
low_confidence,"Mà bố mẹ, ông bà không hiểu tôi, đừng có thích tự nói gì thì nói, làm gì thì làm. Họ không biết gì về tôi cả ! Làm ơn đừng phán xét tôi nữa !",uncertain,low,0,depression,0.5616,0.4384,0.5616,True,depression,,,s8-0658,159c0d09d6
low_confidence,Hồi đó ngày nào cũng cày trên ITV,uncertain,low,0,normal,0.5619,0.5619,0.4381,True,normal,,,s8-0659,132e317a65
low_confidence,Kyo yor chứ ai,uncertain,low,0,depression,0.5619,0.4381,0.5619,True,depression,,,s8-0660,40036ef573
low_confidence,"Bài này là sự kết thúc của một cuộc tình 2 năm trước , nhớ quá , nhớ cái đêm ngồi lủi thủi với bài nhạc này😢",uncertain,low,0,depression,0.562,0.438,0.562,True,depression,,,s8-0661,357e6fa10d
low_confidence,E chưa bao giờ hiểu được a yêu e cần e như thế nào...với a e là tất cả😥😥với e a chẳng là gì💔💔💔,uncertain,low,0,normal,0.5621,0.5621,0.4379,True,normal,,,s8-0662,f334640648
low_confidence,Nói người ta lừa hay già mà hám trai,uncertain,low,0,depression,0.5621,0.4379,0.5621,True,depression,,,s8-0663,b464302d5a
low_confidence,chẳng ông linh mục nào làm phép lạ ông diệp long ko làm phếp lạ mà chuyển lời cầu xin với chúa chỉ có chúa mới có quyền( chúa quyền năng phép màu) phép lạ là do chúa cho mới được...,uncertain,low,0,normal,0.5621,0.5621,0.4379,True,normal,,,s8-0664,ff046fb4f0
low_confidence,Tất cả ca khúc của chi cư như la dành riêng cho em. Đang thất tinh nghe khóc luôn,uncertain,low,0,normal,0.5622,0.5622,0.4378,True,normal,,,s8-0665,aa0c5674da
low_confidence,2024 có ai lâu lâu lại vào nghe không,uncertain,low,0,depression,0.5622,0.4378,0.5622,True,depression,,,s8-0666,ec81860d88
low_confidence,"Để có kinh nghiệm đối ứng thì phải có trải nghiệm, để có trả nghiệm chắc cũng phải mong cầu. Nó lại ngược với bớt mong cầu",uncertain,low,0,depression,0.5623,0.4377,0.5623,True,depression,,,s8-0667,bf21ae72ed
low_confidence,"Anh Dũng nói đúng , tại sao phải chạy theo mấy cái “rực rỡ” đó,nhiều người người ta chỉ cần cuộc sống của họ ổn là đã mừng lắm rồi.",uncertain,low,0,normal,0.5623,0.5623,0.4377,True,normal,,,s8-0668,8c505c24ab
low_confidence,Đcu lừa à?,uncertain,low,0,normal,0.5625,0.5625,0.4375,True,normal,,,s8-0669,eeac591615
low_confidence,"Sao samurice rời phê game,game on và vô lý,my bé đâu rồi các ông",uncertain,low,0,depression,0.5625,0.4375,0.5625,True,depression,,,s8-0670,c1c6c886b1
low_confidence,Cho dù giấy tờ hợp pháp nhưng chính là lừa đảo người cao tuổi là vi phạm pháp luật quy tội hình sự cần cơ quan pháp luật truy tố hình y,uncertain,low,0,depression,0.5626,0.4374,0.5626,True,depression,,,s8-0671,5e438921e4
low_confidence,biết bài này hơi muộn,uncertain,low,0,normal,0.5629,0.5629,0.4371,True,normal,,,s8-0672,137f7338b5
low_confidence,"Nhìn là biết hàng giả rồi, làm gì có xương người nguyên bộ như vậy tồn tại được",uncertain,low,0,normal,0.563,0.563,0.437,True,normal,,,s8-0673,1175c7b597
low_confidence,25/3/2026 ai còn nghe,uncertain,low,0,depression,0.5631,0.4369,0.5631,True,depression,,,s8-0674,ed349c7141
low_confidence,Cô vào rồi mà cũng Tom và Jerry Mà còn không chú ý dẫu vậy sao,uncertain,low,0,depression,0.5632,0.4368,0.5632,True,depression,,,s8-0675,d8eb78e890
low_confidence,hết lòng vì một người nhưng mình không là j trong mắt họ,uncertain,low,0,depression,0.5632,0.4368,0.5632,True,depression,,,s8-0676,afc284cc10
low_confidence,"Chiên da bảo lắc xe trước khi nổ máy xe, người dân làm theo, mắc mớ gì mời lên làm việc.Cái này quá đáng, ngưòi dân phải biết phản biện, không có gì phải sợ CA.Nó là đầy tớ nhân dân,ăn lương của dân.Bớt sợ đi bà con.",uncertain,low,0,normal,0.5632,0.5632,0.4368,True,normal,,,s8-0677,6839b087c8
low_confidence,"Bài hát ""Một mình"" là một tác phẩm đầy cảm xúc, kết hợp tuyệt vời giữa giọng hát mộng mị, sâu lắng của Bùi Lan Hương và tài viết lời đầy tinh tế của Bùi Công Nam. Ca từ được trau chuốt, nhẹ nhàng mà thấm đẫm nỗi cô đơn, như lời độc thoại của một người lạc lõng giữa những kỷ niệm cũ. Giai điệu chậm rãi, không quá phô trương nhưng lại khiến người nghe rung động từ những nốt đầu tiên. Đây không chỉ là một bài hát, mà là một mảnh cảm xúc rất thật – nơi người ta tìm thấy mình trong những phút yếu lòng nhất. Một lần nữa, Bùi Công Nam đã chứng minh anh là một trong những nhạc sĩ viết về nỗi cô đơn hay nhất hiện nay.",uncertain,low,1,normal,0.5633,0.5633,0.4367,True,normal,,,s8-0678,1daec54127
low_confidence,Không lên đổ dầu vào lửa cố gắng tu Đời còn dài tương lai còn rộng Sống trên đời để làm người ai có được cuộc sống tự do nhất là người hạnh phúc nhất,uncertain,low,0,normal,0.5633,0.5633,0.4367,True,normal,,,s8-0679,f3bf59d385
low_confidence,"Tội lỗi là do bà mẹ làm khổ con trai và còn dâu.tôi nghĩ ko trách con đâu.. vì nó yêu ck quá..bà khinh thường con đâu.hành hạ con đâu. Ham con đâu giàu về n9s xem thuòng bà ngày,hương nghèo biết chịu khó ,biết nhường nhị bà .thậm chí là còn chịu nhục..khổ thì chịu,nhưng nhục thì ko..quả báo của bà đâu ko.ngấm ko.thương Tuấn và hương,,đây là ba8f hoch cho những bà mẹ ck nào con coi thường con đâu thì hãy xem gương này nhé",uncertain,low,0,depression,0.5633,0.4367,0.5633,True,depression,,,s8-0680,a7cbb7a790
low_confidence,"Sao ở ngoài vui vẻ nhây gì đâu mà vô mood bài suy là suy cùng suy cực, người gì đâu mà lạ dị Anh Tú ơi",uncertain,low,0,depression,0.5634,0.4366,0.5634,True,depression,,,s8-0681,42a5bfedb9
low_confidence,chỉ là nhạc kpop thoi mà =))),uncertain,low,0,depression,0.5634,0.4366,0.5634,True,depression,,,s8-0682,d9e494cdb1
low_confidence,".......!!!. ai cũng đã từng như vây,,,!!!",uncertain,low,0,depression,0.5634,0.4366,0.5634,True,depression,,,s8-0683,98f504afd1
low_confidence,hoi tht nay hoi xua thi van chi bnhieu diem?,uncertain,low,0,normal,0.5635,0.5635,0.4365,True,normal,,,s8-0684,6dcfe50a72
low_confidence,Tôi cũng sẽ cố gắng để vào lớp 10 dù tiếng anh tôi yếu nhưng tôi sẽ cố gắng,uncertain,low,0,depression,0.5636,0.4364,0.5636,True,depression,,,s8-0685,d06b6830a5
low_confidence,"Nghe tùng dương hát 1 mình thì thấy bth chả có gì đặc sắc! Nhưng khi so kè, song ca cùng 1 ca sĩ khác, thì lại thấy khác biệt hoàn toàn! Chắc tại tai người bth như tôi ko biết cảm nhạc, ai có chung suy nghĩ ko?",uncertain,low,0,normal,0.5638,0.5638,0.4362,True,normal,,,s8-0686,d03b2a48d2
low_confidence,Hóng ra beat karaoke coevr mà không thấy,uncertain,low,0,normal,0.5639,0.5639,0.4361,True,normal,,,s8-0687,200fb7fb92
low_confidence,"nghe nhạc của họ ,nghe giọng của họ chứ không phải nghe ngóng về đời tư của họ.",uncertain,low,0,normal,0.5639,0.5639,0.4361,True,normal,,,s8-0688,fceb8ea242
low_confidence,Cái kết quá đau lòng đừng viết chuyện đau lòng vậy,uncertain,low,3,depression,0.564,0.436,0.564,True,depression,,,s8-0689,76822a6fc2
low_confidence,"Sao chuyện nào cũng giống nhau : con dâu làm nhiều tiền , còn mẹ chồng thì tai quái",uncertain,low,0,normal,0.564,0.564,0.436,True,normal,,,s8-0690,46bd84db15
low_confidence,"Cái j là của mình thì sẽ là của mình, còn ko thì hãy để nó ra đi trong yên bình. Thế giới ko hề khép lại mà chỉ lật sang trang mới cho chúng ta mà thôi.",uncertain,low,0,normal,0.5641,0.5641,0.4359,True,normal,,,s8-0691,42d8706747
low_confidence,Bài test mà bác nói kiếm ở đâu vậy admin ơi,uncertain,low,0,normal,0.5642,0.5642,0.4358,True,normal,,,s8-0692,b4c1319f5a
low_confidence,Rớt nước mắt 4:39,uncertain,low,0,normal,0.5642,0.5642,0.4358,True,normal,,,s8-0693,8f016fda0b
low_confidence,Còn ai nghe lại ko.,uncertain,low,0,normal,0.5642,0.5642,0.4358,True,normal,,,s8-0694,c04b8b436b
low_confidence,"Chuyện vớ vẩn lúc.đầu bảo là của ông vượng sau lại là con của Hùng"" chồng""",uncertain,low,0,depression,0.5642,0.4358,0.5642,True,depression,,,s8-0695,d14a6210f4
low_confidence,Loại người này có tài mà không có đức cũng vô dụng nha a Di Đà Phật ❤,uncertain,low,0,depression,0.5643,0.4357,0.5643,True,depression,,,s8-0696,c45d943e52
low_confidence,Moi người đừng tin những gì quảng cáo toàn là lừa người cái gì cũng uống nói bất chấp rồi người binh chết hay mất tiền cũng ko sao!,uncertain,low,0,depression,0.5643,0.4357,0.5643,True,depression,,,s8-0697,94e46449a3
low_confidence,Oh.. thật ra tôi không có bạn bè nào ngoài chính tôi bạn à,uncertain,low,0,depression,0.5643,0.4357,0.5643,True,depression,,,s8-0698,1d71ffa90b
low_confidence,cái gì vậy,uncertain,low,0,normal,0.5645,0.5645,0.4355,True,normal,,,s8-0699,015718dba2
low_confidence,Cx đã gần một năm rùi chúng ta ctay nhau sau ctay mk đã làm rất nhìu điều điên rồ để rồi khi năm hc mới đến mk đã k dám nhìn mặt cậu nx mk sợ hãi nhìu cái mk vẫn còn vương vấn cậu nhưng h đã nguôi đi nhìu phần r bây giờ mk cảm thấy bn mà mk vs mối quan hệ bb bth này thật tuyệt nhưng khi nghe một vài ng hỏi sao mk k mở lời lại liệu có quay lại k nhưng mk không có ý định đó bởi mk bt mối quan hệ hiện tại đã quá đủ rồi,uncertain,low,0,depression,0.5646,0.4354,0.5646,True,depression,,,s8-0700,bfe2e35a45
low_confidence,Tks. Nhưng mà ông ad cũng từng bị rồi đúng không ?,uncertain,low,0,normal,0.5648,0.5648,0.4352,True,normal,,,s8-0701,4e722490f7
low_confidence,rồi cuối cùng là chỉ chưa?,uncertain,low,0,normal,0.5648,0.5648,0.4352,True,normal,,,s8-0702,46161107a7
low_confidence,Giống hình phạt thời xưa,uncertain,low,0,depression,0.5649,0.4351,0.5649,True,depression,,,s8-0703,df32b482d9
low_confidence,Em đã bất tất cả cho anh rồi nhe😂😂😂😂😂cái,uncertain,low,0,normal,0.565,0.565,0.435,True,normal,,,s8-0704,e6fd23f3e0
low_confidence,E cần a giúp a giang ơi...e dag bệnh mún l.lac với a thì phải làm sao,uncertain,low,0,normal,0.565,0.565,0.435,True,normal,,,s8-0705,8e007d12b9
low_confidence,"NM nhu la mot diva Vietnam ở nuoc ngoai, rat đung nghia! Tu truoc den nay khi noi den chu diva o ben nay, ngươi ta khong phan ung vi không muốn noi gi…..cho den khi NM xuat hien!",uncertain,low,0,normal,0.5652,0.5652,0.4348,True,normal,,,s8-0706,da973fef9c
low_confidence,Thật sự quá bất công. Cha mẹ dầm mưa chờ con cái. Vậy còn con đực không ai chờ,uncertain,low,0,depression,0.5653,0.4347,0.5653,True,depression,,,s8-0707,e4786180b1
low_confidence,"Chắc chỉ là một phần nhỏ, mang tên"" cuốn vương"" =)))",uncertain,low,0,depression,0.5655,0.4345,0.5655,True,depression,,,s8-0708,d8e0ca7adc
low_confidence,Trẻ con nó biết gì đâu❌ Có dạy đâu mà nó biết✅,uncertain,low,0,normal,0.5655,0.5655,0.4345,True,normal,,,s8-0709,7962dbbdd4
low_confidence,"nếu là tôi là đx em trai thì tôi lơ luôn khỏi ôm ,bố mẹ gì đâu mà thiên vị",uncertain,low,0,normal,0.5655,0.5655,0.4345,True,normal,,,s8-0710,3233101abe
low_confidence,Trông chờ ck mới của HC từ sáng đến giờ ko uổng công đợi chờ,uncertain,low,0,depression,0.5656,0.4344,0.5656,True,depression,,,s8-0711,f7189e5e93
low_confidence,tại sao lại yêu đùa thì thắng yêu thật thì thua🥺,uncertain,low,0,depression,0.5656,0.4344,0.5656,True,depression,,,s8-0712,3d631869ad
low_confidence,đợi 26tiếng nữa là phát roii')) ad chơi lớn quá mà có điều chờ muốn mỏi luonn 🥲,uncertain,low,0,normal,0.5657,0.5657,0.4343,True,normal,,,s8-0713,a74a0c20c4
low_confidence,"Tất cả cũng vì cuộc sống mưu sinh thôi , làm gì cũng phải có thu nhập thôi. Video ko có quảng cáo thì chả ai làm vi deo cho mọi người xem cả, cũng như câu '' có thực mới vực được đạo ''",uncertain,low,0,depression,0.5658,0.4342,0.5658,True,depression,,,s8-0714,8e49f4af9b
low_confidence,Sqo gần đây cái zụ này nổi zợ,uncertain,low,0,depression,0.5658,0.4342,0.5658,True,depression,,,s8-0715,5bf0140f26
low_confidence,Những cánh tay của 9x đâu rồi,uncertain,low,0,normal,0.5658,0.5658,0.4342,True,normal,,,s8-0716,74e9e091b1
low_confidence,"Vài năm truớc , tôi có 1 chiếc điện thoại ,chỉ có thể lưu đuợc 200 tin nhắn bên trong là biết bao nhiêu hồi ức khó quên.mỗi lần đầy 200 tin đều phãi suy nghĩ lại rớt nhiều lần xem phãi bỏ đi cái nào . lúc đó chỉ muốn có 1 chiếc điện thoại có thể chứa đuợc 500 tin.. bây giờ tôi muốn có 1 chiếc điện thoại với bộ nhớ siêu lớn..NHƯNG KHÔNG TÌM ĐUỢC ..nguời có thể cùng tôi gửi 200 tin nhắn đó nửa !",uncertain,low,0,normal,0.5658,0.5658,0.4342,True,normal,,,s8-0717,53dfe1e6fa
low_confidence,Ông này không biết nói thế nào để mà bình luận về phẩm chất của ông này quá hâm,uncertain,low,0,depression,0.566,0.434,0.566,True,depression,,,s8-0718,f8b2ff8d54
low_confidence,Mong sớm tất cả mọi người cũng như mình vượt qua mọi khó khăn và nỗi đau đang phải chịu đựng,uncertain,low,0,depression,0.5661,0.4339,0.5661,True,depression,,,s8-0719,5cea3b33f9
low_confidence,"Hát khiếp thiệt, mà cười xỉu á.",normal_auto,medium,-2,normal,0.5661,0.5661,0.4339,True,normal,,,s8-0720,a7f5cbbb9f
low_confidence,"Tiền mà gửi mẹ chồng.??,",uncertain,low,0,normal,0.5662,0.5662,0.4338,True,normal,,,s8-0721,306580c115
low_confidence,L nhìn cái bản mặt thằng nhỏ kìa,uncertain,low,0,normal,0.5662,0.5662,0.4338,True,normal,,,s8-0722,d44957ae54
low_confidence,"3:30 Để có hạnh phúc thì bạn phải có sự giàu có (tiền bạc, điều tạo cho ta niềm vui là sk, thời gian...)",uncertain,low,0,depression,0.5664,0.4336,0.5664,True,depression,,,s8-0723,234bb800d9
low_confidence,"Nói thôi ô ah, thương cho roi cho vọt, dậy theo ô chúng nó ko có tình cảm đâu",uncertain,low,0,depression,0.5664,0.4336,0.5664,True,depression,,,s8-0724,441740b2e2
low_confidence,không biết ái không gặp nứt,uncertain,low,0,normal,0.5666,0.5666,0.4334,True,normal,,,s8-0725,db4cd7630b
low_confidence,14/11 ai còn nghe k ạ.điểm danh cái,uncertain,low,0,depression,0.5666,0.4334,0.5666,True,depression,,,s8-0726,609e588aa2
low_confidence,22 năm tôi vẫn còn nhớ một cuộc tình ngang trái,uncertain,low,0,depression,0.5667,0.4333,0.5667,True,depression,,,s8-0727,d02dc7bfa0
low_confidence,Chúng tôi mạng tuổi trẻ mạng sống của mình đi bao về tổ quốc trước giặc trung quốc xâm lược Việt Nam! Nam 79 tại mất trận lang son với 4 năm tu 80 toi 84 được 62 gom 1 báo hiểm ý tế và 4100 ngàn lính năm 2014 không được cộng nhận người có công bởi không chết không bị thương và cũng không là bệnh binh nên không được cộng nhận người có công mà chúng tôi chỉ là những kẻ ( không có công ) khí báo về tổ quốc Việt Nam! Thật vô lý thật bất công thật không cộng bằng nhe,uncertain,low,0,normal,0.5667,0.5667,0.4333,True,normal,,,s8-0728,5d3f27d97c
low_confidence,❤ nổi đau được chửa lành .giông tố sẽ qua đi ❤ biêt ơn cô Lanh,uncertain,low,0,normal,0.5667,0.5667,0.4333,True,normal,,,s8-0729,1fb8b10a33
low_confidence,Tôi chỉ muốn có ai chơi với tôi vì ko ai chơi với tôi ngta thì được chơi còn tôi thì chơi một mình,uncertain,low,0,normal,0.5668,0.5668,0.4332,True,normal,,,s8-0730,cefe885f36
low_confidence,cái thuốc đó k đắng thì cho bé uống trực tiếp luôn đi chớ có cần phải giả uống trà sữa k :)?,uncertain,low,0,normal,0.567,0.567,0.433,True,normal,,,s8-0731,49eba1d5f2
low_confidence,Quý Thiếu vì một người phụ một người..... Thật không xứng đáng có được hạnh phúc 😢,uncertain,low,0,normal,0.567,0.567,0.433,True,normal,,,s8-0732,0eda9bbbc6
low_confidence,Cuộc đời đáng tiếc khi chưa đủ năng lực... lại gặp được người mình muốn chăm sóc cả đời!!!!,uncertain,low,0,normal,0.567,0.567,0.433,True,normal,,,s8-0733,81e5e34cd1
low_confidence,"Đúng là đời lên xe, xuống chó chỉ như cái chớp mắt. Cho nên khi ở đỉnh cao của giàu sang, địa vị cũng hãy sống tử tế, nhân văn để khi gặp khó khăn còn có người quan tâm, giúp đỡ. Khổ thân câu kết Hào đã nghèo, giờ một ình phải cáng đáng một ông cha vợ đột quỵ, 1 đứa con bại não, không biết cậu ta phải xoay xở sao đây , giờ lại gánh món nợ 5 tỷ của ông bố vợ tàn phế. Không biết cậu ấy sẽ sống sao đây với gánh nặng này? Thương cậu Hào này thật, một con người sống rất tử tế, có tâm.Nếu người khác, họ mặc kệ ông bố vợ ngang ngược này. Đến khi ông ta thấy được cơ thể con rể đã vì mình mà tàn tạ làm việc kiếm tièn nuôi ông và trả nợ thay cho ông , ông có hối hận cũng muộn quá rồi,",uncertain,low,0,normal,0.5671,0.5671,0.4329,True,normal,,,s8-0734,bf18da697f
low_confidence,Bt về tầm quan trọng về sức khỏe tinh thần mà cải thiện đc hay k là chuyện khác😂😢,uncertain,low,0,depression,0.5671,0.4329,0.5671,True,depression,,,s8-0735,9cf08597fe
low_confidence,bad ass 1968 dodge charger,uncertain,low,0,depression,0.5672,0.4328,0.5672,True,depression,,,s8-0736,8a004a1143
low_confidence,"tớ k xứng với hi sinh của bố mẹ tớ. bố mẹ đã tự hào biết bao khi tớ đỗ đhoc, vậy mà mình chểnh mảng học hành, tạch môn, điểm thấp,.. chỉ tớ biết mình đã tụt dốc như nào. Tớ đang cố gắng để cải thiện và khắc phục những gì mình gây ra, chỉ hận bản thân đã chẳng cố gắng hết sức mình, đã ham chơi mà phụ lòng bố mẹ, tớ chẳng biết tương lai mình sẽ đi về đâu, nhưng mong một ngày nào đó tớ sẽ lại khiến bố mẹ tự hào và thấy sự hi sinh của mình xứng đáng. Cố lên nào!",uncertain,low,0,depression,0.5672,0.4328,0.5672,True,depression,,,s8-0737,62ef70c1c5
low_confidence,Em học được học sinh xuất sắc nhưng... vẫn bị phân chia với em họ😊☺,uncertain,low,0,normal,0.5674,0.5674,0.4326,True,normal,,,s8-0738,2db08272c8
low_confidence,Tuần sau thi môn phụ r tr =(,uncertain,low,0,depression,0.5674,0.4326,0.5674,True,depression,,,s8-0739,8b3a872bcc
low_confidence,"Dùng hành động, ý chí để tạo sản phảm làm thuyết phục người nghe và để đập vô mặt mấy thằng nhóc anti, nice",uncertain,low,0,normal,0.5675,0.5675,0.4325,True,normal,,,s8-0740,c662439554
low_confidence,Ai bảo là Hòa bình rồi..vẫn còn chiến tranh đấy chứ..😮😮😮,uncertain,low,0,depression,0.5676,0.4324,0.5676,True,depression,,,s8-0741,dc2d6f5d60
low_confidence,Tui chỉ để ý chị áo đen phía sau😂,uncertain,low,0,normal,0.5676,0.5676,0.4324,True,normal,,,s8-0742,ecd8833274
low_confidence,Tôi thì cái thứ ba là tôi phải ấy lực mạnh hơn chút tôi mới cảm nhận được,uncertain,low,0,depression,0.5677,0.4323,0.5677,True,depression,,,s8-0743,9d2a4e08a9
low_confidence,"Đã 1 năm rồi từ khi lần đầu nghe , mới đầu không hay nhưng qua vài ngày nó càng thấm dần , đôi khi nó là liều thuốc tinh thần giúp bản thân thêm vững mạnh",uncertain,low,0,normal,0.5677,0.5677,0.4323,True,normal,,,s8-0744,a3f197e457
low_confidence,Thêm roi😂😂,uncertain,low,0,depression,0.5679,0.4321,0.5679,True,depression,,,s8-0745,77e69391fe
low_confidence,Mỗi lần nghe bài này xong bị suy quá lại xem phỏng vấn Anh Tú Bùi Công Nam :))) nghe Tú nói tiếng Hàn cười sảng luôn :)))),uncertain,low,0,depression,0.5679,0.4321,0.5679,True,depression,,,s8-0746,bef9cd1a8f
low_confidence,"Nó làm bên nước ngoài bao nhiêu tiền đều gửi giữ giúp vì tin người nhà, vậy mà khi về thì không trả tiền còn thách thức....",uncertain,low,0,depression,0.5681,0.4319,0.5681,True,depression,,,s8-0747,56595d3105
low_confidence,7 năm rồi mới nghe lại bài nhạc,uncertain,low,0,depression,0.5681,0.4319,0.5681,True,depression,,,s8-0748,717214d804
low_confidence,Vẽ cái này chỉ có Què tay lun😂😂,uncertain,low,0,depression,0.5682,0.4318,0.5682,True,depression,,,s8-0749,fbddaf108d
source_uncertain,"Đâu nhất thiết phải xử 1 trong 2 đâu, xử cả 2 cũng đc mà😂😂😂",uncertain,low,0,normal,0.7,0.7,0.3,True,normal,,,s8-0750,e4897d6db9
source_uncertain,Awesome control man lol,uncertain,low,0,normal,0.7001,0.7001,0.2999,True,normal,,,s8-0751,f44ef75f1e
source_uncertain,Và sau đó hai cậu này yêu nhau?:),uncertain,low,0,depression,0.7001,0.2999,0.7001,True,depression,,,s8-0752,cc283e5107
source_uncertain,Chị tú tài vụ việc đang làm gì khi bị mất nước do chủ đầu sẽ được phát hiện ra rồi kìa anh ấy y học cổ đại đã được phát hành trái phiếu của công dân có 🙂‍↕️ có thể làm cho người dùng không ý là không có ản xuất xứ Việt nam đã có,uncertain,low,0,depression,0.7002,0.2998,0.7002,True,depression,,,s8-0753,6e63f6ddea
source_uncertain,Nghe mải nghe mãi rồi. Chỉ là ko biết khi nào thì hết thời. 5/1/2019,uncertain,low,0,depression,0.7002,0.2998,0.7002,True,depression,,,s8-0754,2db869713b
source_uncertain,"Quay 3 lần , 2 lần đầu chắc 1 với 2 ;))",uncertain,low,0,depression,0.7004,0.2996,0.7004,True,depression,,,s8-0755,9da3e74b12
source_uncertain,Xem clip cười chết được nhưng sau khi hết phim lòng sao nặng trũi...,uncertain,low,0,normal,0.7004,0.7004,0.2996,True,normal,,,s8-0756,ac777f34ad
source_uncertain,Cho cô hỏi melatonin mua ở đâu,uncertain,low,0,normal,0.7005,0.7005,0.2995,True,normal,,,s8-0757,ddacc483b9
source_uncertain,Mà xếp thứ 24 của lớp,uncertain,low,0,normal,0.7005,0.7005,0.2995,True,normal,,,s8-0758,41cc4f8580
source_uncertain,"Tôi bị ù tai 1 bên tôi chữa hết thuốc tây, thuốc ta, tất cả các bệnh viện từ cơ sở đến TW đều vô dụng có ai có bí quyết gì chữa khỏi ù tai hãy cho tôi biết xin hậu tạ......",uncertain,low,0,depression,0.7005,0.2995,0.7005,True,depression,,,s8-0759,1480d1291a
source_uncertain,"Theo mình, có nhiều phương diện để đánh giá một cuộc đời đáng sống. Với mình, mình vạch ra một vài tiêu chí thế này: - Học - gặp đúng thầy, đúng bạn, đúng sách - Làm - gặp đúng sếp, làm đúng năng lực - Yêu - gặp đúng người, đúng thời điểm Không tập trung quá nhiều vào vật chất, tiền bạc Vun bồi những điều có ích và buông xả hết những điều tiêu cực.",uncertain,low,0,normal,0.7006,0.7006,0.2994,True,normal,,,s8-0760,fa24c86922
source_uncertain,Sổ bạn viết gọi là sổ gì vậy ạaa,uncertain,low,0,normal,0.7007,0.7007,0.2993,True,normal,,,s8-0761,e0945a2dc6
