review_bucket,comment_text,source_weak_label,source_confidence,source_depression_score,phobert_label,probability,prob_normal,prob_depression,need_review,suggested_label,final_label,reviewer_note,row_id,text_hash
weak_model_disagreement,Hay quá những lời nói ai cũng biết. Phải lì đòn lắm mới lên nói những lời chung chung mà người khác ko dám nói vì ko có gì mới.,normal_auto,medium,-2,depression,0.5036,0.4964,0.5036,True,depression,,,s8-0000,83e46f575a
weak_model_disagreement,"Bai nay hay qua,nghe ma tuong minh đang that tinh.",normal_auto,medium,-2,depression,0.5104,0.4896,0.5104,True,depression,,,s8-0001,80af04117d
weak_model_disagreement,"video này đã đăng vào 1 năm trước, em tìm được trong lúc bản thân cũng đang mắc kẹt ở chính tâm trạng của mình, một sự trùng hợp có sắp xếp để gặp chị giang :p",normal_auto,medium,-2,depression,0.517,0.483,0.517,True,depression,,,s8-0002,f0f5dc38fc
weak_model_disagreement,"-Chúc mọi người nghe nhạc vui vẻ : -Lyric : Ver 1 : Tiếng còi xe vang lên inh ỏi vỗ vai đánh thức phút trầm lắng Phố đã lên đèn chỉ muốn bon chen kịp về tới nhà đủ bình xăng Trong túi đếm còn vài đồng bạc lẻ chỉ đủ lót bụng cho bữa ăn tối Khi lương tháng như giọt cà phê có lẽ ngày mai phải vay mượn rồi… Đời công nhân, kiếp làm thuê… không có tiền chẳng ai nể Lặn lội tới đất sài thành dành dụm từng tí để gửi về quê Bao nhiêu điều còn dang dở chỉ biết thở dài rồi để đó Thực sự hôm nay người mệt mỏi lắm lỡ có gục ngã cũng mình tự lo Về căn trọ dù chật hẹp nhưng vẫn là không gian riêng Thả lỏng thân xác đang còn nặng nề với bao nỗi niềm chưa lên tiếng Muốn làm thằng nhỏ chạy nhảy rong chơi Mình đẫm mồ hôi nhưng vẫn thích Còn mồ hôi của hiện tại cứ thấm vị đắng hơi cay mù mịt Nhốt bản thân giữa bốn bức tường dẫu biết cô đơn sẽ làm rơi lệ… Muốn cách ly khỏi sự ồn ào trên tấm chiếu manh cho lưng mọc rễ Con đường đi tới thành công không có dấu chân của sự lười nhác Nhưng cho bản thân lười nhác hôm nay, vì tâm bủn rủn trước sự ngột ngạt Hook : Muốn buông bỏ cái nôi mệt mỏi nhưng mà cuộc sống không cho phép Đồng tiền thống trị tất cả mọi thứ nên tiếp cận nó mình còn hạn hẹp Đời vẫn còn đẹp nếu bản thân còn… sống thật với con người thật Chỉ mong suy tư hãy tới vừa đủ để lại ngày mai ta được thức giấc ( x2 ) Ver 2 : Năm tháng thì vẫn cứ rộng dặn lòng ráng sống nơi miền đất lạ Nơi xứ người lặn lội bương trải một hai đừng bước tới chuyện quá xa Giờ muốn lắm một sự quan tâm dù có nhỏ nhoi nhưng vẫn đủ ấm Chỉ đơn giản một câu hỏi han cần chỉ sướt mướt nhưng vẫn đủ thấm Nếu được chọn ẩn mình trong hoa… thì chỉ muốn thành hoa xương rồng Có thể chống nhiều thứ khắc nghiệt mặc kệ bão tố hay là mưa giông Sông dù nông hay là sâu động lực gia đình chắc tay lái… Cho dù cuộc sống đôi lúc thu hẹp nhưng vẫn không muốn phải mắc lòng ai Nhiều lúc người ta không hiểu… phán thẳng ta không biết điều Miệng đời là những con dao sắc bén thôi kệ không thích nói nhiều Chuyện tình cảm… hay tình nghĩa… nếu cảm thấy được thì ta tới Sống cho bản thân không phải thiên hạ nên cũng buông lơi cho đời thảnh thơi Muốn nghỉ ngơi nhưng tâm lại động… bao nỗi niềm còn đang chất đống Muốn xỏa hết cho đầu này trống đón luồng gió lộng nhưng trời lại giông Ta buông tay giữa màn đêm tối chỉ ta mới biết tay nằm ở đâu Cũng chỉ là ta điều khiển bàn tay nên thôi cũng cố lao vào bể dâu Hook : Muốn buông bỏ cái nôi mệt mỏi nhưng mà cuộc sống không cho phép Đồng tiền thống trị tất cả mọi thứ nên tiếp cận nó mình còn hạn hẹp Đời vẫn còn đẹp nếu bản thân còn… sống thật với con người thật Chỉ mong suy tư hãy tới vừa đủ để lại ngày mai ta được thức giấc ( x2 )",depression_auto,medium,6,normal,0.5195,0.5195,0.4805,True,normal,,,s8-0003,19912efab8
weak_model_disagreement,Khúc cuối buồn cười xỉu 🤣🤣🤣,normal_auto,medium,-2,depression,0.5292,0.4708,0.5292,True,depression,,,s8-0004,dfdbca62ec
weak_model_disagreement,minh cung tram cam nang co cgiay xac nhan ne nhung o len khon nạn o nen do thua cho benh tat,depression_auto,medium,5,normal,0.5322,0.5322,0.4678,True,normal,,,s8-0005,93410ba5b9
weak_model_disagreement,Đừng hỏi:” 2020 còn ai xem không” vì chúng ta vẫn luôn ở đây và nghe bài này,normal_auto,medium,-2,depression,0.5363,0.4637,0.5363,True,depression,,,s8-0006,15ec43d081
weak_model_disagreement,Nếu bạn bắt đầu nhìn video ở chân thì sẽ thấy quay theo chiều kim đồng hồ. Còn bạn nhìn trên phần đầu thì sẽ thấy ngược kim đồng hồ. Nhưng phải nhìn từ đầu video.,normal_auto,medium,-2,depression,0.5375,0.4625,0.5375,True,depression,,,s8-0007,f89f30b14c
weak_model_disagreement,"Hồi lớp 5 e có đi thi một vài cuộc thi về tin học của tỉnh và e thấy ""ủa sao nó dễ vậy?"" xong đến lớp 6 lớp 7 lớp 8 e trở nên rụt rè hơn bao giờ hết lúc giơ tay phát biểu hay thuyết trình cũng vậy lúc đó e mới tự hỏi ""ủa sao hồi nhỏ mình đi thi 2 3 năm liền vẫn ko sao mà ta"" đến lúc đó e mới nhận ra là mình đang thật sự quá nhút nhát năm nay e lớp 9 nhờ xem được vd của a mà e đã có can đảm đi thi hsg 1 lần nữa cảm ơn a vì những đóng góp cho xã hội này",normal_auto,medium,-2,depression,0.54,0.46,0.54,True,depression,,,s8-0008,ada141aebd
weak_model_disagreement,"Trung hoa dân quốc có trước cộng hoà nhân dân trung hoa, Đài Loan là phần còn lại của Trung hoa dân quốc và không cần tuyên bố độc lập vì nó đã độc lập.",normal_auto,medium,-2,depression,0.5412,0.4588,0.5412,True,depression,,,s8-0009,1e31e929ae
weak_model_disagreement,Bác Sĩ ơi Em vừa thấy quả cầu di chuyển nhẹ và không có chuyển động thì là sao ạ 🥺,normal_auto,medium,-2,depression,0.5425,0.4575,0.5425,True,depression,,,s8-0010,06ae2a9220
weak_model_disagreement,"30/07/02024 Thầy thật sự là cứu rỗi cho cuộc đời con ạ, mỗi lần con cho đen trầm cảm quay trở lại thì con lại mở video của thầy lên nghe, và khi giọng thầy cất lên thì tâm hồn con trở nên nhẹ nhõm. Cầu mong cho sự bình an trong tâm hồn để không phải mãi đi tìm nữa",depression_auto,medium,5,normal,0.5439,0.5439,0.4561,True,normal,,,s8-0011,9569d98e28
weak_model_disagreement,Ông ad hiểu biết ghê ha. Đài loan là ngta kêu cho vui. Nó là trung hoa dân quốc. 1 trong 5 nước thường trực của liên hiệp quốc. Sau trung cộng hối lộ cướp cái ghế đó. Trước thập niên 70 cái chính quyền của tập cận bình có ghế thường trực ko. Tìm hiểu trước khi nói. Thằng đài loan bạn nói nó tuyên bố chủ quyền cả cái nước trung hoa. Nhưng do thua trận nó kiểm soát dc đảo đài loan. Chính quyền tưởng giới thạch chưa sụp đổ.,normal_auto,medium,-2,depression,0.5489,0.4511,0.5489,True,depression,,,s8-0012,973dd9b8fe
weak_model_disagreement,Mình cũng suy nghi rất nhiều. Rất muốn chết luôn nhưng mà mình vẫn còn thương em mình lắm. K biết nói với ai cha mẹ k bảo giờ hiểu và nghe mình,depression_auto,medium,5,normal,0.5491,0.5491,0.4509,True,normal,,,s8-0013,62f75341f2
weak_model_disagreement,Có loại người như vậy thật đó bạn _khi đi chơi ở Phú quốc 3 ngày...vào quán cafe (Đắng) tại Dương Đông...cách trước cửa quán 5m..tôi nhặt cái bóp (ví) cộm tiên..đếm đại khái tiền giấy 500n trên 30 tờ...và tiền nhỏ hơn(ko đếm ?)..và 7 tờ 100 dollar..cùng giấy xe..bằng lái (ko thấy CMND) thời còn CMND _Vào quán..tôi gọi tên trên giấy...có Anh kia hỏi (sao biết tên tôi ?)..và đối chiếu mặt và trong ảnh bằng lái..tôi thấy giống nhau..nên tôi nói đã nhặt trước quán..đưa lại cho Anh ta nguyên vẹn cái bóp (ví)..Anh ta mở ra xem..xong gấp lại..bỏ vào túi quần dài _ko thèm nói cám ơn..hay 1 câu gì đó..cho có chút nhân văn trong cuộc sống _và lần đầu trong đời..tôi biết loại người (máu lạnh cá sấu)..là có thật..kể cả lúc mình đem lợi ích đến cho họ ?,normal_auto,medium,-2,depression,0.5502,0.4498,0.5502,True,depression,,,s8-0014,06cb85a406
weak_model_disagreement,"Video nội dung rất hay, nhưng nguyên nhân chính của bệnh này k phải do mxh và internet - vốn chỉ làm nó nặng lên thôi, mà là do cách gia đình nuôi dạy từ nhỏ + những chấn thương tâm lý gặp trong đời",normal_auto,medium,-2,depression,0.5511,0.4489,0.5511,True,depression,,,s8-0015,07d2ecd2bd
weak_model_disagreement,Không thích quản cáo xen vào bạn ơi,normal_auto,medium,-2,depression,0.5519,0.4481,0.5519,True,depression,,,s8-0016,ab61e51609
weak_model_disagreement,"Bài này làm tôi nhớ đến một lần vô tình gặp cô bạn thân trên đường, ánh đèn đường rọi lên bóng hình mảnh khảnh ấy, một tay cầm đôi cao gót, chân trần đi trên đường. Đôi chân nhỏ bước đi nhẹ nhàng, tấm lưng thẳng tắp, tự tin mà đi mặc người dòm ngó, tôi còn thấy cô ấy mỉm cười nhẹ nhàng, không chút lo âu như thể ánh nhìn của người ngoài chẳng thể nào ảnh hưởng đến cô ấy. Lúc đó tự nhiên cảm thấy ngưỡng mộ, mấy ai có thể tự nhiên bỏ ngoài tai lời bàn tán từ bên ngoài, tự tin mà sống theo cách mình muốn chứ.",depression_auto,medium,6,normal,0.5526,0.5526,0.4474,True,normal,,,s8-0017,caf2a8e396
weak_model_disagreement,"Nội dung rất hay, đúng lúc mình cần. Phải ghim cái suy nghĩ chỉ tập trung vào những điều mình có thể kiểm soát nên đầu ghi chú để đọc mỗi ngày. Cuộc sống đôi khi rối tung nên làm quên đi những thứ quan trọng và làm mình căng thẳng lo lắng",normal_auto,medium,-2,depression,0.5544,0.4456,0.5544,True,depression,,,s8-0018,b84a8c9988
weak_model_disagreement,Tôi tập bài hít thở mỗi ngày cam on kim ba,normal_auto,medium,-2,depression,0.5595,0.4405,0.5595,True,depression,,,s8-0019,35c0fd291c
weak_model_disagreement,"Chào Bố ! Vậy là từ giờ phút này trở đi con không được nhìn thấy Bố nữa rồi .Đến tận bây giờ con vẫn hối hận nhiều lắm Bố à . Năm nay con học năm cuối rồi cũng 4 năm xa nhà , con về nhà rất ít kể từ khi con lên Hà Nội . Con xin lỗi bố và con cũng ân hận rất nhiều vì không về nhà nhiều hơn để giờ con về đã không có Bố nữa rồi . Mẹ giờ ở 1 mình buồn lắm bố à . Con thực sự xin lỗi và ân hận rất nhiều chưa thể lo cho bố mẹ 1 chút nào vậy mà giờ đây bố đã đi xa rồi . Con rất biết ơn bố mặc dù tới tận giờ con chưa một lần được nói mạnh dạn “ con cảm ơn bố “ Bố ở nơi phương xa phù hộ cho mẹ mạnh khỏe và các con con yêu bố nhiều lắm Gửi con trai : Con à lúc ba viết lời này là lúc ba 22 tuổi, con sinh ra là điều vô cùng quý giá nhất của cuộc đời Ba , Nhưng ông nội mất rồi sau này con phải thật yêu thương Bà Nội nhé , Ba sẽ làm tất cả vì con , Ba yêu con lắm Mình Đức con trai của Ba ! Bố mẹ đến với nhau sinh ra con , Ba cũng có nhiều Hoài bão nhiều dự định nhưng giờ có lẽ Ba sẽ phải chậm lại 1 nhịp để có thể lo cho con và Mẹ vì gia đình nhỏ này ! Điều này chưa bao giờ làm Ba hối hận cả . Nếu sau này con lớn con nghe được bài này và thấy cmt này bà mong con hãy yêu thương mẹ nhiều hơn vì mẹ đã vất vả vì con . Yêu con lắm Minh Đức (Bonka)",normal_auto,medium,-2,depression,0.5597,0.4403,0.5597,True,depression,,,s8-0020,d87b0bff73
weak_model_disagreement,Phim bố già rồi từ từ mng sẽ quên dần. Nhưng bài hát này của PMQ thì chắc chắn sẽ không bao giờ bị lãng quên.,depression_auto,medium,5,normal,0.5606,0.5606,0.4394,True,normal,,,s8-0021,79eed19067
weak_model_disagreement,"Em mới chia tay được vài tuần. Vài tuần qua em nghe đi nghe lại video này của chị không biết bao lần chỉ để tạm thời tự xoa dịu nỗi đau của bản thân. Đến ngày hnay em nghĩ mình đã đến bước 3, em oà khóc nhiều hơn những ngày trước, rồi ngồi nghe lại video này 1 lần nữa, bình tĩnh tự cảm nhận và chấp nhận nỗi buồn của mình, và thấy nhẹ nhõm hơn. Những ngày tháng tới chắc em vẫn chưa thoát ra được khỏi nỗi buồn ngay, nhưng em cảm thấy bản thân không cô độc bởi có chị ở đây gửi cho nhx người như em lời khuyên rất chân thành và cảm thông. Em cảm ơn chị nhiều. Gửi những người đang tan vỡ vì tình yêu, hãy tin rằng những ngày tháng khó khăn này sẽ qua thôi, cùng mạnh mẽ đối diện và vượt qua để tìm thấy bình yên cho bản thân nhé 💕",normal_auto,medium,-2,depression,0.562,0.438,0.562,True,depression,,,s8-0022,67a9661180
weak_model_disagreement,Mình là chính mình chứ không thể là nhân vật nhân vật Nó cũng có tư cách riêng của mình và mình cũng phải có tư cách riêng của mình chứ không thể nào nói theo giọng dễ thương của nhân vật nhiều quá Xong rồi quên mất cái giọng của mình rồi sau đó ba mẹ mình cũng sẽ không nhận ra mình đâu,normal_auto,medium,-2,depression,0.5648,0.4352,0.5648,True,depression,,,s8-0023,33e011d291
weak_model_disagreement,Cảm ợn Better Version 🥰🥰🥰,normal_auto,medium,-2,depression,0.5701,0.4299,0.5701,True,depression,,,s8-0024,feb7715670
weak_model_disagreement,nghe mà lòng đau từng quặng :( Gigi quá đỉnh!,normal_auto,medium,-2,depression,0.5779,0.4221,0.5779,True,depression,,,s8-0025,3ff58ba1d7
weak_model_disagreement,"Tự nhiên k có động lực như trước K còn đam mê, kể cả đã từng rất thích Ủ rũ, cáu kỉnh vs ng thân. Khó khăn vs cảm xúc Bỏ bê chăm sóc bản thân so vs trước kia Kiệt sức khác lười biếng",depression_auto,medium,6,normal,0.581,0.581,0.419,True,normal,,,s8-0026,a1dad10e84
weak_model_disagreement,"1. Đừng cam chịu, thẳng thắn chia sẻ với nhau.Mình muốn gì thì cứ nói ra. 2. Chia sẻ việc nhà và nuôi con. 3.Học cách chung sống hòa hợp với mọi người xung quanh, không phán xét, thật thà. 4. Học cách giải phóng cảm xúc tiêu cực, chữa lành, nhìn người khác với con mắt yêu thương. 5.Đừng bỏ quên bản thân mình. Chăm nom, quan tâm cơ thể và tinh thần của mình hơn. CẢM ƠN CÔ LANH RẤT NHIỀU.",normal_auto,medium,-2,depression,0.5812,0.4188,0.5812,True,depression,,,s8-0027,a5fdad3f37
weak_model_disagreement,ừ ba t cx kh cho t đóng cửa trừ khi thay quần áo,normal_auto,medium,-2,depression,0.5818,0.4182,0.5818,True,depression,,,s8-0028,b69953e944
weak_model_disagreement,Chi ơi..e khô wá..em cang cô gắng..cang nặng thêm.. lúc nao cung chi muon tu tư thôi..,depression_auto,medium,5,normal,0.5854,0.5854,0.4146,True,normal,,,s8-0029,81354198ea
weak_model_disagreement,cảm ơn nhạc của bạn nhiều 🤗 nhiều lúc trông chuyện tình cảm mình muốn làm họ vui thì họ bảo mình còn trẻ con quan tâm thì họ xem như rát mà vứt đi còn họ đâu hiểu cảm giác của mình trông lúc đó ra làm sao đâu mình buồn hay vui họ cũng xem như kh có chuyện gì 🤗,normal_auto,medium,-2,depression,0.5908,0.4092,0.5908,True,depression,,,s8-0030,28bde54304
weak_model_disagreement,"C1: dùng hoạt động thể chất thay thế hoạt động MXH C2: bảo vệ giờ vàng (lúc thức dậy + 3 tiếng) C3: hoạt động sinh lý thay thế tâm lý - Chạy tầm 10p xung quanh nhà - Nghe nhạc beat nhanh (150 beat pop music) - Đầu giờ trưa, nghe trước khi lv.",normal_auto,medium,-2,depression,0.5954,0.4046,0.5954,True,depression,,,s8-0031,a0380da3af
weak_model_disagreement,Nhưng hồi năm đó làm j có thiết bị hiện đại vậy thì ai đã lái?,normal_auto,medium,-2,depression,0.6007,0.3993,0.6007,True,depression,,,s8-0032,a37a9105ab
weak_model_disagreement,Nghe thay giang mà tīnh ngô läy lai tinh thän cam on thay chuc thsy mk binh an .,normal_auto,medium,-2,depression,0.6039,0.3961,0.6039,True,depression,,,s8-0033,b3ea5cd14e
weak_model_disagreement,Mô phật bài gián này rất hay nhưng mình từng cho đi và thâm hỏi khi mình khi có chuyện không ai hỏi và thậm có những lúc buồn cho số phận mam mô a Di Đà Phật mieng tâm an lạc là hạnh phúc tâm từ bi không phiền ai hết mình nghĩ đây là no kiếp trước giờ buồn thì khổ thân nên gũi tâm an lạc là hạnh phúc mô phật,normal_auto,medium,-2,depression,0.6059,0.3941,0.6059,True,depression,,,s8-0034,f1c56130ca
weak_model_disagreement,"Ông làm video này không hiểu gì về vấn đề Đài Loan cả. Chả có cái nào gọi là nước Đài Loan, Đài Loan chỉ là một hòn đảo thuộc Trung Hoa Dân Quốc (tuyên bố chủ quyền toàn bộ lãnh thổ TQ).",normal_auto,medium,-2,depression,0.6075,0.3925,0.6075,True,depression,,,s8-0035,698d8019f2
weak_model_disagreement,"Tóm tắt video: *Có 3 hiểu lầm khi lắng nghe: Lắng nghe là người lép vế hơn: Người lắng nghe là người kiểm soát câu chuyện Lắng nghe là ngồi im: nếu ko đưa ra dc ý kiến Lắng nghe trong mọi trường hợp giống y như nhau *Có 4 kiểu lắng nghe: Lắng nghe để thưởng thức: Tập trung vào việc thưởng thức, ví dụ như âm nhạc( thường là những thứ liên quan đến nghệ thuật)... Lắng nghe để học hỏi: bao gồm viêc biết m đã hiểu vẫn đề hay chưa và đưa ra ví dụ, Lắng nghe để đồng cảm: chia sẻ để biết người nói đang ( có cảm xúc gì) vì gặp vấn đề nào đó,..., Lắng nghe để đánh giá: liên quan đến teamwork , thảo luận=> đưa ra quan điểm và giải thích hoặc bổ sung cho ý kiến cho người nói",normal_auto,medium,-2,depression,0.609,0.391,0.609,True,depression,,,s8-0036,e98c08307e
weak_model_disagreement,"Thì cái gì cũng từ từ chứ ,chậm mà chắc bạn phải học thêm tính kiên nhẫn nửa rồi!",depression_auto,medium,5,normal,0.6104,0.6104,0.3896,True,normal,,,s8-0037,f6cf8605b5
weak_model_disagreement,"Mình cũng từng là những người đc mn tung hô, ngưỡng mộ như một idol thực thụ. Từ việc có thể cày từ 10-20 đề toán trong 1 buổi tối, làm cái nào đúng cái đó, giải được những bài khó nhất, từng rất yêu môn toán, đâm mê vs chúng. Nhưng từ khi mình chuyển cấp , mmìnhddax sa sút môn toán trầm trọng, k còn đam mê nx, mình trở nên ghét toán, ghét làm toán, bỏ bê môn toán và chẳng bgio oon nó nx....Nh bio, mik đã là1 hs chuyên văn, mik rất yêu quý môn văn ...",normal_auto,medium,-2,depression,0.6158,0.3842,0.6158,True,depression,,,s8-0038,9b838a3ee6
weak_model_disagreement,"Mong anh có thể làm video về thực trạng ""ptsd"" và nguyên nhân dẫn đến chúng ạ (em trai của em mới 13t nhưng em ấy lại có biểu hiện của ptsd nên em cũng hơi lo ạ)",normal_auto,medium,-2,depression,0.625,0.375,0.625,True,depression,,,s8-0039,e979bf21f6
weak_model_disagreement,"[Lời bài hát ""NGƯỜI NHƯ ANH XỨNG ĐÁNG CÔ ĐƠN""] Verse 1: Ánh sáng tắt đi, chẳng để lại thứ gì Cuối cùng mọi cố gắng chỉ là vứt đi Tìm trong ký ức vẫn còn, bờ vai môi son Từng ở bên anh, từng nằm tay anh Trí nhớ khắc sâu, ngày đôi ta mất nhau Bất lực anh trôi vào trong nỗi đau Chẳng gì có thể xứng đáng lấp đầy Khoảng trời em buông tay nơi đây Bước chân như ngã quỵ Chấp nhận ta chia ly Chorus: Phải chăng anh đã lỡ đến sớm Một vài kiếp người để yêu em? Phải chăng duyên chúng ta phải chấp nhận Đường đi của sô phận không thể phạm sai ý trời Giữ em một chút trước lúc xa hơn Trời làm gió từng cơn Có lẽ người như anh Chỉ xứng đáng cô đơn Verse 2: Giấu nước mắt đi nhanh khi đứng trước em Lấy hết cả dũng khí để buông tay em Anh không sao, anh không sao đâu mà Chỉ là lòng chật chội về đêm Vì chịu đựng nỗi nhớ về em Bao lâu nay anh đã nói dối lòng mình rằng thật sự anh đã quên em Bao lâu nay anh đã cố phớt lờ mọi cảm xúc không nguôi về chính em Làm sao để đối diện đây? Làm sao để mở lời đây? Hay là anh phải đi xa Đi về nơi mà không có chúng ta Bridge: Một mùa hạ ôn như có khiến giấc mơ Yêu em được kéo dài thêm? Chìm mình vào mưa đêm liệu tim anh thôi nhức nhối? (Kết cục hôm nay sẽ mãi không thay đổi Câu chuyện của chúng ta phải dừng ở đây thôi) Đành chia đôi rẽ lối (Tự thân gặm nhấm những ngày tháng lầm lỗi Lẳng lặng ngược dòng hoa trôi) *Mình anh trong bóng tối* Chorus: Phải chăng anh đã lỡ đến sớm Một vài kiếp người để yêu em? Phải chăng duyên chúng ta phải chấp nhận Đường đi của sô phận không thể phạm sai ý trời Giữ em một chút trước lúc xa hơn (Trái tim em muốn giữ lại) Cơn đau không thể bớt đi hơn Có lẽ người như anh (hooh-ooh) Chỉ xứng đáng cô đơn Có lẽ người như anh Chỉ xứng đáng cô đơn",depression_auto,medium,6,normal,0.6359,0.6359,0.3641,True,normal,,,s8-0040,495e661da9
weak_model_disagreement,Nói chung bà mẹ này cũng chưa hoàn toàn thương yêu con mình còn 2 đua con thì cũng chưa thực sự hiếu thảo với mẹ nhưng nếu 2 con của bà năm giành nhiều thời gian cho mẹ thì bà năm cũng ko hành động như vậy nhưng nếu di chúc cho con út 3 tỉ còn lại cho 2 con mỗi đua 1 tỉ còn giữ lại cho mình là hợp lí còn người giúp việc họ chăm sóc những họ đã hướng lượng nếu tốt chỉ có thể tăng lương cho họ là hợp lí hơn,normal_auto,medium,-2,depression,0.6406,0.3594,0.6406,True,depression,,,s8-0041,e99a826771
weak_model_disagreement,Đầu năm 2018 rồi có ai còn nghe lại không .. Nhớ cái lần đầu tiên nghe bài này khi nhận đc tn ct mọi thứ trong tôi chấm dứt buồn và đâu khổ nh khi muốn chết Thế giờ đã 2 năm rồi hì nhanh thật ... mối tình đâu của tôi... giờ nta có ng mới rồi..nhưng e đâu có biết tôi vẵn yêu em như ngày nào .. từng ngày từng giờ từng năm tôi vẵn mong e ql vs tôi... nhưng đều đó khó qá e nhỉ ... thôi thì chúc em hp ng con gái tôi yêu 08/01/1999,depression_auto,medium,5,normal,0.6462,0.6462,0.3538,True,normal,,,s8-0042,842941bfeb
weak_model_disagreement,Đài loan thù nước nào coi nó là quốc gia thì sẽ kêu là đài loan ví dụ như mỹ v.v còn mà theo liên hợp quốc thì sẽ kêu nó là đài bắc trung hoa Bình luận xong thấy hả liên quan mà thôi kệ 🐧,normal_auto,medium,-2,depression,0.6479,0.3521,0.6479,True,depression,,,s8-0043,647de4ce9c
