comment_text,label,source,weight
"em mới có gần 12 tuổi thôi ạ. Dôi khi em cảm thấy em thật ngu ngốc, tại sao một con người như em lại có thể sống trên đời cơ chứ. Nhiều lúc chờ cả nhà ngủ hết r một mình lăn ra khóc đến gần 1,2 h sáng. Em đã từng là một cô bé năng động và vui tươi. Em rất thích đi chơi cùng mọi người và ra thăm bà. Nhưng bỗng một ngày em lại bắt đầu sợ hãi về việc đi chơi và thăm mọi người. Em sợ những lời khen và chê của mọi người về em. Đôi lúc em có cãi nhau với chị và hỗn láo với bố mẹ nhưng em ko thật sự muốn điều đó. Em cảm thấy thật sự mệt mỏi với cuộc sống. Em đã rất nhiều lần lên sân thượng nhưng ... Em đã thật sự rất mệt mỏi. Em đã rất mệt r. :(",1,phobert_v2_confident,1
"Tôi cũng trăm cảm khi lúc con tôi mất,có thể mệt mỏi,",1,weak_high_conf,2
"Là cha, mình sẽ nghe lại video này ít nhất hai lần nữa, cảm ơn TS Lê Nguyên Phương, chị Thùy Minh và cảm ơn Vietcetera. Đặc biệt là về vấn đề tự hại và tự tử của người trẻ, trước tác động của môi trường giáo dục cạnh tranh và áp lực từ sự không thấu hiểu từ phụ huynh. Đoạn đó thực sự mình đã nổi hết da gà. Sợ nhất là lúc mình quá bận rộn/mệt mỏi, mình sẽ có lúc chợt nghĩ, vấn đề của con quá nhỏ, so với vấn đề của mình hiện tại, và nói là hạt mầm của sự vô tâm và một vết sứt trong sợi dây kết nối với con cái. Lúc bình thường, vết nứt ấy quá nhỏ, nhưng lúc kéo căng ra, vết sứt nhỏ ấy, sẽ xé toạc đi sợi dây kết nối. Mọi câu mình nói với con thường là: con nên, con phải, con cần... Cảm ơn về những món quà của cuộc sống và cảm ơn Have a sip về góc nhìn để mình quay đầu nhìn lại và trân quý món quá mình đã và đang có.",1,weak_high_conf,2
Xem lại rồi mà không chán,0,phobert_v2_confident,1
"Thật sự .. cháu là 1 hs c2 l lớp 8 nữ Gđ cháu kh dc vẹn toàn và đôi lúc có 1 số vấn đề cảm thấy xấu hổ vì mẹ trước các bạn, đôi khi chỉ mong mẹ thông cảm và hiểu cho. Áp lực thi cử, điểm số, bị mn xì xào bàn tán vì mẹ bỏ theo trai, yêu sớm, bị chê về ngoại hình,... dần biến cháu thành 1 ng tiêu cực và khép mình. Chưa bao h cháu dám nặng lời với các bạn hay sợ mình làm thế này kh hài lòng các bạn, kh ai hiểu cháu cả và chính cháu cũng vậy. Trước đây cháu học rất giỏi nhưng overthinking khiến cháu khép mình lại vì quá nhạy cảm , tự ti... và giờ thì thật sự cháu chẳng muốn thi vào 10 Xin lời khuyên từ cô ạ chứ h cháu chẳng muốn vận hành j nữa Gần như buông xuôi , phó mặc cho cuộc đời định đoạt ạ😔😮‍💨😕",1,weak_high_conf,2
"Em đang là học sinh lớp 12 và tâm trạng cực kỳ tệ. Em thực sự rất ghét bản thân mình đến nỗi em không muốn bản thân mình tồn tại vì mình làm gì cũng tệ. Em vì ảnh hưởng tâm lý từ hồi nhỏ, vì muốn lúc nào cũng bằng bạn bằng bè nên đến lúc điểm em luôn thấp hơn so với những sự nỗ lực em bỏ ra, em chán ngấy đến mức không biết mình thực sự có nỗ lực không hay 5 6 tiếng mình học là vô dụng. Đến lúc ấy, em lại cảm giác muốn chết. Chết đi thì bản thân em sẽ không khóc mỗi ngày nữa, chết đi thì em không lấy bản thân để so sánh người khác",1,weak_high_conf,2
Tiếng nhỏ quá ad,0,phobert_v2_confident,1
Đi dúng giầy không sợ đau chân Chọn đúng bạn không lo đau đầu Yêu đúng người không lo đau tim Ai thấy đúng xin 1 like 1 sub,0,phobert_v2_confident,1
Giống ta cứ giảm được cân lại ăn ngon mấy bữa lại hòa có khi còn tăng hơn 😅,0,phobert_v2_confident,1
Chuyện thật như đùa ùng hộ anh sâm ủng hộ em chúc em có cuộc sống hp,0,phobert_v2_confident,1
Ai đang nằm bên bạn con ma chứ ai😢😢😢,0,phobert_v2_confident,1
"Áp lực đại học còn nhiều hơn Phụ huynh còn thường xuyên so sánh chúng ta với ngươi khác Vì vậy ko công bằng Khi nghỉ hè Trẻ em phải học he Có vài đứa trẻ còn phải tự tử Vì quá nhiều nhiều nhiều áp lực Khi trẻ em muốn được một món đồ nhỏ nhoi Cha mẹ ko chịu Hiện nay , cha mẹ chỉ biết nói mấy cái câu trên mạng : trẻ em dưới 15 tuổi xem đt sẽ phải đi tù Tại sao cha mẹ lại như vậy ?cha mẹ chưa bao giờ như thế , nhưng vì sao khi đi học lại thay đổi ? Cha Mẹ Ơi... Trẻ Em Giờ Khổ Quá ... Cha Mẹ Ơi.... Chúng con có phải là con ruột của cha mẹ ko , cha mẹ?",1,weak_high_conf,2
Anh có phải là dv tring phim thời tới cản không kịp ko anh,0,human_gold,3
Bài này bây giờ Anh Jack là nhất .,0,phobert_v2_confident,1
Rất hay xin cám ơn Huynh nhiều,0,weak_high_conf,2
"healing mah broken heart so well c Min ơi huhu, nhạc tình mà nghe xong khóc lun",0,phobert_v2_confident,1
Tôi cũng là một người cô đơn 🥹🥹🥹,1,phobert_v2_confident,1
"Có những lúc cảm thấy trầm cảm vô cùng , có những lúc nghĩ tới cái chết , nhưng bản thân lại nhắc nhở còn sống là còn nước còn tát , nên mình vẫn quyết định sống . Một phần là mình vẫn rất yêu đời và sợ chết nữa :)))",1,phobert_v2_confident,1
Ai cx có ước mơ chỉ cần ko ngừng lỗ lực cố gắng thì chúng ta sẽ đạt đc nó thôi Mãi là tri kỷ của anh Huy ❤️😍😍,0,phobert_v2_confident,1
Xin hãy viết dựa vào những những gì mà tác giả có ý định lúc ban đầu; tại sao lại hỏi đến các phiên bản; người đọc biết rằng chuyện viết là hư cấu thôi.,0,human_gold,3
Lớn lên mong đc bắt tay anh hẹn anh nha !,0,phobert_v2_confident,1
Nhiều lúc k nghĩ ra câu gì nói hết á,1,phobert_v2_confident,1
"Mk yêu 1 ng rối loạn chức năng kiểm soát cảm xúc, trầm cảm , hưng cảm. Mk đã đấu tranh nội tâm rất nhiều, đã từng rời đi vì k chịu đc áp lực nhưng r bọn mk lại quay lại, lần này mk cố gắng hơn , thay đổi bản thân để ở bên ng ấy, mk k tức giận nx, k đổ cảm xúc tiêu cực cho ng ấy nx, cố gắng giữ cảm xúc ổn định khi có cãi vã để k lm b ấy tổn thương, để lm trụ tinh thần cho b ấy như cách b ấy từng lm vs mk, nma cuối cùng vẫn k ở bên nhau đc. Chúng mk k tự lo đc cho bản thân tốt nên k thể hạnh phúc khi bên nhau",1,weak_high_conf,2
"Mình nghĩ hầu hết mọi người khi nghe bài này đều nghĩ về chuyện tình yêu hợp tan, chia tay các thứ...Còn bản thân mình lại thấy bài này như dành cho những người đã mất đi người thân yêu nhất. Bố mình mới mất năm nay, không có ngày nào là mình không nhớ bố. Nghe bài này mình ngẫm nghĩ từng câu chữ một, lại càng thêm nhớ bố. ""Thời gian sẽ chữa lành mọi vết thương"" nhưng có lẽ nỗi đau, nỗi nhớ người thân đã mất thì không bao giờ có thể chữa lành.....",0,phobert_v2_confident,1
"Hay quá , cảm ơn Đinh Đoàn nhiều!",0,weak_high_conf,2
cảm ơn a Tun và a Long chung đã tâm sự để em bớt được chút nỗi lòng nào ^^,0,phobert_v2_confident,1
"Cách đây 1 năm về trước. Tôi có một người bạn, nhưng người bạn của tôi bị áp lực học tập. Ba mẹ của người bạn ấy, rất là muốn thành tích tốt mà trong khi người bạn đó chỉ toàn bộ là được học sinh khá, rất ít thành tích tốt, và gần như không có xuất sắc. Thế là chuyện gì cũng đến. Người ấy bất đầu suy sụp hoàn toàn, nhưng tôi đã có ở đó để an ủi khiến tin thần ổn hơn nhiều. Khi ngày thi đã đến bọn tôi nhóm có 4 người bắt đầu ôn bài, và cả nhóm chia sẻ đáp án cho nhau. Và cuối cùng tôi được giỏi, còn tất cả người còn lại cũng giỏi nhưng người ấy chỉ có 9,5 rất cao nhưng khi về tôi thấy ba mẹ la cậu ấy và nói : '' 0,5 điểm nữa đâu? '' khoảnh khắc ấy khiến tôi hoàn toàn hoảng. Mà những ngày thi tiếp theo tôi không thấy cậu ấy nữa... Khi 5 ngày sau đó cả lớp bắt đầu nhận được tin người đó đột tử. Vì thức khuya quá mức làm từ 8h-2 luôn. Tới khi xe cấp cứu đến thì đã quá muộn người mẹ và ba của cậu ấy không nhận ra lỗi của mình rồi còn nói : * nó giả chết để nghỉ học đấy! * tới khi được cứu thì đã quá muộn. Thế là từ đó kế bên tôi không còn ai tôi còn bị cả lớp phó trừ điểm nhưng tôi chả làm gì sai cả. Tôi chỉ đi giặt khăn thôi mà...thế là tôi Đã quá mức nên tôi đã chuyển trường thế là từ đó tôi bắt đầu câm thù lớp của mình vì họ chả quan tâm tôi chả ai quan tâm tới cái chết của bạn tôi thế là tôi chỉ còn nước tìm bạn mới thôi...",1,weak_high_conf,2
"Con bị mất con, áp lực từ cs ở nhà chồng và công việc làm con thấy nghẹt thở. Luôn cảm thấy cô đơn. Và như bị mọi người chán ghét. Mặc dù con biết con k làm gì sai trái. Đã vài lần stress quá mà tự làm mình thương. Mong rằng tất cả chúng ta sẽ vượt qua tất cả. Ngày mai sẽ là 1 ngày mới.",1,weak_high_conf,2
Ko văn nào tả hết về bà được,0,phobert_v2_confident,1
Tôi mất ngủ 20ng rồi một ngày đêm chỉ ngủ được 1.5h cả đêm chăn trọc vậy uống thóc gì phụ hơn tuổi 61tuôi,1,phobert_v2_confident,1
Liên Khúc Nhạc Trẻ Buồn Thất Tình Hay Nhất 2026 - Càng Nghe Càng Thấm,0,phobert_v2_confident,1
"vừa mới ctay ngy 2 năm vì lý do ngy mình du học, nghe cảm giác giống như chuyện của 2 đứa mình, ngẫm thật sự",0,phobert_v2_confident,1
"Con thành tâm tri ân Thầy, nhờ mấy tháng nay con nghe được các bài giảng Pháp của Thầy, và thực tập quay vào bên trong, thư giản, mà con tạm thời vững hơn, con là người bị tổn thương tâm hồn mình, bị trầm cảm hơn 10 năm, con đã dùng thuốc rối loạn lo âu thật nhiều, bác sĩ đã từng cảnh báo con uống nhiều quá ko tốt cho thần kinh não bộ, con rất mong được đến khóa tu tập thiền hiểu biết của Thầy ạ,",1,weak_high_conf,2
mình đang bị trầm cảm từ áp lực công việc,1,weak_high_conf,2
"Trc mình đi khám bác sĩ tâm lý, ngta bảo mình bị trầm cảm khá nặng và đưa ra nhiều lời khuyên. Bây h mình cx đang cố thay đổi, tưởng khó nhg thật ra cx dễ lắm, qtrong nhất là thích ứng thôi, h thấy tâm trạng tốt hơn nhiều r 😆😆",1,phobert_v2_confident,1
"Ở VN gần như đứa trẻ nào cũng có tổn thương về gia đình, mình k ở nc ngoài bh nên k biết họ thế nào. Bản thân mình cũng phải tự nhìn lại bản thân, đọc nhiều sách dạy con (mà đọc những quyển đấy mình thấy đứa trẻ đang bị tổn thương trong mình nhiều hơn), dạy mình, với mong muốn con mình sẽ k gặp phải toxic parents, k phải trải qua những cảm xúc tiêu cực đến muốn tự tử như mình. Có 1 quyển sách của Nhật ""Mẹ cáu giận, con hư hỏng"" mà mọi cha mẹ nào cũng nên đọc một lần.",1,weak_high_conf,2
Xem xong MV mình thật sự rất cảm động. Không chỉ bởi vì nội dung kịch bản và giọng hát của Trung Quân mà còn là vì sự đầu tư chỉn chu và tâm huyết của ekip. Hơn cả những gì mình mong đợi đối với phần 2. Cảm ơn Trung Quân và ekip đã làm ra những sản phẩm tuyệt vời như thế này.,0,weak_high_conf,2
"Remix chán vl,ngang phè phè.",0,phobert_v2_confident,1
Mình vô tình tìm thấy video này ở mục đề xuất. Nó đến đúng lúc mình đang khổ sở với chính suy nghĩ của bản thân. Cảm ơn tác giả và ad rất nhiều vì đã tạo ra một video có ích với tôi và nhiều người ở đây nhé🌱🪴🍀,0,phobert_v2_confident,1
Đỉnh cao của công nghệ,0,phobert_v2_confident,1
"Trời ơi âm nhạc quá hay, chất lượng MV quá đỉnh❤",0,phobert_v2_confident,1
bài của chị cam thật sự siêu ý nghĩa bị mê ấy,0,phobert_v2_confident,1
Vi deo hay chuẩn lắm cháu oi,0,phobert_v2_confident,1
"Năm nay là năm mà mk áp lực nhất, từ việc học đến bạn bè. Nhiều khi mk còn muốn lấy dao tự tử nhưg nghĩ tới mẹ cha tốn tiền nuôi mk mà mk lại tự tử ko đền đáp côg ơn thì lại ko dám",1,weak_high_conf,2
"Một vài ngày nữa là em đã sắp bước sang tuổi 19 r … Thật sự khi xem vd này của chị thì em thật sự đã nhìn lại . Em học dc thêm nhiều điều và nhìn lại những điều bản thân đã tự học dc Em thật sự rất cảm ơn chị , một vd thật ý nghĩa ạ",0,weak_high_conf,2
Bạn ra tiếp đi hay :),0,phobert_v2_confident,1
lâu lâu nó còn chụp cho cái mũ nhân quyền với tự do tôn giáo,0,phobert_v2_confident,1
Sao bài này hay dữ mà giờ tui mới biết trời.,0,phobert_v2_confident,1
Chuẩn nhìu lc tập qài mà chân ko to đc tui đành thốt lên 2 chữ dm vì qá bất lực 😅,1,phobert_v2_confident,1
Cảm ơn Mẫu Đơn review phim tình cảm rất hay nam 9 Trần Chính Dương đóng chung với Quách Vũ Hân rất tuyệt vời❤❤❤❤❤❤❤❤,0,weak_high_conf,2
Đã rất nhiều khi chán nản hay bế tắc rối bời con đều tìm nghe những bài thầy giảng. Biết ơn thầy! Con tâm niệm sẽ tự tu tập tinh tấn qua những lời giảng Phật pháp của Thầy.,1,weak_high_conf,2
"Bây giờ là 23:25 ngày 24/11/2020, ai có nghe lại thì điểm danh nha 💞",0,phobert_v2_confident,1
Tui mới 17 tuổi nhưng lại gặp tình trạng như khủng hoảng tuổi 20 không biết phải làm sao bây giờ,1,phobert_v2_confident,1
Thích nge nhạc 8x 9x vì nó hay nge mãi không bao giờ chán.,0,phobert_v2_confident,1
Cám ơn a đã chia xẻ cho ai mất ngủ,0,phobert_v2_confident,1
Đại ca đẹp trai phết,0,phobert_v2_confident,1
"Rất nhiều thời điểm trong cuộc sống khiến mình nản lòng và buông xuôi, nên mình tìm động lực và sự can đảm từ những người truyền cảm hứng. Cảm ơn Vy, hy vọng Vy sẽ tiếp tục ra những video bổ ích 🎉🎉🎉",0,weak_high_conf,2
Cố lên Hùng ơi. Mày nhất định làm được. Sau này bất cứ lúc nào mày nản chí thì hãy quay lại đây và nhìn những dòng chữ mày đã viết ở đây nhé. 17/02/2024 - Một buổi chiều thứ 7 thật tuyệt vời!,0,weak_high_conf,2
"Mình uống hai viên thuốc giảm đau xong rồi nghe,ko biết tại thuốc hay tại nghe mà ngủ một giấc đến sáng luôn 😂,xin cảm ơn ❤",0,human_gold,3
"Đúng là cô đơn k muốn về nhà, một ngôi nhà với nối sống càng im lặng càng tốt . K trọn vẹn tình yêu thương của bme. Mẹ ruột mất khi còn nhỏ ,bố đi bước nữa. Giữa gd với nhau nhưng lại rất hiếm khi quây quần. Lớn lên trưởng thành thì phải bươn chải sự đời , rồi dòng đời xô đẩy nghiệt ngã quá đã cướp mất b. Những ngày cuối cùng b chỉ nghe bài này , lúc ấy t k hiểu hết ý nghĩa lời hát . Đến nay khi chuyện đã xảy ra t mới nhận ra rằng b đã mệt mỏi , và kiên cường như thế nào trong khoảng thời gian khó khăn ấy. Giá như , giá như một lần thôi ...... T ước giá như một lần quay lại thời gian ấy sẽ hiểu b nhiều hơn nữa để k có những chuyện đau lòng như bây giờ. Sắp một tháng kể từ ngày b mất t k lúc nào k nghĩ đến b. Có lẽ đây là cứ sốc lớn nhất với t , đầu t hiện tại cũng chỉ muốn lặp lại chuyện của b thôi. Nhảy xuống cái cầu ấy mới hiểu hết cảm giác như thế nào b à . T hiện tại đang chơi vơi , k biết lm j, k biết nghĩ j. Ngoài việc tự tử theo b",1,weak_high_conf,2
gầy gò :))) nói thế chịu r,0,phobert_v2_confident,1
Bố vào cài đặt ứng dụng kiểu Con trai của ta 😈😈😈,0,phobert_v2_confident,1
mong rằng những thứ sắp tới sẽ suôn sẻ hơn 😢 nhìu áp lực quá hồi nhỏ mún lớn thật nhanh để đc này dc kia ai ngờ lớn lên thất vọng hg kịp 🤦 kh ngờ mik lại lm những chuyện xấu hổ đến lm 1 chuyện mà nguyên trường big lời nói ngoài kia đầy ác ý sao con có thể chịu nổi đây chứ nhìu lần mún kthuc thật nhanh mà lại nghĩ tới gđ😢,1,phobert_v2_confident,1
Em chỉ bị mất ngủ và chẩn đoán hỗn hợp trầm cảm và rối loạn lo âu vậy bệnh em chữa khỏi k ạ nếu điều trị thì bao lâu khỏi ạ,1,weak_high_conf,2
Tay phải e không đua ra sau nam lấy trái được gấp người về trước e cung không làm được 😢,0,phobert_v2_confident,1
Anh nguyên đã hát hay rồi mà bà yến cũng hát hay đúng là người yêu của ca sĩ nổi tiếng mà😊😊😊😊❤,0,phobert_v2_confident,1
"T thật sự rất bất lực trc hoàn cảnh cuộc đời của mình. Thiếu tiền, thiếu tình đã lm cuộc đời tớ bào mòn sinh lực,tinh thần lm cho mình ko còn suy nghĩ gì cả, đều nghĩ đến ý định kết thúc cuộc đời bi thương đầy xót thương nhưng mình ko thể lm đc điều đấy,vì mình vẫn còn niềm tin vào thế giới này,vẫn tin vẫn chờ vào một cuộc gặp gỡ có thể lm thay đổi hoàn toàn cuộc đời mình vào năm mình 18 tuổi đầy giông bão nhưng mình vẫn tự tin mình sẽ đứng vững trc cơn giông bão của xã hội đầy khốc liệt😭😭",1,weak_high_conf,2
Mí bạn có thấy cảnh này quen ko 👍,0,phobert_v2_confident,1
10/10 thảo nào lúc nào tui cũng thấy khó chịu trong người😢,1,phobert_v2_confident,1
Hay qua luôn Hiếu Organ ui,0,phobert_v2_confident,1
"🤣 con bé đó nói là, khi nào anh kiếm đủ tiền xóa hết hình xăm trên người thì em sẽ cưới anh. Tiệm họ báo giá xóa hình xăm cậu ấy hết 2 tỷ 😂",0,human_gold,3
😭😭😭😭 tui cx bị thất tình tui mệt quá muốn 44 mà sợ đau,1,phobert_v2_confident,1
"Hay quá anh, mỗi lần tâm trí chênh vênh lại xem được video của anh, đây không phải lần đầu, và chắc chắn sẽ có một vài lần nữa. Cảm ơn anh rất nhiều, lại được thư giãn và tiếp động lực rồi, mong video này còn mãi đến năm em 200 tuổi, mỗi năm xem 1 2 lần, gửi anh 400 views kk @@",1,human_gold,3
Trước đây mình cũng bị bắt nạt nhưng giờ hết rồi ba tôi là hiệu trưởng của trường😅😂😊,0,phobert_v2_confident,1
e vừa nhận kết quả phân chuyên ngành và nó vào hải quan . e ko bt mk chọn đúng hay sai nữa:(((,0,human_gold,3
Chúc Dũng và các anh em Cter năm mới may mắn vui vẻ 🎇🧨🎊,0,phobert_v2_confident,1
Mới đây đã 3 năm nhanh thật Nhớ lúc trước mình còn trên chỗ chú đạt võ quay video,0,phobert_v2_confident,1
"Hôm nay Lâm hát ở HN, liên khúc Bolero với Mai Thiên Vân. Quá ngọt ngào luôn. Idol mãi đỉnh",0,phobert_v2_confident,1
Đc bài hát .cuộc sống vô nghĩa này hay về đoi ý nghĩa.@,1,weak_high_conf,2
"mình cũng từng trượt chuyên và bị bố chì triết cả tháng hè khiến mình suy sụp, dù khi đó mình ko có mục tiêu học chuyên vì nó xa nhà. nhưng việc bố mẹ kì vọng nhiều vào mình và khi không được như ý thì quay ra trù ẻo trách móc để lại 1 vết thương lớn với tớ. đến khi thi đại học tớ quyết tâm ôn thi vào NEU vì đó là trường t thích, khi ấy chỉ còn 1 tháng trước thi đại học mà tớ mất gốc toán lý, máu liều vùi đầu vào ôn và cuối cùng lên được 8 điểm 2 môn đó. tổng điểm của mình cao hơn những bạn cùng lớp cũ từng đỗ chuyên, và cao nhất khối trường mình. Nghĩ lại thấy cũng may vì sau khi trượt chuyên mình ko mất niềm tin vào bản thân mà càng quyết tâm đỗ đại học, cũng ko nghĩ là mình có thể có cú lội ngược dòng như vậy. giờ thì mình đã ra trường và trường chuyên giờ chỉ còn là dĩ vãng, ko còn là thứ khiến mình tự ti và đố kị nữa rùi",1,weak_high_conf,2
"Cuộc sống đôi khi nặng nề đến mức ta chỉ muốn buông xuôi, nhưng chính trong những giây phút mệt mỏi ấy, lời Phật dạy lại như ngọn đèn soi sáng tâm hồn. Phật dạy rằng khổ đau vốn là một phần tất yếu của đời người, nhưng khổ không phải để ta gục ngã, mà để ta học cách tỉnh thức, nhận diện và buông bỏ. Khi tâm còn vướng bận tham – sân – si, ta tự tạo ra xiềng xích cho chính mình; còn khi biết quay về với hơi thở, sống chánh niệm và thấu hiểu vô thường, ta sẽ tìm thấy sự an yên giữa phong ba. Mệt mỏi không đến để dập tắt ta, mà để nhắc ta rằng: đã đến lúc dừng lại, lắng nghe và chữa lành. Và rồi, ta nhận ra hạnh phúc không ở đâu xa, mà hiện diện trong chính sự tĩnh lặng và bình an nơi tâm mình.",1,weak_high_conf,2
"Có 1 thực tế ở quê mình những cháu thi trượt cấp 3 rất nhiều. Và chỉ có duy nhất 1 trường cấp 3 đã trượt thì nghỉ luôn. Còn học trường nghề thì càng khó quản lí Cho nên rất rất nhiều cháu lêu lỏng. Chưa đủ tuổi đi làm, suy nghĩ thì chưa tới, chưa đủ chín chắn. rất dễ là tệ nạn, vi phạm pl.",0,phobert_v2_confident,1
"Mình bất lực khi thấy chame bị ngt khinh thường, bất lực khi mình vẫn đag đi hc nên kh giúp gì cho ba mẹ, bất lực khi thấy ba mẹ ngày một nhìu tuổi, bất lực khi không đạt được kết quả mình mong muốn trong hc tập, mình bất lực trước sự kỳ vọng của bame, bất lực khi nhìn thấy những người bn mình từng rất thân dần trở nên xa lạ, mình bất lực khi nghĩ đến tương lai phía trước của mình, bất lực khi bản thân suy nghĩ quá nhiều, bất lực khi sức khỏe mình yếu kh được khoẻ mạnh..",1,phobert_v2_confident,1
Quá cảm xúc và hay 👍,0,phobert_v2_confident,1
"Em đang nghe bài hát này trong một sáng chủ nhật cảm xúc trống không. Cảm ơn anh Luân mang lại một bài hát đầy cảm xúc, chạm đến trái tim người nghe. Lúc đoạn rap phát lên em đã khóc, có lẽ ở đâu đó thấy được bản thân mình trong đó, mọi sự do dự của bản thân làm mất đi mối quan hệ thật sự quan trọng mà sau này không bao giờ tìm lại được nữa. Chúc mừng anh ra một bài hát tuyệt vời, hi vọng sẽ có nhiều người biết đến bài hát này. Chúc anh thành công hơn nữa.♥️",0,weak_high_conf,2
Tập truyện mê nhất từ trước tới giờ cụa toi😂🫠,0,phobert_v2_confident,1
Sao tui thấy bùn c ứ c vậy,0,phobert_v2_confident,1
Hay.ok❤,0,phobert_v2_confident,1
