comment_text,label,source,weight
"Tôi có cảm giác buồn và luôn lảng tránh người xung quanh, cảm thấy không có đủ năng lượng khi làm một nhẹ cũng cảm giác thở gấp mặc dù tôi 70kg. Và cũng luôn nghĩ đến mình sống mệt thế này thì chết đi có thể bớt khổ hơn, nhưng chỉ nghĩ nhiều về điều đó thôi còn không thực sự muốn, bất lực nhất là cảm giác mình thiếu năng lượng làm có chút việc nhẹ mà tay chân cứ run và thở tim đập nhanh, nhưng luôn che giấu ko muốn người khác chú ý đến những điểm đó của mình, luôn luôn lạm dụng bia rượu để cho mình mạnh mẽ hơn",1,phobert_v2_confident,1
Kẻ săn lùng hồn hài nhi à😊,0,phobert_v2_confident,1
Mất ngủ hai năm rồi ko dây phút nào được yên giấc chỉ mong một phút ngủ ngon thôi mà ko thể nào có được nhiều lần nghĩ đến tự tự vì sông ko bằng chết,1,weak_high_conf,2
Cô Rachel cứ vô tư tôi rất mến cô với cách nói chuyện dễ thương và thông minh dễ thương không nên để tâm vào những lời phê bình nhớ mọn đó có thể là ghen ghét ❤,0,phobert_v2_confident,1
I might just start playing forsaken again so i can play as teto two-time,0,phobert_v2_confident,1
"""FROM JAPAN WITH LOVE"" ""TOP 1 TRENDING YOUTOBE""",0,phobert_v2_confident,1
50 cầu chuyện hay và sâu sắc.. cám ơn Kênh đã sưu tầm & chia sẻ ❤️🌹,0,phobert_v2_confident,1
Mình gặp hết các triệu chứng ở trên và mình bị 5 nâm rồi giờ mình bớt cở 80%,1,phobert_v2_confident,1
"luôn cảm thấy có lỗi, mất động lực, khóc trc gương mỗi ngày trước khi đi làm ...",1,phobert_v2_confident,1
"Em đã xem cái video này 2y trước ngay khi anh ra và like rồi. Nhưng hôm nay 13/9/2025 em xem lại và nó thực sự ý nghĩa với em. Ko hiểu sao video này lại nhảy sang lúc em xem xong 1 video khác của kênh khác (em vừa bật auto chuyển video trước đó). Em rất thích đoạn anh nói những ngã rẽ bất ngờ khiến chúng ta có những bộ kĩ năng rất đặc biệt làm chúng ta unique độc đáo, khi không giống với những người đi đường thẳng. Em cũng đang thấy mình phải đi vòng vèo hết nơi nọ đến nơi kia, học đủ thứ rồi đập đi xây lại dù ở bất cứ đâu em cũng cố gắng hết sức. Em tin là video của anh là thông điệp của Vũ Trụ nhắc rằng em đang đi đúng đường, và con đường mình khác với số đông không có nghĩa là mình không đến được đích. Có lẽ đích đến của em cũng khác với mọi người 😊 Cảm ơn anh và hy vọng anh sẽ có ít video cũng được nhưng cái nào cũng chất như nước cất anh nhé",0,weak_high_conf,2
Ngày chia tay 😔,0,phobert_v2_confident,1
"Câu truyện của Bác nó bạc ,nhưng rất có giá trị cho xã hội ,một bài học cho những ai đang bạc bẽo với gđ vợ,con.",0,human_gold,3
Con dâu giống mẹ quá ❤,0,phobert_v2_confident,1
"Bây giờ coi lại mới biết ""nhà cháu ở chân đồi, có giàn thiên lý, cò người cháu yêu""",0,phobert_v2_confident,1
Đúng tâm trạng.... Mới chia tay người yêu.....,0,phobert_v2_confident,1
Tôi bị trầm cảm 2 năm rồi,1,phobert_v2_confident,1
cám ơn bạn rất nhiều,0,phobert_v2_confident,1
Tôi sợ bố mẹ già đi.. Lại sắp đón tết rồi. Nỗi sợ lại đến. Không như lúc bé đến tết rất vui.. Áp lực cuộc sống quá mn ơi!,1,phobert_v2_confident,1
"Sun làm video về những người trầm tính, ít nói đi ạ :(",0,phobert_v2_confident,1
"Mik cx vài lần bị thất tình, nhưng mik đã buông bỏ ,mik rất đâu v ng ấy đã phản bội mik",1,phobert_v2_confident,1
năm mới chúc chú Dũng luôn luôn mạnh khỏe và hạnh phúc.,0,human_gold,3
Trầm cảm khủng khiếp lắm các bạn ạ.. vượt qua đc nó thì nỗi đau tinh thần và di chứng ảnh hưởng sk cũng rất nặng nề,1,phobert_v2_confident,1
Xin chào buổi tối chương trình chúc chương trình luôn thành công trên con đường âm nhạc mình đã chọn tôi cảm ơn chương trình đả chia xẻ bài nhạc của người cho tôi rất thích,0,phobert_v2_confident,1
Mỗi ngày kênh ra một video được không ạ😢Thật sự giờ chỉ có kênh này cứu rỗi được linh hồn của tôi.Đời nó chó😂,0,phobert_v2_confident,1
😮 tôi đang bị như vậy😮❤ nhưng mà tôi đâu có trầm cảm đâu❤,1,phobert_v2_confident,1
"Tui ở Úc tập lần 2 thôi là ngủ , ngày nào tui cũng tập 2 lần trước khi ngủ rất hay , cám ơn cháu rất nhiều",0,weak_high_conf,2
ตามมาจากติ้กต้อกเลย,0,phobert_v2_confident,1
Cũng 4 5 tháng nay rồi mình từng bị 1 cú sốc lớn kể từ đó mình sợ tiếp xúc sợ nc vs ng quen gặp ng lạ đi qua là chạy vô nhà ko dám nhìn ng khác chỉ biết cầm đt chơi game và nằm trong phòng ... Đến bây h chẵng biết làm sao để khắc phục để giao tiếp vs ng xung quanh nữa lo lắng lắmm 😞,1,phobert_v2_confident,1
"Thật sự là bài hát lần này hay quá Nam ơi! Ma mị, chút giằng xé, đơn độc, day dứt,... Thực sự ca từ của Nam cùng với giọng hát của BLHlà sự kết hợp quá tuyệt vời",0,weak_high_conf,2
Xin cam on bạn nhieu nhé,0,phobert_v2_confident,1
hãy làm call of the night,0,human_gold,3
Nam mo quan the am bo tat cuu kho cuu nang,0,phobert_v2_confident,1
"Tưởng rằng vô nghĩa nhưng không hẳn vậy, với tâm trạng suy tư tích cực , nghị lực kiên cường người nghe cũng được truyền cảm hứng, mình rất thích bài hát này.",1,weak_high_conf,2
con nuoi con nho chi 1 minh nen con mat ngu rat nhieu ngay . con muon bi tram cam luon vay do . con rat kho ngu co cach nao giup con nhanh vao giac ngu dc kg ah xin cam on ah,1,phobert_v2_confident,1
Quảng cáo nhiều quá 😅 30:14,0,phobert_v2_confident,1
Trúc Nhân,0,phobert_v2_confident,1
Nó áp lực lắm Nó mệt mỏi Nó tốn nước mắt lắm Nó làm e khóc nhiều lắm e chỉ muốn chet,1,weak_high_conf,2
Bác sỹ nói tiếng miền Nam dễ thương quá.,0,phobert_v2_confident,1
Hi ❤cj nha Thien Ai mãi đỉnh<3333💞📚,0,phobert_v2_confident,1
"""Cuộc đua duy nhất là sự thương yêu""thương yêu là quyền lực nhất,thương yêu vô điều kiện",0,phobert_v2_confident,1
Siêu hay luôn,0,phobert_v2_confident,1
Vũ Khanh hát bản này hay quá trên cả tuyệt vời nhưng từ mùa Covid đến nay 2023 Vũ Khanh hầu như biến mất ...?,0,weak_high_conf,2
Tuyệt vời luân,0,phobert_v2_confident,1
"Cảm ơn Thầy,bài giảng quá bổ ích dể hiểu!",0,weak_high_conf,2
"Chú ơi chú phải thật tỉnh táo không là trắng tay với người vợ trẻ này đó ạ . Người phụ nữ này đến với chú không phải vì tình , khẳng định luôn , lúc chú ốm đau chỉ có ruột thịt , con chú chăm sóc thôi , chắc chắc người này sẽ không chịu ở với chú lâu dài đâu khi chú không cho tiền ạ",0,phobert_v2_confident,1
A men cha giảng tuyệt vời quá,0,phobert_v2_confident,1
Nghe bài này là tôi khóc nức nở,0,phobert_v2_confident,1
"Mình cũng từng bị trầm cảm giai đoạn 1. Mình rất lo lắng, sợ hãi, tuyệt vọng và cảm thấy không còn tin tưởng Ai. Vì mình thờ Phật, trước đây lúc rảnh thì nghe Phật dạy, các Pháp của các thầy giảng. Mình từng được các cô,chú đi chùa khuyên nên tụng niệm Danh hiệu Ngài quán thế âm bồ tát hoặc chú Đại Bi. Mình có làm theo, mỗi sáng mình thức dậy mình tụng Quán Thế Âm bồ tát nhưng sau đó vì lười nên bỏ tụng. Dạo gần đây mình mắc chứng suy nghĩ Thái Quá, Quá nhiều và mình quyết tâm tụng chú Đại Bi và tin tưởng tuyệt đối vào Phật. Đồng thời bản thân mình cũng nâng cao nội lực của mình. Ai muốn hiểu thêm về sự Linh ứng của Chú Đại Bi thì xem video :Sự Linh ứng của chú Đại bi thầy Thích Trí Huệ giảng. Mình mong cho tất cả mọi người đều bình an và hạnh phúc từ trong tâm hồn 💓",1,weak_high_conf,2
âm nhạc vẫn là một cái j đó để giảm bớt và xua tan những mệt mỏi và căng thẳng sau những ngày làm việc 💓,0,phobert_v2_confident,1
"Bài này rất hay hữu ích, cảm ơn thầy ❤",0,weak_high_conf,2
Cách nc xưng hô giữa Thầy và chị Thùy Minh rất hay! Y Nghĩa bất y ngữ.,0,weak_high_conf,2
Em cảm ơn Thầy rất nhiều ạ 💓 Mãi iu 🌸💕,0,human_gold,3
11/2/2025 có ai ko,0,phobert_v2_confident,1
Bài này hay lắm lun,0,human_gold,3
Cố lên tôi ơi tự làm tự tạo . Bế tắc thật sự . Chỉ biêt nhơ ba giúp mình thasy mình thật tệ rất rất tệ 😔 ba ơi con sẽ cố gắng ba nhé cám ơn ba,1,phobert_v2_confident,1
"Mình thật sự bất lực trước những việc khó ngay cả với tương lai của bản thân cũng thế mình sợ thành quả của mình sẽ bị thay thế nhanh chóng mình vẫn luyện tập hằng ngày để mong cái tương lai đó thay đổi nhưng nó với mình khó quá mình là một người k có tài năng nhưng bằng cách nào đấy lại khá thích nghệ thuật mình quyết định sẽ theo nó nhưng từ khi bắt đầu luyện tập nghiêm túc rất nhiều cái cản trở mình, sự kì vọng của gia đình , nỗi sợ rất lớn của mình có những lúc mình muốn buông suôn hết mọi thứ nhưng nghĩ lại thật tệ nên mình vẫn cố gắng sống tiếp và vật vã với cái lí tưởng của bản thân không biết khi nào mình sẽ đạt đến được nó nhưng mình vẫn cố gắng",1,phobert_v2_confident,1
"Hãy buông bỏ tất cả những ưu tư, phiền muộn, những thứ gì không thuộc về mình, không mong cầu nhiều quá,chỉ mong cho chúng sinh an lạc ,thời tiết thuận hòa,mùa màng tốt tươi, thế giớ hòa bình không có chiến tranh,chúng sinh bỏ ác làm thiện tư theo phật pháp ,tin sâu nhân quả là đời bình ăn. Nam mô a di đà phật.",0,phobert_v2_confident,1
5 giờ sáng kiểu Mẹ tôi: dậy ik 5 giờ sáng r Tôi: ahhhhh!!!! Ko ik học đâu Em tôi: trời ơi cứu tôi Tôi: đắp mền kín người,0,phobert_v2_confident,1
Cảm ơn câu chuyện rất đời thường nhưng thật tuyệt vời và rất ý nghĩa của chương trình.,0,weak_high_conf,2
3:05 tui thấy đoạn này trên tik tok nhiều nè,0,phobert_v2_confident,1
"Tên bài hát nhạc Thái: ตัดพ้อ do ca sỹ Koh Niphon Trình bày. Bài hát hay, nghe k hiểu cũng thấy hay. Thấy cmt có ích like nhé @@",0,phobert_v2_confident,1
Bài chia sẽ hay quá. Cảm ơn Cha và chương trình ❤!,0,weak_high_conf,2
Ông này không biết nói thế nào để mà bình luận về phẩm chất của ông này quá hâm,0,human_gold,3
"bạn thực sự đã nói đúng bản chất của mình, một đứa mang tư duy cố định. Mình luôn nghĩ là mình đã cố gắng, nhưng mình luôn đi sau mọi người, mình luôn cho rằng mình hoàn toàn ko thể đuổi kịp những người mà mình tự cho là họ thông minh hơn mình, nhưng.....mình nghiệm ra rằng những thứ mình gọi là nổ lực, nó chỉ nằm trên lý thuyết, mình ko hề áp dụng vào thực tiễn, mình luôn tự ti về năng lực và ngại việc hỏi những người giỏi hơn. Một thời gian dài mình luôn bị ám ảnh bởi hai chữ "" hoàn hảo"" , mình thậm chí còn không dám yêu một ai chỉ vì đơn giản mình luôn cho rằng mình là kẻ thất bại. hy vọng qua những video của bạn mình sẽ cải thiện hơn về tư duy và sống tích cực hơn. Cám ơn về những giá trị mà bạn đã mang đến !",1,phobert_v2_confident,1
Tôi ở Việt Nam nhưng vẫn bị vậy,0,phobert_v2_confident,1
Cảm ơn các bạn đã ủng hộ bản remix này của mình ạ ^^,0,weak_high_conf,2
dug tam trag kua mjnk a vj hat hay wa,0,phobert_v2_confident,1
"Em nhất định phải yêu một người biết trân trọng em, không phải vì đôi ba lần giận hờn rồi bỏ em mà đi. Em nhất định phải yêu một người biết cách yêu em, biết cách giữ em, nên phải là một người thực sự trưởng thành có thể chịu được cái tính khó chịu của em, chứ không phải gặp một người trẻ con lúc nào cũng ghen tuông, giận hờn khiến em phải đau lòng. Rồi em sẽ gặp một người mà khi em buồn, họ nhất định sẽ bỏ hết chỉ để ở bên cạnh em, an ủi em. Khi yêu nhau sẽ không tránh khỏi những lần cãi vã, nhưng em nhất định sẽ phải yêu một người vì em mà chịu chấp nhận họ sai, chịu xin lỗi em trước chỉ để giữ em lại. Nếu một ngày em muốn rời xa vì mệt mỏi, họ sẽ nắm tay giữ em ở lại, chứ không phải là bỏ tay em ra rồi bỏ em ở lại cô đơn, một mình. Rồi em sẽ gặp họ, cái người mà không làm cho em phải buồn, đau lòng vì bất cứ điều gì, hãy an lòng em nhé, em sẽ không phải hối hận khi phải yêu họ đâu. Rồi em sẽ thương đúng người, suốt đời vẫn cứ thương, cùng nhau đi cả đời vẫn không xa lìa... !",1,weak_high_conf,2
Tuyệt phẩm nhân gian,0,phobert_v2_confident,1
"mình cũng từng là nạn nhân của bạo lực học đường. do là vào năm lớp 1, mình bị 1 bn nữ trong lớp bắt nat. Bn ấy thường bắt mình vào nhà vê sinh để lấy tiền nếu ko có thì đánh, sau đó còn đe doa nếu nói cho người lớn nghe sẽ bị năng hơn .Do sơ nên mình ko dám nói ai nghe. Nó tiếp diễn cho đến năm lớp 3, lấn đó bị phát hiên cùng với biểu hiên ve tâm lí nên đã hỏi mình lúc đó mình còn khán cư 1 chút nhưng minh cũng nói cho ho nghe .từ đó mình cũng ko bị bắt nat nữa nhưng do mình bị ám ảnh với trường và nhà vê sinh nên gia đình đã chuyển về quê, cũng từ đó tâm lí mình cũng đỡ hơn dù vây mình ko dám tin tưởng ai trong lớp (kể cả bn của mình) Hiện nay mình học lớp 7 và dù đa qua nhiều năm nhưng kí ức đó vẫn còn mãi trong đầu. 😢😢😢😢",1,phobert_v2_confident,1
tui nhớ chị hai tui quá bây giờ chị hai tui đâu còn thương tui đâu cửi chước chị tui thương tui lắm luôn bây giờ chị hai tui ko thương tui 😔😔😥😥😭😭,0,phobert_v2_confident,1
15 tháng 1 năm 2018 ai còn ghiền bài nàybkhông ạ ... chưa từng 1k like ...,0,phobert_v2_confident,1
❤e cảm ơn bác sĩ về những kiến thức tuyệt vời ạ❤,0,weak_high_conf,2
Hồ ngôn loạn ngữ =))),0,phobert_v2_confident,1
Bọn ác là sinh đôi đúng hông ????,0,human_gold,3
Bác sỹ cho tôi hỏi tôi bị mất ngủ 15nam nay rồi tôi rất là đau khổ và tuyệt vọng xin hỏi Bác sỹ có cách nào giúp dùm tôi,1,human_gold,3
Bạn thật sự là người xuất sắc nhất!,0,phobert_v2_confident,1
xem đến 3'28 em bấm dừng video để gỡ cài đặt facebook & messenger. Hôm nay em thật sự mệt mỏi về áp lực học tập thi cử; hy vọng là xem hết video năng lượng sẽ trở về với em,1,weak_high_conf,2
Á đù 😂😂😂😂😂😂😂😂😂😂 ngoại tình à ❤❤❤❤❤❤❤,0,phobert_v2_confident,1
Thổn thức quá rồi cô giáo ơi,0,phobert_v2_confident,1
Ước gì t cũng có thằng bạn như vậy,0,phobert_v2_confident,1
Con bị rối loạn lo âu lúc nào cũng lo lắng sợ chết bất an đầu óc chật chội nhiều khi như sắp phát điên ý cơ thể suy nhược tức ngực khó thở mệt mỏi .thầy có thể giảng về bệnh rối loạn lo âu được không ạ,1,phobert_v2_confident,1
thật ra mình cũng từng bị bắt nạt rồi,0,phobert_v2_confident,1
Hay quá cs ơi,0,phobert_v2_confident,1
Giọng đọc này giống bên Ethereal nhỉ.,0,phobert_v2_confident,1
"WoW, trái đất tròn thế",0,phobert_v2_confident,1
"t cũng bị ,suy nghĩ quá nhiều",1,phobert_v2_confident,1
Trống rỗng quá thì lấy dưa leo đút vào,0,phobert_v2_confident,1
"Nghe tới đoạn “thà cô đơn vì chưa từng yêu lấy ai” là nổi da gà luôn, đúng tâm trạng nhiều người ghê. Giọng hát Vicky Nhung thật cuốn. Một bản ballad tuyệt vời!""",0,phobert_v2_confident,1
Anh HUY ngầu quá,0,phobert_v2_confident,1
👍👏💐😴😴😴😴,0,phobert_v2_confident,1
"chị dễ thương xỉu á trời, xem cuốn á",0,weak_high_conf,2
"Huhu cảm ơn Mita nha. Mình đang có vấn đề về tiêu hoá rất nhiều. Đầy hơi, ợ chua, trào ngc dịch vị, khó tiêu. Đã bớt dị ứng lastose nên ổn ổn phần uống sữa bị tiêu chảy. Các Seri về tiêu hoá như thế này mình đều xem rất kĩ, thực phẩm probiotic, kefir, thực phẩm bổ sung enzyme tiêu hoá protein, fat, carb.... Nhưng khá bất ổn vì cải thiện ít... 😫😫😫 Ps mình đang gym đều đặn 6 ngày 1 tuần.",1,phobert_v2_confident,1
"Cảm ơn bạn chủ kênh Better Version, clip này mình vừa nghe vừa rùng mình, như có một nguồn năng lượng chảy qua. Rất cảm ơn vì đã chia sẻ sự thông thái cho mọi người. Mình sẽ chia sẻ clip này cho bạn bè, người thân vì sự sáng suốt và truyền cảm hứng của nó. Cảm ơn bạn nhiều vì đã kiên trì duy trì kênh này.",0,weak_high_conf,2
"""Để người khc đánh giá bản thân là tự tạo ra xiềng xích cho bản thân vào những thứ vô nghĩa""",0,phobert_v2_confident,1
Hưu duyên.neu bạn đọc được những dòng chữ này thì chúc bạn và gd sống 1đời an nhiên ❤,0,phobert_v2_confident,1
"Mình cũng đang trông tình trạng mất động lực minh duy trì thói quen tốt một thời gian mình một lần nữa rơi vào trạng thái tồi tệ ăn đồ ngọt mất kiểm soát tinh thần rối tung lên năm 2025 tới đây là bước ngoặc của mình khi lớn lên mình thấy áp lực rất nhiều ! Nhiều thứ trong quá khứ khiến mình không vứt bỏ được sợ thất bại ! Mình thấy mình đang rất chậm so với mn như đi lùi lại thấy sự cố gắng của mình không biết khi nào sẽ thành công ! Rồi sau này mình có giúp ích cho bản thân , gia đình, liệu mình có không hối tiếc hay không ! Tại sao tinh thần mình không ổn định đôi khi mình tự suy ngẫm liệu mình đã ổn chưa ! Những gì mình làm sai trong quá khứ có quá đắc hay không . Liệu mình phải làm gì để có được sự mong muốn của mình ! Liệu mình đu sức không …..",1,phobert_v2_confident,1
"Hallo anh, chào mọi người, mình 96 tức là đang 24 tuổi, trước khi xem clip, mình không nghĩ mình đang trong 1 cuộc khủng hoảng, chưa xác định rõ kẻ địch của bản thân mình đang phải đối mặt là gì, nhưng giờ thì rõ rồi. Kẻ địch có sự hỗ trợ từ sự yêu thương của gia đình, bó buộc bản thân mình trong vòng an toàn, nhưng điều đó chi càng làm mình muốn vượt qua bung ra, chính trong mình cũng cảm thấy có sự bất hiếu khi không nghe theo định hướng sống cuộc sống mà gia đình mong muốn. Nhưng đó là cái giá mình chấp nhận trả để có được 1 ngày mai tốt hơn, 1 con người khác được gia đình ghi nhận, và gặt hái được nhiều thành quả, cống hiến có ích làm đẹp cho đời. Cảm ơn anh Trí.",0,weak_high_conf,2
tất cả những suy nghĩ trên t đều có suốt 3 - 4 năm nay rồi lúc nào suy nghĩ tiêu cực chỉ nghĩ động viên bản thân cố gắng vượt qua nhưng đến bây giờ vẫn k chả ăn thua gì,1,phobert_v2_confident,1
WoW chị và em hát hay quá trời 😂😂,0,phobert_v2_confident,1
"Chuyện nhố nhăng mà dưa lên mạng,lố bịch.",0,phobert_v2_confident,1
Chia sẻ của bác sỹ rất hay và thiết thực giúp cho mỗi người mỗi gđ có thêm kiến thức về bệnh trầm cảm từ đó phát hiện sớm và điều trị kịp thời tránh đi những cái chết đau lòng không đáng có nếu những người xq phát hiện sớm,0,human_gold,3
"Lần nào nghe thì cũng có cảm xúc như lần đầu nghe. Bài này dường như sinh ra cho Miu Lê. Từ giọng hát tới cách diễn xuất quá đỉnh. Chúc chị ngày càng thành công, mãi ủng hộ những sản phẩm tiếp theo của chị.",0,weak_high_conf,2
Mình cũng suy nghi rất nhiều. Rất muốn chết luôn nhưng mà mình vẫn còn thương em mình lắm. K biết nói với ai cha mẹ k bảo giờ hiểu và nghe mình,1,human_gold,3
Mỗi lần buồn chả nói với ai nằm một mình thở dài nghe nhạc thỉnh thoảng tự nhiên lại rơi rọt nước mắt😿😿😿,1,phobert_v2_confident,1
"tớ làm sai và bị mọi người cô lập, xa lánh giờ mình không có cảm giác vui vẻ gì, còn muốn nghỉ học, vì thấy có lỗi mình còn đã từng thử nhiều cách để tự tử nhưng không thành, có khi nào sẽ dẫn đến trầm cảm không ạ",1,human_gold,3
Lười biếng vs trí nhớ giảm có seo k ta😂,0,phobert_v2_confident,1
Nếu là tui. Sẽ dẫn con mình đi sứ khác làm ăn. Tránh xa người chồng đó,0,phobert_v2_confident,1
"mình đang lớp 12 cũng là học sinh cuối cấp và đứng trước rất nhiều các ngưỡng cửa tương lai nhưng đôi lúc mình lại thấy bản thân mình lạc lõng quá, mình không biết mình muốn gì, mình phải làm gì, và mình đã cố gắng vì cái gì… mong sao mình sẽ tìm đúng được con đường mình muốn và kh hối hận vì điều đó. Cảm ơn vstn đã làm ra tập pc rất ý nghĩa",1,phobert_v2_confident,1
Tôi bị viêm xoang khó thở đau đầu cảm giác bất lực khóe tràm cảm mất rồi,1,weak_high_conf,2
Phương án giũ gìn kinh té hợp lý,0,phobert_v2_confident,1
Mình cũng trầm do áp lực tình cảm gia đình😔😔,1,phobert_v2_confident,1
Bạn sẽ ko thấy cô đơn nữa mà sẽ thấy sợ 😮😮😮.,1,phobert_v2_confident,1
"Theo mình, có nhiều phương diện để đánh giá một cuộc đời đáng sống. Với mình, mình vạch ra một vài tiêu chí thế này: - Học - gặp đúng thầy, đúng bạn, đúng sách - Làm - gặp đúng sếp, làm đúng năng lực - Yêu - gặp đúng người, đúng thời điểm Không tập trung quá nhiều vào vật chất, tiền bạc Vun bồi những điều có ích và buông xả hết những điều tiêu cực.",0,human_gold,3
"Anh hát bài nào cũng sâu sắc, rất quý và ngưỡng mộ anh ❤",0,phobert_v2_confident,1
mình cũng muốn điều trị mà nghèo quá,1,phobert_v2_confident,1
"Có 1 sự thật rằng tôi luôn nói chuyện với bản thân.tự tưởng có 1 người khác đang nói chuyện chia sẻ mọi thứ mình.điều đó làm tôi vui , toi cũng k cần bạn bè vì rất khó nói chuyện với họ. 😔😔😔",1,human_gold,3
E hát tuyệt vời hay quá,0,weak_high_conf,2
Khi doanh số tụt ... làm lúc áp lực tâm lý đè nặng những người chủ dn.. áp lực nhiều lúc không thở nổi .. mình hiểu cảm giác của bạn. Mình là nữ đỡ hơn bạn còn thêm áp lực là trụ cột. Mình nghĩ tư tưởng này nên dần bỏ đi. Giảm áp lực cho đàn ông,1,weak_high_conf,2
Cảm ơn a rất rất nhiều ạ,0,phobert_v2_confident,1
"Nghe giọng chị mà thấy nhẹ cả lòng, cảm ơn vì tất cả những gì chị làm ạ <3 Em sẽ luôn ở đây, âm thầm nghe, âm thầm ủng hộ và chờ đợi các video tiếp theo từ chị.",0,weak_high_conf,2
Hát hây❤❤❤❤❤,0,phobert_v2_confident,1
"Cố lên nha ae 2k11, lần này hãy cùng nhau chăm chỉ và thi thật tốt nha!!!!",0,phobert_v2_confident,1
"1 căn phòng,1 cái tai nghe,1 cái mền, 1 mình nghe nhạc ngồi khóc từ 9h tối đến 11h rồi nhập viện❤",1,phobert_v2_confident,1
Hay quá chị Lyly ơi 😍 dễ thương,0,weak_high_conf,2
Hay quá em ơi luôn luôn Theo dõi và nghe em hát.,0,phobert_v2_confident,1
Chúc bác sỹ Hạnh sk ra nhiều vi reo,0,phobert_v2_confident,1
Chuyện hay người đọc cũng hay,0,phobert_v2_confident,1
