comment_text,label,source,weight
"Nhà tôi rất nghèo. Nhà nghèo nên cái gì mẹ cũng mang đi bán. Từ mấy ngọn rau ngót, rau mùng tơi đến quả chuối, quả hồng, quả bưởi hay con gà, con chó, con mèo, mẹ đều cho vào cái mẹt con, đội ra chợ bán hết. Mẹ bảo phải bán để dành dụm tiền cho các con ăn học. Nếu không bán thì mẹ lại để mang đi biếu, đi cho. Mỗi khi ra thăm các bác ở thành phố, có cái gì ngon, cái gì đẹp mẹ đều mang đi làm quà biếu hết. Mẹ bảo của biếu, của cho thì phải đàng hoàng kẻo người ta lại cười cho. Thế là còn bao nhiêu những cái xấu xí, sâu si, đầu thừa, đuôi thẹo thì để lại nhà dùng. Nhiều khi tôi cứ nghĩ có khi cả đời bố mẹ cũng chả được miếng ăn ngon. Mẹ không thích ăn thịt gà! Một hôm, đi học về, thấy mẹ đang vặt lông gà, tôi chạy ào xuống, ôm cổ mẹ, vừa nhảy tưng tưng, vừa reo lên sung sướng: “A! Hôm nay nhà mình được ăn thịt gà! Thích quá! Thích quá!”. Mẹ nuôi hơn chục con gà nhưng trừ dịp tết nhất, giỗ chạp ra chẳng bao giờ thịt nên có khi cả năm mới có miếng thịt gà mà ăn. Cứ nghĩ đến đĩa thịt gà lá chanh, tôi lại thấy đói cồn cào ruột gan, nước miếng chảy qua kẽ răng nuốt không kịp. Tôi nhún vai mẹ giục: – Mẹ thịt gà nhanh lên mẹ, con thèm lắm rồi! Mẹ cười: – Sư bố cô, chỉ được cái nước ăn là giỏi! Hóa ra con gà nhỡ nhà tôi bị chó vồ. Lúc mẹ phát hiện ra thì nó đã bị ăn mất một góc. Tiếc của, mẹ lôi cổ con chó về, lấy chiếc dép nhựa đánh cho nó mấy cái vào mõm, dí mũi nó sát vào con gà chết dọa sẽ cho ăn rềng nếu còn tái phạm. Tôi thì lại thấy vô cùng sung sướng, muốn cảm ơn con chó đáng ghét vì nhờ nó mà tôi mới có cơ hội được ăn thịt gà. Có thịt gà, bữa cơm nhà tôi vui hơn hẳn. Mọi hôm, đến bữa, phải gọi mỏi mồm chị em tôi mới thèm về ăn cơm nhưng hôm nay, không đứa nào bảo đứa nào tự giác túc trực ở nhà từ lúc mẹ thịt gà cho đến lúc ăn cơm, không bước ra ngoài nửa bước. Mẹ cứ quay vòng hết gắp cho bố lại gắp cho chị em tôi mà chẳng thấy gắp cho mình. Tôi vừa nhai nhồm nhoàm vừa hỏi: – Ơ, sao mẹ không ăn? Mẹ cười bảo: – Mẹ không thích ăn thịt gà. Thằng em tôi nhe răng cười vô tư: – Mẹ ơi, mình ăn thừa của chó mà ngon nhỉ mẹ nhỉ! Tôi tức mình quát: – Không phải ăn thừa, dốt ạ. Đây là mẹ cướp được của nó chứ. Mẹ mà về muộn tí nữa thì con chó đã xơi hết rồi còn đâu nữa mà ăn! Mẹ lại gắp cho mỗi đứa một miếng nữa vào bát: – Thôi ăn đi! Ăn đi! Chúng mày lắm chuyện quá cơ! Ăn xong, vừa buông đũa buông bát, chị em tôi đã chạy ù đi chơi với cái bụng no nê đầy năng lượng. Nhưng vừa chơi được một tẹo, tôi đã thấy khát nước nên phải chạy về uống. Có lẽ vì món thịt gà rang của mẹ hơi mặn. Vừa tới cửa bếp, tôi đã phải lùi lại, nép vào sau cánh cửa. Dưới ánh sáng hơi tối của chiếc bóng tiết kiệm điện bị mạng nhện bao phủ, mẹ đang gặm lại những miếng xương gà mà chúng tôi đã ăn. Chẳng biết nó có còn dính tí thịt nào không nhưng nhìn mẹ gặm có vẻ như chúng rất ngon lành. Lòng tôi thắt lại, tim tôi nhói đau muốn chạy lại ôm mẹ thật chặt nhưng sợ mẹ tủi nên không dám. Tôi khẽ lùi ra ngoài, chạy đến một gốc cây to, ngồi ôm mặt khóc. Bây giờ, tôi đã học xong đại học, đi làm, có tiền, mỗi lần về nhà đều mua rất nhiều đồ ăn ngon cho mẹ ăn. Nhưng lần nào về cũng thấy đồ ăn trong tủ lạnh vẫn còn nguyên. Tôi cằn nhằn thì mẹ cười bảo: – Răng rụng hết rồi còn đâu nữa mà ăn?",0,weak_high_conf,2
Ước gì có karaoke best này,0,phobert_v2_confident,1
"Cảm ơn tôi thích nghe thày nói, một phương pháp bổ ích , áp dụng trong mọi lĩnh vực",0,weak_high_conf,2
"Mình đã nghe video này rất nhiều lần, hiểu ra được vài điều, rất ấn tượng với video này của bạn. Cảm ơn và luôn ủng hộ bạn ❤",0,weak_high_conf,2
"Thưa cô, con nghe cô giãn thì chín bản thân con bị giải đoạn, còn rất mét con năm bệt trên giương con không muôn ăn hay làm gì nưa cả ,vì ,bạo lục của người thân công thêm xã hộicon, không có cách nào tránh khỏi ho ,con nhờ cô có cắc nào cô giúp con để vượt qua con cảm ơn cô nhiều.",1,phobert_v2_confident,1
Mất ngủ cả đêm à 😂😅,0,phobert_v2_confident,1
"Em bị mệt mỏi,cảm thấy đau đầu,giảm tập trung và trí nhớ bắt đầu kém đi.... Bắt đầu thiếu quyết đoán,lơ ngơ,lú lẩn,hay lo âu sợ hãi,căng thẳng,em nghĩ mình sắp trầm cảm đến nơi rồi,... Hay tức giận,lo lắng sâu xa,khó chịu với mn xung quanh thiếu kiên nhẫn và nóng tính,em cứ muốn ở 1 mình mãi,lúc ăn uống ít cực,lúc ăn thì lại nhiều,có khi đêm nằm lại tự khóc,... -Mới sáng nay chỉ do em lo lắng,nóng tính mà lỡ nặng lời vs ba em nên e bị đánh thẳng vào đâu vs lỗ tay,... E cảm thấy áp lực -Áp lực trong học tập lẫn gđình,bạn bè lẫn thầy cô -Riết cứ mỗi lần học đặt biệt tới giờ toán,em cảm thấy sợ hãi vô cùng,thiếu quyết đoán,lơ ngơ,lú lẩn,hay quên trong giờ học - Cứ mỗi lần để đồ ở đâu xoay qua xoay lại em lại quên mất đã để nó ở đâu nữa - Hay sợ sệt,nghĩ đến tương lai hoặc vài ngài tới... Mấy triệu chứng trên cho thấy em bị stress loại nào ạ?",1,weak_high_conf,2
"❤ nghe & xem tiếp lần 3 ""tuyệt vọng của tiểu thuyết radio"" lúc 19:11 ngày 14.10.2024 ❤ ❤🎉😊❤🎉😊❤🎉😊❤",0,phobert_v2_confident,1
Họ ko biết thấu hiểu. Ko quan tâm con cái hiến con tự ti. Là lí do con bị Trầm cảm 😢,1,weak_high_conf,2
Căng quá,0,phobert_v2_confident,1
"Chào cả nhà, một tim bằng một lần mình nghe lại bài này nhé!",0,phobert_v2_confident,1
"Mình đã khóc bất lực vì cơn lo âu, lo sợ cứ quây vào tâm trí mình, mình muốn cố gắng chiến đấu với nó từng ngày và tâm trí mình nó không thoát được, đến đây để nghe nhạc thiên nhiên tiếng chim hót tiếng suối rì rào mong tâm sẽ bình an và thư giãn thật nhiều mình đang rất cần thư giãn. Tuy khó tránh khỏi nhưng nó quá sức với mình. Mong có ai đó thấu hiểu lắng nghe và chia sẻ tâm tư đến mình đỗng viên mình, có lẽ mình không cô đơn trên con đường này đâu. ❤❤❤ Mình thực sự buồn lắm mình càng chống lại nó nó càng dữ dội hơn cơn lo âu lo sợ cứ bủa vây mình, mình đã thực hành nhiều tập thể dục mỗi ngày, tập hít thở sâu 5-10p, đi ra ngoài nhiều hơn và tiếp xúc thiên nhiên nhiều hơn, đi dạo, đi bộ nhanh,.... Làm mọi thứ mong rằng sẽ tốt hơn.",1,weak_high_conf,2
"Hồi nhỏ em rất tự tin nhưng khi càng lớn dần, em hiểu được những gì ba mẹ em chỉ trích em, áp lực học tập và đồng trang lứa, khiến em dần thu mình lại.",1,weak_high_conf,2
Huhuuuu em đã nghe hết postcard của anh vào một ngày mà trời mưa to rì đâu. Thực ra em chưa tập được thói quen nghe postcard nhiều lắm nhưng mà postcard của anh là một trong những cái hiếm hoi mà em nghe hết ấy ạ :vvv Nhân tiện a có thể recommend một vài postcard tiếng Anh mà anh hay nghe được không ạ,0,human_gold,3
"Nghe buổi talk quá truyền cảm hứng, có vài khúc thấy nổi gai ốc và vui sướng trong lòng:) cảm ơn Team vietcatera luôn có spotlight cho những nhân vật quá tuyệt vời!",0,weak_high_conf,2
Cách diễn đạt dễ hiểu,0,phobert_v2_confident,1
"ngày xưa bài này nổi bao nhiêu nghệ sĩ cover mà ngóng mãi a mão k thấy lên sóng, giờ ms thấy a làm!!! Hay",0,phobert_v2_confident,1
Biết ơn Thầy❤,0,phobert_v2_confident,1
"Thật sự lúc đầu còn nhỏ thì em cũng khá mạnh dạn trong giao tiếp nhưng dần dà lớn lên gặp một số vấn đề tâm lý nhất định cộng với việc người lớn bảo cái này không được cái kia không được nên em bắt đầu thu mình lại. Vì vậy ngày càng lớn người nhà em lúc nào cũng bảo em phải vượt qua sợ hãi, phải bản lĩnh lên các thứ tuy nhiên chẳng chỉ dẫn em cách để làm hay là đưa ra một lời khuyên nào cả, chỉ đưa ra một lời nói suông khiến em rất bối rối không biết hiện tại nên làm như thế nào.😔😔",1,phobert_v2_confident,1
Đây là bộ phim ns về cô gái vô dụng tới mức con mèo phải tiến hóa cấp tóc để nuôi chủ khiến cho từ người nuôi mèo thành mèo nuôi người ở đâu bán tui mua gấp.=)))),0,phobert_v2_confident,1
OMG THATS SO BEAUTIFUL!!!!!,0,phobert_v2_confident,1
Bác của ta là thám tử mori u là trời hatori ngầu quá 😘,0,phobert_v2_confident,1
"Em thua trắng tx , đau ốm tới nỗi không có 1 đồng trên tay , chỉ biết cầu nguyện cho chúa và nghe âm thanh này để hết sốt và ho , ngày mai đi làm và làm lại cuộc đời,ai đang ở tình cảnh khó khăn nào, nhớ phải lạc quan yêu đời nha , cầu nguyện cho chúa cho mn hết đau ốm bệnh tật ưu phiền, áp lực, tiêu cực mau chóng tiêu biến hết nhé , AMEN ❤",1,phobert_v2_confident,1
"Em mới trải qua 1 kỳ thi quan trọng em tưởng rằng sau khi thi xong em sẽ thấy nhẹ nhõm nhưng nó chỉ mang lại cho em sự lo lắng tiếc nuối lo sợ sẽ trượt dù đề ko khó nhìn những đứa chung phòng thi cười mà em chỉ muốn khóc thà rằng đề khó thà rằng em ko bt lm nhg rõ ràng em có thể lm đc có thể lm tốt hơn nữa rõ ràng ko đúng với khả năng thật sự của bạn thân , ra khỏi phòng thi em ko thể kìm nổi khi nhìn thấy bố em tiếc nuối , dằn vặt dù chẳng thay đổi đc j , Mẹ em nói "" học tài thi phận "" cái tư tưởng chừng đơn giản nhg nó vắt kiệt , nó đeo bám lấy bản thân lấy hết sự tự tin của em em đã trải qua nhiều kỳ thi nhiều lần cảm thấy ko công bằng tại sao bản thân đã nỗ lực như vậy mà vẫn ko đạt đc ý nguyện nhg trong lần thi quan trọng này em thật sự đã rất bất lực hàng loạt câu hỏi tại sao , tại sao ông trời lại ko đứng về phía mình , tại sao người đó lại là mình ,...nhớ lại tất cả những nỗ lực những hy vọng em cảm thấy bất lực , chán nản em ko bt lm thế nào để thoát khỏi cái gọi là học tài thi phận nữa Em ko biết phải nói với ai nên viết trên đây e cảm ơn nhiều nhé ạ",1,weak_high_conf,2
"Mệt mỏi quá ,ko còn muốn cố gắng nữa huhu",1,phobert_v2_confident,1
Tôi bị trầm cảm từ lúc tôi mới 3 tuổi,1,phobert_v2_confident,1
"A ơi vậy mình nên trả lời sếp ntnao cho khéo ạ? Nếu mình nói kiểu như dạ e đang bận vc này chút lát e rep a đc k ạ bah blah, sếp sẽ cáu và cho là do e đang k tôn trọng cv a giao,....còn nếu mình trả lời như video thì sếp lại mong ngóng,....k biết làm sao ạ",0,human_gold,3
Tôi có áp lực và mắng đánh tôi với la và tôi đÃ trầm cảm....,1,weak_high_conf,2
"Ôi tôi bị trầm cảm nặng nề, làm sao thoát khỏi bệnh trầm cảm này,😭😭😭😭",1,phobert_v2_confident,1
sáng học đã mệt chưa 1 giờ lại đi học tiếp tới 7 giờ mới dược nghĩ rồi lại còn làm bt nx mết lắm luôn 😴😴😴,1,phobert_v2_confident,1
Cám ơn sl và trình bày rất hay mà ý nghĩa cám ơn❤❤❤❤❤❤❤❤,0,weak_high_conf,2
"""HEO RỪNG SỐNG Ở BẮC CỰC"" :))",0,phobert_v2_confident,1
"Đường nào cũng tìm lối sống thoát, sao từ đầu bên mẹ nhờ mẹ sớm,",0,phobert_v2_confident,1
ko biết kênh đã làm về đa nhân cách chưa ạ,0,phobert_v2_confident,1
Anh ta sẽ phải nuối tiếc khi mà bỏ rơi 1 người tuyệt vời như em,0,human_gold,3
Hòn đảo nào đông nhất thế giới,0,phobert_v2_confident,1
"Xem điện tử để giải toả căng thẳng, giải trí sau ngày học tập kiệt sức mà mẹ nói vậy thì chịu r",0,phobert_v2_confident,1
Ra bài mấy tháng trời mới được 1 bữa live đàng hoàng :)) Cám ơn mng đã ủng hộ Quân suốt năm qua Happy new year🎉,0,weak_high_conf,2
Má ơi như bạch nguyệt quang lùn đẹp vãiii😂,0,phobert_v2_confident,1
Bs tôi uống ngũ mỗi đêm đó là thuốc ngũ mắt thuốc tây có sao không viên thuốc có bốn mắt,0,phobert_v2_confident,1
Thật á em bị bệnh lười nặng luôn á em đag cố bỏ bệnh này 😢😅,1,phobert_v2_confident,1
"May thay ,hạnh phúc thay cho những ai được ngồi đây nghe thầy thuyết pháp !",0,phobert_v2_confident,1
"Chủ kênh: ""Trái Đất Mẹ"" Ngta: ""Mẹ Thiên Nhiên"" :)",0,phobert_v2_confident,1
Anh đạt ra áp lực học tập 29,0,phobert_v2_confident,1
"xin chào, mình nghe đến các vid của bạn gần đây, cảm ơn bạn vì đã giúp chữa thành 1 phần trong mình, mình có 1 chút vấn đề của bản thân và cứ mãi loay hoay trong vòng luẩn quẩn đó, k biết bạn có thể lắng nghe mình được không?",1,phobert_v2_confident,1
"Nói chung bệnh trầm cảm la do chinh những người thân iu của chúng ta đã vô tâm làm tổn thương ta , nếu ko vi quan tâm và yêu thuong họ chúng ta tuyệt đối ko bi trầm cảm rồi. Là do chính người thân iu cua chúng ta đã đẩy chung ta vào mức tuyệt vọng xã hội bây giờ sống vô cảm qua. 😔",1,weak_high_conf,2
"Khi da trai qua tram cam roi thi toi that su moi hieu dc qua nhieu nguoi tram cam chi co the noi nhieu hoac it ma thoi -:). Vi no la 1 cam xuc tu trong nao~ nen ko co bat cu 1 Bac si nao co the noi dc rang trong nao~ ban co gi va cam xuc gi ,Toi thay Ong Bac si chua tram cam cho toi ,ma khi tiep xuc Toi thay Ong^~ con tram cam hon toi kkk vi qua cach noi chuyen toi da thay Ong ay mat tap trung va hay quen do la tram cam chu la gi ?-:)😅",1,human_gold,3
"Giờ chỉ có thành phố lớn như SG áp lực thi trường công lớp 10 rất lớn. Như ở vùng nông thôn chỗ mình Tây Ninh học tèn tèn vào đuoc lớp 10( điểm chuẩn trường công có 8 điểm). Thời giờ vào đh quá dễ, dân SG mùa tuyển sinh k dám đi ngang trường đh sợ trúng tuyển",0,phobert_v2_confident,1
"Đã nghe cũng thấy mình trong bài hát này, tks a trai",0,phobert_v2_confident,1
"Lâu lắm k nghe Thuần rồi nay coi lại thì mới thấy thì ra người ủng hộ xây nhà ở quê hương mình là b, xin cảm ơn rất nhiều",0,weak_high_conf,2
Sâm ơi mày bốc phét vừa thôi người Nam Định gì mà nói giọng miền Nam chúng mày bịa chuyện tào lao không đâu vào đâu,0,phobert_v2_confident,1
Ôi cuối video miếng sường đc dát vàng,0,phobert_v2_confident,1
"Lần đầu xem anh là dịp tết 2016, xem anh chơi con RE 7 cái sự mê game offline bị lãng quên trỗi dậy, lúc đó ban ngày ôn thi viên chức tối kéo thùng nước sâm đi bán dạo ở quảng trường chỉ tranh thủ xem được lúc 11h đêm,năm đó thi rớt dòng đời đưa đẩy . Quay đi quay lại cũng hơn 8 năm đây là lần đầu tiên em cmt trong video, giờ thì đã 33 tuổi rồi nhà xe cũng đã có, thu nhập thụ động cũng có, cám ơn anh Dũng là một trong những nguồn động lực để em tiến lên mỗi ngày nhé",0,weak_high_conf,2
Tin tức thế giới cho anh nhiều cho anh được cái gì sóng gió viết cho mình,0,phobert_v2_confident,1
Nếu bố mẹ hợp tôi mà cho hết tài sản tôi thì tôi cung chia cho anh em kể cả con nuôi chứ lộc tôi không hưởng một mình vi bao nhiêu tiêu cũng hết,0,phobert_v2_confident,1
"Mình xin chia sẻ câu chuyện của bản thân ạ. Mình rời khỏi nhà lúc 15 tuổi để đi học ở 1 trường thành phố nên khi rời khỏi nhà và tiếp xúc với cuộc sống mới cảm thấy bản thân rất hạnh phúc, lúc đó mình có ước mơ sẽ trở thành tỉ phú, một người nào đó thật vĩ đại như trong sách vậy. Nhưng mọi thứ lại sụp đổ khi mình rớt đh và phải vào nhà dì ở SG để ở nhờ, cắt đứt mọi quan hệ bạn bè cũ vì nhà dì ko nằm ở trung tâm thành phố, học 1 ngành mà mình chưa bao giờ nghĩ đến, lúc đó mình cảm thấy tuyệt vọng và trầm cảm liên tục trong vòng 2 năm tiếp theo (tất nhiên là mình giấu gia đình). Hiện tại, mình đã thoát khỏi nhà dì, tìm được 1 căn nhà cho thuê nhỏ và 1 công việc part-time và chấp nhận tiếp tục theo đuổi ngành này (mình biết rằng bản thân ko mặn mà với ngành này nhưng không thể phủ nhận lợi ích của nó). Mọi thứ không quá tuyệt như mình năm 15 tuổi kì vọng và bản thân chưa có kế hoạch gì cho tương lai nhưng chỉ cần làm tốt ở hiện tại, tiếp tục sống đã là một thứ tuyệt vời rồi❤❤",1,weak_high_conf,2
_Duu ngoại tình vs cô giáo trí tượng pp v_,0,phobert_v2_confident,1
"Bất lực vì không thể ngừng suy nghĩ, bất lực khi cảm thấy sức khỏe bản thân yếu đi trầm trọng, bất lực vì cái bệnh QUÁI đó cứ lặp lại hoài và cản bước mình trong học tập, dự định riêng. Bất lực vì vừa mới thoát ra được 1 tháng trước thì bây h cảm giác hình như cái bệnh đó đã quay lại. Tại sao tại là mình mà k phải một ai khác.",1,phobert_v2_confident,1
"Tôi là một thằng con trai bất tài, xấu, đen đúa, không giàu có, không giỏi ăn nói, nhạt nhẽo, không có tài năng gì cả, học hành dỡ tệ, thể thao càng tệ hơn, nghiện game, không thích nói chuyện, sợ đám đông. Tôi không có nhiều bạn, và tôi cũng chẳng dám thích ai cả. Đến năm lớp 10, tôi gặp cô ấy, cô ấy ngồi sau lưng tôi. Cô ấy hay bắt chuyện, nói đùa với tôi, và rất hay cười, cô ấy hay lấy bài kt cho tôi, hỏi điểm số tôi, còn động viên tôi khi tôi điểm kém đôi khi còn tỏ ra hơi lo lắng. Đó là một điều hết sức bình thường giữa những người bạn học với nhau, nhưng với một thằng con trai như tôi, đó là lần đầu tôi được một cô gái đối xử tốt như thế. Rồi không biết tôi thích cô ấy từ lúc nào, biết là không thể nên tôi chẳng dám nói ra, khoảng cách nó lớn quá, với lại cô ấy chỉ thích mấy bạn đẹp trai, đầu nấm nè, dễ thương nữa ( cô ấy rất thích trai Hàn ). Sau này tôi bị đổi chổ ngồi đi nơi khác, và cũng không còn ai đối xử như thế với một thằng như tôi cả, cô ấy cũng thích ai đó, không còn nói chuyện với tôi như trước. Vài chuyện xảy ra, tôi đã gián tiếp phủ nhận tình cảm của mình, không lâu sao thì cô ấy quen người khác ( tốt hơn tôi nhiều ). Ngày đó tôi buồn lắm, hụt hẫng, chẳng biết phải làm sao nữa, hàng ngày nhìn cô ấy và người khác vui vẻ tôi đau lắm, nhưng bản thân mình có là gì của họ đâu. Nhưng không lâu sau thì họ chia tay vì không hợp, tôi cũng chẳng có fb hay zalo của cô ấy nên chẳng biết cô ấy có thật sự buồn không, chỉ thấy cô ấy luôn bình thường, hình như cô ấy là người chủ động chia tay thì phải. Những năm 12, cô ấy vẫn nói chuyện và cười với tôi, nụ cười cô ấy đẹp lắm, tôi luôn không kìm được cảm xúc khi cô ấy cười. Tôi luôn chọn đứng phía sau lưng cô ấy, luôn ra về sau lưng cô ấy, luôn nhìn cô ấy từ phía sau, phải chỉ phía sau thôi, vì tôi biết tôi không thể, dù sao thì khoảng cách vẫn quá lớn, nó dễ dàng nhận ra được ngay từ vẻ bên ngoài. Chỉ cần cô ấy nói với tôi một câu, cười với tôi một lần, có lẽ nó là hạnh phúc và đủ lắm rồi, tôi không dám hy vọng điều gì khác đâu. Chỉ còn vài tháng nữa là hết năm học 12 rồi, có lẽ khoảng thời gian tươi đẹp ấy cũng sẽ kết thúc với tôi. Hy vọng sau này nếu có duyên khi gặp lại, tôi sẽ tốt hơn bây giờ ( tôi sẽ luôn cố gắng mà ) và cô ấy cũng thế, chúc cô ấy thành công với ước mơ của mình và tìm được người người thật sự yêu thương và tốt với cô ấy. TAO BIẾT MÀY SẼ KHÔNG THẤY NHỮNG DÒNG NÀY NHƯNG TAO CẢM ƠN MÀY NHIỀU LẮM, CẢM ƠN VÌ MÀY ĐÃ TỐT VỚI MỘT THẰNG NHƯ TAO, VÀ XIN LỖI, XIN LỖI VÌ ĐÃ THÍCH MÀY KHI TAO KHÔNG CÓ GÌ CẢ ( cảm ơn ai đó đã đọc những gì mình viết, nếu có, đây là những gì mình muốn nói với cô ấy nhưng không thể, nếu không thích xin bỏ qua ạ)",1,human_gold,3
Chòi ơi tuyệt vời quá anh ơi mới biết luôn cảm ơn anh,0,weak_high_conf,2
Em dính 1 2 3 4 6. Năm/bảy rồi 😢,0,phobert_v2_confident,1
Bi mat ngu co phai bi tram cam k bs,1,weak_high_conf,2
Giọng chj khàn đục làm em hát y như giọng chj 😂,0,phobert_v2_confident,1
"Có những ngày, cuộc sống dồn dập đến mức ta chỉ muốn buông xuôi tất cả—mệt trong lòng, nặng trong ngực, và chẳng còn chút sức để mỉm cười. Nhưng trong những lúc ấy, nếu ta chịu dừng lại một chút, lắng nghe một bài giảng Phật pháp, có khi chỉ một câu thôi cũng đủ làm dịu đi cơn bão trong tim. Phật không hứa sẽ xóa hết khổ đau, nhưng Ngài chỉ cho ta cách vượt qua bằng sự tỉnh thức và buông xả. Rằng đời là vô thường, khổ là điều không tránh, nhưng tâm an thì khổ cũng hóa nhẹ nhàng. Nghe để nhắc mình: mỏi thì nghỉ, buồn thì thở sâu… rồi sẽ ổn, rồi sẽ qua. 00:00 Chào Mừng Đến Kênh Minh Triết Phật Pháp: Đăng Ký Để Nhận Bài Giảng Ý Nghĩa 00:13 Sức Mạnh Của Sự Dừng Lại: Nghỉ Ngơi Để Lòng An Yên, Không Phải Từ Bỏ 00:48 Vượt Qua Khó Khăn: Giấc Mơ Tan Vỡ Là Cơ Hội Bắt Đầu Lại Tốt Đẹp Hơn 01:33 Buông Bỏ Gánh Nặng Tâm Trí: Chấp Nhận Yếu Đuối, Sống Thật Với Chính Mình 02:36 Thay Đổi Tâm Thái, Chấp Nhận Nhân Duyên Vô Thường: Trí Tuệ Sống An Lạc 03:39 Tâm An Vạn Sự An: Buông Bớt Kỳ Vọng Để Tìm Thấy Vùng Trời Bình Yên 05:02 Dừng Lại Để Lắng Nghe: Khám Phá Hành Trình Nội Tâm Khi Mệt Mỏi 06:36 Neo Đậu Tâm Hồn Giữa Sóng Lớn: Sự Dừng Lại Là Khởi Đầu Mới 08:31 Tâm Như Đứa Trẻ: Đối Xử Với Mệt Mỏi Bằng Lòng Từ Bi Và Hiểu Thương 10:16 Vạn Pháp Do Tâm Sinh: Chuyển Hóa Khổ Đau Khi Cuộc Đời Không Như Ý 13:07 Sống Như Mây Nước: Bài Học Buông Bỏ Từ Thiên Nhiên Để Tâm An 15:30 Hơi Thở Chánh Niệm: Cánh Cửa Về Hiện Tại, Nơi Trú Ẩn Tâm Hồn 21:10 Đối Diện Cơn Mỏi Mệt: Lắng Nghe Tiếng Lòng Để Hiểu Và Chữa Lành 26:30 Buông Bỏ Điều Không Cần Thiết: Dọn Dẹp Tâm Trí Để Nhẹ Lòng Hơn 31:41 Nghệ Thuật Buông Bỏ Trong Phật Pháp: Chấp Là Khổ, Xả Là An 40:00 Vô Thường Và Sự Chấp Nhận: """"Rồi Mọi Thứ Cũng Sẽ Qua"""" - Câu Chuyện Vị Vua 45:10 Bài Học Từ Nghịch Cảnh: Chuyển Hóa Khó Khăn Thành Cơ Hội Trưởng Thành 53:48 Tĩnh Lặng Đích Thực: Không Trốn Chạy Mà Là Quay Về Làm Lành Với Nội Tâm 1:02:20 Sống Trong Hiện Tại: Nền Tảng Của Hạnh Phúc Và An Lạc Theo Lời Phật Dạy 1:10:05 Chịu Đựng Thông Minh: Khi Nào Nên Buông Để Tâm Hồn Được Tự Do?",1,weak_high_conf,2
áp lực nhiều quá với nhìn bn bè xung quanh cx đang che giấu đi sự mệt mỏi của họ sự áp lực khiến t cx cảm thấy quen với 2 chữ áp lực,1,phobert_v2_confident,1
Nhung Thanh nien nay se song trong benh tat song khoang 5-10 Nam se di doi ve chau trio!,0,phobert_v2_confident,1
