row_id,text
r4-1038,"Lời bài hát: Tập Cô Đơn - Lê Bảo Bình Trong cuộc sống đâu có ai là không Phải rơi những giọt lệ Đâu có ai là không có lúc mắc sai lầm Và đánh mất đi người mình yêu Ngày xưa tôi cũng thế, chỉ vì những đam mê Đánh mất đi người tôi đã yêu Giờ đây ôm nuối tiếc, nhiều khi muốn thét lên Giá như ngày ấy, có thể quay lại với tôi. [Đk:] Tôi đã cố tập sống, một cuộc sống cô đơn Và học cách một mình Để bước qua những nỗi đau thực tại Sau những vấp ngã tôi gây ra Làm hai ta cách xa Tôi đã cố tập quên, những quá khứ đau thương Cho dù ngày ấy, cũng đã xa xôi Không biết liệu tôi, có thể đứng lên Và mạnh mẽ vượt qua, nỗi đau mà tôi đã gây ra..."
r4-1039,"I have ptsd, had burn-out and as an a-type was willing to chase achievements that would have took me into an early death. I am now unemployed, relaxed, happy and always playing with my kid...bliss for now. You only live this life once.."
r4-1040,"My burnout experience was pretty violent. I spiraled downward slowly for several months, dealing with unstable home relationships, a job closing down, I left to take care of myself and landed my own place because the chaos from others was too much. But as my job left me, I was hitting a bad spot. I took on two jobs at once, but fell behind on rent. All the unresolved pressure eventually broke me down. I noticed something was wrong when I began making more illogical choixes. I felt moments of confusion and panic. The big day was when I just stopped. I quit all my jobs and isolated myself. Had a 5 day fever, my body was so sensitive like I was literally fried out. I didn't eat for 32 hours. I was a shivering wreck. But talking with a friend after isolating for 5 days, I slowly picked up all the pieces. However, that experience affected me for a long time. I felt the effects of this for a whole year, even long after things improved and I got my life steady and functioning. 70% of what caused this problem was not having money... It always goes back to not enough money."
r4-1041,"I am very late diagnosed AuDHD, and after pushing through for nearly 40 years and dealing more than a few abusive/toxic family members, I shut down. I've been shut down for almost 5 years, and I hate this feeling. It's like I turned back into a toddler or something, and everything is so, SO hard now. I had a therapist who was allegedly well versed in autism, but the advice I got was often very misguided, and it was clear that they didn't understand adult autism at all. I don't know what to do anymore."
r4-1042,"xin gửi lời cám ơn sâu sắc tới chị, những gì chị nói đều giống tình trạng của e trong 2 tháng gần đây, cám ơn chị đã cho em biết cách để thoát khỏi nó."
r4-1043,"There is no question I've hit clinical burnout. I even took a vacation/travel sabbatical of sorts a few months ago; about 5 weeks long which is much longer than most Americans would be able to do. It was great, but when I got back to the job it was almost as if I never left. Just as cynical, fuse just as short, motivation shot, stress level rocketed back up again. Been at this 15 years. For those who are feeling the same but only a couple years in, it doesn't always get better. Sometimes a total change is in order."
r4-1044,"I can't say I fully agree here. Sure, that is a cause of burnout, but overworking is also a major factor and I don't agree with that you ruled it out completely at the start. I'd say that I'm burnt out from schoolwork, but I'm getting a pretty major reward in the form of good grades. My problem is that I work too much, not that I don't get any reward."
r4-1045,"Trường tốt hơn gù có áp lực đến nào thì tôi lun lun cố gắng, nhà là địa ngục.....😁"
r4-1046,"Rốt cuộc thì tình yêu là gì Ta ch được hạnh phúc bao lâu lại phải xa cách nhau, em nhớ anh lắm, a có khỏe không? Ai cx bảo e quen a sẽ hp nhưng mà ...... sao mà a bỏ em đi thế. Kiên ơi a muốn e phải làm sao đâyyyyy 🥺🥺😔😔"
r4-1047,Nhìn em khóc một mình giữa đêm Bàn tay ôm những kỉ niệm buồn Lòng đau lắm nhưng chẳng nói ra Giờ người ta đã bỏ em rồi Rồi em nói em sẽ cố quên Mà tại sao tim vẫn còn nhớ Để đêm xuống nỗi buồn ở bên Tại sao em vẫn cứ mong chờ Sao em lại khóc một mình như vậy Người ta có thương có yêu gì đâu Em mãi ôm sầu cho tim nát tan Sao không mở lòng cho anh ủi an Thôi em đừng khóc em ơi đừng buồn Thời gian sẽ thôi không chờ đợi ai Hãy để anh được bên em sớm mai Cho em nụ cười quên đi đắng cay Rồi em nói em sẽ cố quên Mà tại sao tim vẫn cứ nhớ Để đêm xuống nỗi buồn ở bên Tại sao em vẫn cứ mong chờ Sao em lại khóc một mình như vậy Người ta có thương có yêu gì đâu Em mãi ôm sầu cho tim nát tan Sao không mở lòng cho anh ủi an Thôi em dừng khóc em ơi đừng buồn Thời gian sẽ thôi không chờ đợi ai Hãy để anh được bên em sớm mai Cho em nụ cười quên đi đắng cay Khóc làm gì em nhớ làm gì Cho tim mình đau Những câu chuyện quá khứ Thôi hãy để lại sau Có anh rồi anh sẽ luôn ở bên chở che Cho em những tháng năm bình yên Sao em lại khóc một mình như vậy Người ta có thương có yêu gì đâu Em mãi ôm sầu cho tim nát tan Sao không mở lòng cho anh ủi an Thôi em dừng khóc em ơi đừng buồn Thời gian sẽ thôi không chờ đợi ai Hãy để anh được bên em sớm mai Cho em nụ cười quên đi đắng cay Hãy để anh được bên em sớm mai Cho em nụ cười quên đi niềm đau
r4-1048,hinh nhu ngay nao toi cung nghe lip nhac nay ma kg biet vi sao
r4-1049,Mình bị BURN-OUT một khoảng thời gian dài do đặc thù làm IT nên phải ngồi và tập trung lâu. Để khắc phục mình đã chia công việc thành các phần nhỏ hơn để có thể áp dụng Pomodoro và lên plan kỹ càng. Khối lượng công việc được điều hòa lại nhưng di chứng về cột sống có lẽ phải lâu mới khắc phục được.
r4-1050,"Quise dedicar está canción a la chica que me gustaba en el colegio, ella me hacía sentir bien solo con su presencia. Nunca se lo dije y le envié un audio años después. Fue un buen cierre, pero está canción ahora más que para ella es para mí. Atesorare los recuerdos del colegio décadas después. Gracias por todo chicos."
r4-1051,Nghe bài này ae có khóc ko (.......)vậy buồn lắm chăng ai muốn mình phải đi xa hết
r4-1052,"I have to admit all of the above ! Burn out for over two years , just functioning not living. To afraid to relax in case I stop and give up ! I tell no one I do not want sympathy just understanding as to what's happening. I can see it now! that has to be going in the right direction . This information is so valued , thank you 😊"
r4-1053,I've dealt with burnout to varying degrees throughout my entire life at every job I've had (over 11 in 11 years). I don't know if I just have niche interests or have yet to find fufilling work but I just hate feeling trapped for the majority of my life doing something for someone else. I just want to stay home or travel and persue my own interests. Currently only working so I can try to retire to get out of it
r4-1054,"I thought this was my undiagnosed A.D.D. symptoms but I see it is deeper with brain fog and absentmindedness where it overshadows my cbt distortions with depression. Thanks for putting a name to it. I am getting better with finding you too. This sounds a lot but I am getting emotional wake up calls, ah-ha moments, and fake it till you make it ideas. Got the Vibe five! I just open youtube and I find you. Talk about callings!!!"
r4-1055,"I had a doctor compare me to Teddy Roosevelt because I have a chronic illness and I pushed myself so much my whole life, it would make the illness worse and now I’m disabled and never really recovered from almost dying a few years ago. I thought I’d be able to walk somewhat like I used to once I rested and built up my strength but I was never able to and now I have to use a mobility aid to walk more than a few feet. I just never really knew it would cause permanent damage. I thought pushing yourself was a good thing…. But some of us need to understand how these things work and set limits."
r4-1056,I would say that the body is responding to “what’s wrong” in the world. It’s not supposed to be this way. Our government can and should fix it. They are overloading workers with responsibilities while cutting back on staff! It’s wrong! Take your sick days without hesitation. You only have one body.. love it and treat it with respect. Take your vacation days too.
r4-1057,"One of the things that made me realize I was going through a burnout was feeling completely exhausted when I had to force a smile at work. Not only did the emotion of joy had completely left me, but even the act of faking a smile for social purposes was an impossible task. Thank you so much for your video it helps me in my recovery 💜"
r4-1058,"There is caregiver burnout as well. After 5 years of taking care of my parents, I feel 'done/tired' most days and it's really hard to power through general chores on top of everything else."
r4-1059,"Xem tập này mình mới thấy thương 2 đứa em nhà chú mình. Bị bố mẹ áp đặt cấm đoán mọi thứ từ lúc nhỏ tới tận cấp 3, không cho đi chơi giao lưu với bạn bè, ngoài những lúc đi học ở trường thì bị nhốt ở nhà không được tiếp xúc với xã hội khiến cho 2 em bị mất định hướng không có khả năng tự chủ cho cuộc đời của chúng. Mặc dù cũng có thành tích học tập khá giỏi, bằng khen này nọ vậy mà bây giờ vẫn phải trật vật để thích nghi hòa nhập với xã hội."
r4-1060,This is so wonderful! I thank you for sharing. I really want to be more productive but find myself going all or nothing instead of analyzing and breaking down certain tasks according to my energy levels.
r4-1061,"I'd love to give you 10 thumbs up just to help spread this video! Excellent message, thank you so much. It really fills that gaping hole in the vicious circle of self-accusation around not having the right to be ""traumatised"" in comparison to the trauma cases you listed in the beginning."
r4-1062,Hiền Hồ ơi thả tym comment này đc k? I love u ❤
r4-1063,huhu như nói hộ lòng em trong giai đoạn e sắp ra trường bị mất connect và depressed khá nặng. Hope everyone will better in the future
r4-1064,"I’m always here to waiting your videos … somehow I understand what you’ve been through…. I Had that moments in my life. We love you Justin, you know what I love the your’s bar stories..lol. I’m happy to see you still continue with your passion ❤"
r4-1065,"Experienced this so many times. I would breakdown because I could not make any progress in school activities, but also couldn't be productive because my mood's not in the right place. My tactic during these times is just rest and sleep, then pick the activity right back up when that feeling has vanished or lessened."
r4-1066,"I really cared about my consumers' safety before,but after years of working without asssistant and bullying at work ..my brain couldn't function like it used to do."
r4-1067,Đôi khi tôi cũng tự hỏi như vậy. Vì ko làm gì có ích cho người khác thật buồn và uổng phí.
r4-1068,"I was already struggling with this with my PTSD, and then my dad was diagnosed with pancreatic cancer two months ago and immediately got sepsis from his port being put in. He died at the start of the month. Taking care of him (even though he was in the hospital and rehab facility) was more than a full time job for my mom and myself. It was practically impossible to take care of ourselves. The depersonalization was real. Even dissociation at some points. I'm trying very hard to dig out of it now, while also grieving very intensely. I do have a few missions however that's helping keep going. One is to hike his flag to the top of MT. Washington. The other, is at 42, go back to school to become a therapist. His passing, as horrible as it is, is making that a possibility. It's been in my plans for years as I've been on my journey being a survivor of clergy abuse. ( Only realized it at 37) It was part of his wishes for me to go forth and help people and for once in my life, I feel I have purpose. Anyhow, great video. Thank you!"
r4-1069,"Em đồng ý với quan điểm của anh Trí. Em từng có một khoảng thời gian lo sợ và overthinking về rất nhiều thứ xung quanh mình. Tin tốt là thời diểm hiện tại em đã tìm được trạng thái bình yên. Dù em vẫn overthinking gần như là mỗi ngày. Nhưng giống như anh Trí đã trình bày, em có bộ lọc suy nghĩ để điều hướng dòng chảy trong đầu mình: ""Thứ gì mình tác động được, thay đổi được thì lo mà hành động đi. Còn thứ gì mình không ảnh hưởng được thì hoặc tìm cách tận dụng nó, hoặc mặc nó, lo chi tổ mệt."" 😁 Một cách khác mà em áp dụng song song là: Tự tranh luận với chính mình. Em cho phép mọi dòng duy nghĩ trái chiều nhau hay thậm chí không liên quan cùng đồng thời chạy. Đúng là đa số trường hợp chúng vả nhau tới tấp khiến em hết sức mệt mỏi. Nhưng kết quả sau những cuộc tranh luận như thế hoặc là thuyết phục thành công vấn đề không đáng suy ngẫm nữa -> Bình an; hoặc là thành công giải quyết vấn đề theo cách tối ưu nhất; hoặc thậm chí là tìm ra những phương pháp mới, những góc nhìn mới nữa. Nói chung là không thiệt thòi gì cả. Vấn đề lớn nhất em gặp phải có chăng là việc để nhiều luồng suy nghĩ tự do va chạm nhau như thế, em sẽ rất khó diễn giải ra trọn vẹn ý kiến của mình cho người khác. Nhiều lúc khá phiền nhưng em thấy chấp nhận được khi tâm mình bình an.😇 Rất cảm ơn anh Trí và đội ngũ ekip đã cho ra video ý nghĩa này ạ.💕💕"
r4-1070,ngày xưa bị lo âu mà ko biết giờ thành bệnh luôn tim mạch chán
r4-1071,"I spent a third of my time at my last job doing unnecessary, repetitive trainings, reading endless emails, filling in timesheets for myself and my reports, justifying the time I actually did real work, attending meetings, etc. It was exhausting and demoralizing. My coworkers and I wanted to get real work done, not do busywork."
r4-1072,"Watching this video really makes me cry. I have been going through a really tough time and all the burnt-out syndromes just start to come up. Moving overseas, several losses, academic stress, and family relationship are really affecting my well-being and the worth part is that my parents don't even stand in my shoes to understand why I feel this, they just complain."
r4-1073,"Love Ghibli and Genshin references. Honestly, the one I relate to the most is the fantasy sign. When I'm overwhelmed, it isn't hard for my mind to just slip to another world entirely. In the figurative sense that is. It's not uncommon for my mind to just draw a blank and my thoughts immediately go to a fantasy, whether it's someplace real with people who are real or if it's a fictional place with fictional people, my mind will slip wherever it can when I get burnout."
r4-1074,"yêu một người, sẽ vui và hạnh phúc khi họ cũng yêu mình, nhưng nếu đó chỉ là yêu đơn phương, từ một phía, thì thật buồn. Chỉ những người đã từng trải qua mới hiểu được cảm giác này. Muốn buông, muốn ngừng nhớ,.. nhưng làm sao điều khiển được con tim. Trách ai bây giờ, trách bản thân mình. Ước gì có thể ngừng yêu người, ngừng nhớ đến người thì mình đâu phải buồn đến thế. Bài hát của anh như thay lời muốn nói hết tâm trạng của những người đang đau khổ vì yêu"
r4-1075,"It is so incredibly strange being such a wreck these days. I was the calm and collective one who was ready for anything for years, then one day I’m no longer okay. But I’m trying to get better. Thanks for your videos."
r4-1076,"nghe đến lúc cổ vư 2k7 lm mik bồi hồi , nhớ lại kì thi như giấc mơ vừa trôi qua trc mắt trôi lun cả thanh xuân của mik , và giờ đây thay vì dg tận hưởng cs sv thì mik lại chọn thi lại vì 1 tương lai tốt hơn và mỗi lần mik thấy mẹ than thở tiền bạc thì lại thêm động lực cho vc mik dg lm .Hy vọng các bạn tstd vững vàng tâm trí và mik bt cta sẽ lm đc th , hy vọng mik cug sẽ đỗ nv1"
r4-1077,Thật sự hôm nay ko muốn về nhà 😔
r4-1078,"lessons from radio 894: Put the mask down. We are human—we need one another. If you can’t fill what’s inside, it’s because you’re sitting with a sense of emptiness. Someone’s talent always has the power to help others, no matter how small it seems. trust yourself"
r4-1079,"Lên cấp ba, mình thường xuyên đứng Nhất lớp và trong top đầu của trường. Điều đó đặt lên áp lực cho mình là cần phải luôn đứng Nhất, phải luôn luôn đạt điểm cao. Người ngoài sẽ nghĩ điều đó thật tuyệt khi luôn đứng Nhất, nhưng mình nghĩ đó chưa chắc đã là “tuyệt”. Kì này đi thi, do khá nhiều yếu tố khiến điểm thi của mình tụt hẳn đi nhiều và không thể giữ được phong độ như mọi kì thi. Mình nhận được những lời nói thất vọng của thầy cô, những ngờ vực của bạn bè về khả năng của chính mình. Điều này khiến mình thấy thật sự rất stress khi phải đối diện với ánh mắt, lời nói của người khác, đặc biệt là với những người thân luôn đặt nhiều kì vọng vào bản thân mình. Nhưng mình nghĩ, có lẽ đây không phải là điều gì quá tồi tệ mà có khi đó lại là một cơ hội để mình hướng vào bên trong bản thân mình hơn để hiểu mình và những hoài bão, khát khao mà mình thật sự mình muốn đạt được chứ không phải là luôn chạy theo kì vọng của người khác nữa. Tình cờ xem được clip này của anh Trí, mình nghĩ đó là một cái duyên. Cảm ơn anh rất nhiều!"
r4-1080,"""A new definition of trauma.... ""any event, perception or experience that causes us to lose our connection to our sense of value and our unique gifts that we have to bring to the world"" Yes! this new definition is so much more honouring for the infinite variety of human experience. Burnout is so insidious and old definitions of 'trauma' cause many people to feel ""undeserving"" of the medicine (rest) they truly need & do not feel worthy of receiving help. Thank you, I appreciate your offerings immensely."
r4-1081,"Yep, that’s been my experience. And I had multiple burnouts that led to a mayor burnout overload. In my late 20s to late 30s. Two recent burnouts after some recovery. In my late 40s. Now I really listen to my permanent damage, limits and restrictions. I am very fragile/vulnerable when I forget my boundaries. I can feel it, even when I use my mindfulness, emotional intelligence, and/or self control not to show it. But sometimes it shows. Inevitably my immediate family triggers it the worst. I do most of the self care, but need to get better at saying no, or need time to think. But becoming better at no, more and more. Or avoid situations that might make me feel like saying yes."
r4-1082,lúc nào cũng vậy.........tôi luôn giấu cảm xúc thật của mình ^^
r4-1083,Tôi muốn được kết nối vào nhóm để được tư vấn cách vượt qua rối loạn lo âu
r4-1084,"Shi~~~~ how'd you know i needed this? My mom has metastatic breast cancer and I'm a caregiver, I'm only 27 I've been doing this since i was 25... I'm burnt out from work.... And also depressed.. i feel like you spoke to me specifically in this video. I struggle with control, SOOOOO much! 😭"
r4-1085,Sir I just have to tell you the relief I felt in my body when you described what has been happening to me in this video and then gave me tangible steps to help myself. Thank you
r4-1086,"Em mỗi khi lo lắng, giận dữ hay có suy nghĩ ở mãi trong đầu cũng thường viết vào nhật kí, cách này hiệu quả thật sự ạ"
r4-1087,"Sự cô đơn nếu quen cuộc sống sóc nổi rồi thì sẽ rất buồn . Nhưng trong cuộc sống thực tại sẽ không bao giờ tránh được sự cô đơn nhất là khi về đêm mà bạn không ngủ được . Khi vừa đối diện với nó, bạn hụt hẫng và thấy rằng mọi sự bất hạnh đến với mình. Lâu dần nếu tỉnh tâm như Phật , như Chúa thì mọi sự sẽ khác . Bạn bè , người thân đã quá xa để với tới nhưng rất gần để nghe điều có thể chưa là sự thật, Cuối cùng nhìn đi, nhìn lại chỉ có mình với mình . Niềm tin và sự hy vọng chỉ xuất phát từ bản thân và niềm tin tôn giáo chân chính nào đó nếu bạn tin tưởng . Sự cô đơn sẽ để bạn có sự tự nhận xét về bản thân về quá trình của mình đã từng trải và tích tụ hành xử ở tương lai để tự tạo hạnh phúc riêng bản thân không phụ thuộc ngoại cảnh . Lúc này bạn đã thành công. Tôi thô thiển nên chỉ suy nghĩ được đến vậy"
r4-1088,I'm literally sitting here crying that someone was able to verbalize everything i can't and haven't been able to for the past many years.. Thank you for this.
r4-1089,"Em mới đọc chủ đề của chị là nghĩ ngay đến câu chuyện hiện tại của em. Nên em cmt luôn vừa nghe vừa cmt. Em đã quyết định chia tay nyc sau 5 năm yêu nhau. Mặc dù trc đó em nghĩ không có kết quả nhưng vẫn muốn bên anh. Và rồi chúng em vẫn ctay. Bây giờ anh ý có nym làm em thấy có thể là em sai, em có nhiều điểm không tốt nên anh ấy đã đồng ý, không muốn tiếp tục với em nữa. Hơn 1 năm sau ctay, em vẫn buồn, vẫn nghĩ về nyc. Nhưng lại nghĩ nếu quay lại em vẫn chọn chia tay. Nhưng em lại không muốn như vậy. Đúng kiểu không muốn nhưng vì hoàn cảnh fai làm nvay."
r4-1090,"As someone who has PTSD and more recently has felt burned out, I can definitely see this. I was burned out with my previous job at Domino's. Once I was finally able to leave, I left the entire industry and have not missed it at all, it's more than likely because I was burned out"
r4-1091,Do not promise to do anything more than what you can do without being stressed.
r4-1092,Thầy ơi.con xin thầy hãy cho con quên được người mà con yêu.cô ấy phản bội con nhiều lần.mà con không thể quên.con xin thầy
r4-1093,em chi biet an ui nguoi khac nhung em khong biet an ui em cu coi la minh on!!
r4-1094,"mình thì ko giống bạn nữ này chỉ là ba mẹ kiêng quyết ko cho đi làm lúc học đại học í ,nhưng còn nhiều thứ phải chi trả mà ko đi làm thì chịu.cứ ngửa tay xin mỗi ngày như vậy mình cảm thấy vô cùng tệ :((("
r4-1095,"Ước mơ của em là đc gặp bố nhưng bố em mất rồi,nó sẽ ko thành sự thật."
r4-1096,"I recently got treatment for OCD, mental stuff that wasn't obvious, subvert. Man I realize how it was causing me burnout... Making me feel weak when really I was going beyond what my brain is capable of! Thank you for the tips in the video they will help me stay on track"
r4-1097,Con xin tri an cong duc cua Thay Thich Tri Hue da day bao ve nhung bài thuoc hay giup cho moi nguoi duoc có suc khoe. Con kinh chuc Thay Thich luon phap the khinh an Tue Dang Thuong Chieu 🙏🙏👍👍👍
r4-1098,Nhiều khi gd cũng là nơi gây ra nhiều áp lực hơn mình nghĩ...
r4-1099,Tôi cx đg cố gắng để thì cấp ba . Tôi cx tin mik sẽ lm đc tôi sẽ chiến thắng chính tôi . Bây h chx muộn 😁
r4-1100,mình có 7 triệu chứng rồi không sử dụng chất kích thích
r4-1101,Lúc này tôi biết rằng a ấy cũng đang rất đau khổ. Tôi biết mà. Hai chúng tôi đang rất đau khổ.
r4-1102,Chat i have my exam tmrw and ik im cooked and well i followed gohar's advice and i'll update you how much i scored in like a week or so fr
r4-1103,"Been on my own since 19. Im 33 now. Worked sooo many jobs, feels like i've spent 90%of my life trying to find myself or my purpose..now im mentally exhasusted. Depressed...anxious...etc. my mind wanders at 1000 thoughts per second. I recently just kinda gave up and i really dont have any feelings about it. I have asked certain people for help but most dont see it..they just say ""oh you can do it"" you've been doing good for soooo long just keep going"" they dont understand what lies beneath all of this..I NEED A BREAK! I will probably lose my car and my apartment soon bc i hqve zero energy or motivation or desire to fight...i just need a break!"
