row_id,text
r4-0292,"Xin được chia sẻ một số điều mà tôi biết Trong tâm thần học thì hoạt động của vỏ não là vô cùng quan trọng, còn cảm xúc là chiếm vị trí thống trị, rất nhiều bệnh tâm thần do các rối loạn về cảm xúc gây nên Tâm thần phân liệt là bệnh khó chữa nhất trong tâm thần Rối loạn giấc ngủ thì có những dạng như ngủ quá nhiều hoặc không ngủ được như trong video mà anh Vui Vẻ đã nói Có hai kiểu là rối loạn giấc ngủ do nguyên nhân thực tổn và rối loạn giấc ngủ do nguyên nhân không thực tổn Rối loạn giấc ngủ do nguyên nhân thực tổn thường là do hệ tiêu hóa của mình kém ( đặc biệt là gan ) và mình bị thiếu một số chất dinh dưỡng như chất xơ, chất béo không no ( đặc biệt là omega 3) , thiếu Canxi, nếu người nào bị căng thẳng quá nhiều thì phải bổ sung 8 loại vitamin B cơ bản ( não sẽ được thư giãn và da sẽ đẹp ), nhưng chú ý rắng để chuyển hóa được các vitamin B và cả vitamin C thì bắt buộc phải uống đủ nước ( lượng nước mình uống tính theo Lít = 0.04 * cân nặng ( kg ) ( vd 50 kg thì 2l, 75 kg thì 3l ) , người nào không uống đủ nước sẽ còn bị táo bón, da nhanh lão hóa, chóng mặt khi thay đổi tư thế, đặc biệt là khi bổ sung vitamin B và C thì cần uống nhiều nước hơn một chút ( uống nhiều hơn công thức tôi vừa ghi ở trên ). riêng các vitamin B và vitamin C thì không được uống buổi tối . Mình uống nước đều đến mức cơ thể không thấy khát mới là đúng, nên uống trong tư thế ngồi, và không tu ừng ực . Gan kém thì bổ gan ngay. Nguyên tắc là khi cơ thể mình không khỏe thì mình phải điều chỉnh chế độ ăn ngay rồi mới tính đến việc dùng thuốc. Giấc ngủ của mình phải là ngủ sâu, khi tỉnh dậy thì cơ thể phải thoải mái, thời gian là 7 tiếng, nếu người nào mà ngủ ít hơn 5 tiếng/ ngày ( liên tục trong 1 tuần ) thì người đó sẽ thấy sức khỏe của mình tụt nhanh hơn cả tụt quần :)) . Và một nguyên nhân nữa là không khí trong phòng ngủ phải trong lành thì phổi của mình sẽ được thư giãn , giúp tăng chất lượng giấc ngủ, trước khi đi ngủ tránh xa màn hình điện thoại , tivi và máy tính khoảng 30 phút, ăn tối trước khi đi ngủ 4 tiếng đồng hồ. Ngoài ra có thể cơ quan nào đó bị tổn thương chẳng hạn Nếu ai đó bị mất ngủ thì có thể thử cách mà tôi nói ở trên, nếu vẫn không hiệu quả thì có thể là bị rối loạn giấc ngủ không thực tổn ( cái này là phải đến gặp bác sĩ Tâm thần ) Khi bị mất ngủ là mình phải tìm ra nguyên nhân gây ra mất ngủ, rồi giải quyết nguyên nhân đó thì mình sẽ ngủ lại được, chứ không phải mất ngủ là đi uống thuốc ngủ hay thuốc an thần"
r4-0293,my nhung ca bai hat nao cung rat hay đi vao long nguoi❤minh thich con gai lam ma hoang canh ngheo ko co ai thuong chut my nhung tren con đuong am nhat đay vv
r4-0294,"- lúc nào củng học học học, không có thời gian đễ chơi, không có thời gian đễ nghĩ mệt.....tôi......mệt.....mỏi.....lắm rồi !"
r4-0295,E đã từng cố dùng game để giải tria rồi nhận ra rằng mình càng chơi thì càng cảm thấy buồn hơn
r4-0296,"Bố mẹ em muốn em có tương lai tốt hơn họ và có thể đỗ cấp 3 vào 1 ngôi trường tốt như chị em. Đặc biết là giỏi môn Anh, học chuyên luôn thì càng tốt. Chắc cũng vì vậy nên em khá áp lực, tự ti về bản thân và sợ sẽ làm bố mẹ thất vọng."
r4-0297,"Gia đình là nơi giúp mình tiêu tan những suy nghĩ tiêu cực của bản thân.. sống mà như qua đời. Vì mình cũng muốn được hiến xác, muốn chết k cần bia mộ, tro cốt rải nơi nào mát mẻ, không cần luân hồi, không cần tái sinh làm người. Trong kiếp này, cho dù đều có đủ các dấu hiệu trên, một phần rất nhỏ trách nhiệm dành cho người thân và gia đình đã kéo mình lại, giúp mình không sa ngã thêm vào suy nghĩ quá là tiêu cực. Đại khái là cân bằng một chút.. không vô dụng, chỉ cần có một chút có ích là còn tồn tại ❤"
r4-0298,Chị sunhuyn..cảm ơn chị rất nhiều vì đã truyền động lực cho e..nhờ chị e đã học hỏi thêm nhiều thứ.. Em cũng có tâm sự này..đó là chuyện gia đình..nó khiến e cảm thấy mỏi mệt..bố mẹ e đã li dị từ rất lâu...và mẹ e lúc e 13 tuổi mẹ đã đưa e ở vs dì ..nhưng mà càng lớn thì e thấy e ko hợp ở đây.. nhưng bây h e muốn trở về nhà lại thì mẹ lại đuổi e đi..e đang rất lo về cs độc lập..ba e thì cũng đã lớn tuổi ..chị có thể cho e vài lời khuyên đc ko..mong chị đọc đc..mặt khác e rất buồn về mẹ ..e cảm thấy mẹ e coi e là gánh nặng..lúc nhỏ thì e còn hay bị mẹ đối xử tệ..e lo lắng chị..e ko bk e có đủ dũng cảm để đối diện vs những gì sẽ xảy đến tiếp hay ko..nhưng e cũng ko muốn sống cs an toàn nhưng ko có ước mơ
r4-0299,"Nếu bị lo lắng, trầm cảm. Các bạn hãy đi khám bệnh và uống thuốc nữa nhé. Sẽ nhanh khỏi hơn"
r4-0300,"Chuyện của tớ đơn giản lắm, nhưng đã giày vò tớ suốt thời gian dài. Vì gia đình tớ rất hay xung đột, tớ lúc nào cũng phải im lặng vì bố mẹ tớ từng nói: lúc mất kiểm soát bố mẹ thất vọng về tớ lắm. Thế nên tớ đặt rất nhiều tình cảm cho bạn bè. Thế nhưng từ lúc lên cấp 3 tớ cảm thấy mọi người đều ko còn sự hồn nhiên như c1, c2 nữa. Hôm nào cũng cười nói nhưng thật sự với tớ, tớ ko thấy thân thiết vói ai cả. Tự nhiên tớ thấy cuộc sống tớ thật đơn độc, tớ không dám tâm sự với bất kì ai. Có 1 cậu bạn mà tớ cảm thấy rất yêu thích. Thế rồi cậu ấy dần bước vào cuộc sống của tớ, tớ cảm thấy cậu ấy như lấp đầy mọi sự cô đơn của tớ. Cậu đẹp, dịu dàng và toả sáng vô cùng. Có ngày tớ nhận ra cậu ấy thích tớ, lúc ấy tớ vẫn nghĩ mình ko quá yêu thích nên đã hơi né tránh, cho đến khi cậu ấy bắt đầu rơi xa khỏi cuộc sống của tớ, mọi thứ diễn ra trong vỏn vẹn hơn 1 tháng… ko 1 lời giải thích, cậu đi trong im lặng. Tớ đã lấy hết can đảm chất vấn cậu, cũng ẩn ý rằng tớ cũng rất thích cậu ấy… Nhưng quá trễ rồi.. cậu ấy nhất định phải rời xa tớ, bảo rằng cậu chỉ muốn tập trung học, bây giờ đến làm bạn tớ cũng ko thể. Cậu ấy nhìn thấy tớ nhưng quay đi thật xa… tớ nhớ cậu ấy lắm, nhớ ánh mắt dịu dàng từng dành cho tớ, nhớ cái xoa đầu tớ của cậu với câu nói “dễ thương lắm”… Mọi thứ như đã kết thúc, tớ chìm trong nỗi luỵ tình suốt 2 tháng. Thế rồi tớ lại thấy cậu cười và đi chơi cùng hội có khá nhiều nữ, mà mấy bn nữ ấy đều khá thân với tớ. Dịp tết vừa rồi cậu có chúc năm mới tớ, tớ cứ ngỡ đó là điều cậu dành cho 1 tớ vì tớ đã hỏi hết vòng bạn bè của cậu xem cậu có chúc họ ko, họ bảo ko.. Nhưng đều là dối trá, cậu chúc riêng cả những bạn nữ thân thiết với tớ. Tớ tủi thân vô cùng, tớ đã tự ảo tưởng và tớ khóc… đến giờ viết những dòng này tớ vẫn khóc. Tớ không hiểu tại sao khi tớ nghiêm túc với ai đó, họ lại vứt bỏ tớ như vậy… chẳng nhẽ tớ thật sự không xứng đáng được lắng nghe và yêu thương ư…"
r4-0301,"Ngày nào cũng như vậy là tổn thương con như vậy là, làm áp lực của các con"
r4-0302,"E coi được video này khi đã bước một bước ra khỏi comfort zone được 1 khoảng thời gian. Khi mà bắt đầu những thứ mới, gọi món mới, dám nói chuyện với những người mới, thử thách nhiều hơn - và đến hiện tại, em bắt đầu thấy lo sợ, lo lắng về tương lai, rằng e đã rẽ sai ngã, rằng e đang mất ổn định(và điều đó không ổn). Coi được video này, e chắc chắn với điều e đang làm hơn, cảm ơn a"
r4-0303,"Em cảm ơn chị nhiều ạ. Hiện tại em đang là một du học sinh, em đang trong quá trình nuôi dưỡng và phát triển bản thân. Thời gian phần lớn em dành cho việc học và chăm sóc bản thân, cũng đạt được một số kết quả nhất định ở trường đại học hiện tại. do sống một mình ở nơi xứ người nên tối về hay cảm thấy trống trải lắm. Nhất là gần 23 lồi bánh trưng mà chưa có lấy mảnh tình vắt vai, em cảm thấy lo lắng vì bạn bè xung quanh ai cũng có đôi có cặp. Nhưng nghe podcast của chị em nhận ra một điều là bản thân em đang tìm kiếm và lo lắng về thứ tình cảm mình chưa có mà quên mất đi những mối quan hệ, những người ngày ngày vẫn quan tâm và yêu thương em. Em cảm ơn chị nhiều ạ !❤"
r4-0304,"Trầm cảm kết hợp adhd nữa ạ,😢cho cháu hỏi trầm cảm khác gì tâm thần phân liệt ạ"
r4-0305,"mất động lực còn đỡ, chứ không có động lực như mình thì thất bại ngay từ đầu rồi."
r4-0306,"e có anh ạ , ngay bây h e vẫn đang khó chịu , ích kỉ với những nổi bật , thành công của những người bạn cùng lớp hay cùng khối , e biết là nó ko đúng , nhưng em vẫn ko kiểm soát đc những cái ganh gét ấy. e ko bt lm j cả nên đã tìm đếm video này. cảm ơn anh ."
r4-0307,Chị ơi lmsaoo để đủ can đảm nói với người thân về chuyện mjn bị trầm cảm ạ =((
r4-0308,"thật sự ở cái độ tuổi chỉ mới 15-17 mà đã phải đối diện với khủng hoảng hiện sinh và peer pressure rất khó để có thể vượt qua. Năm nay, em thi đại học và phải đối mặt với rất nhiều sự thay đổi từ bgd khiến em khá choáng. Năm 14 tuổi, bản thân cứ nghĩ là mình giỏi cho đến khi học lớp chọn, rất nhiều người giỏi hơn em, học được rất nhiều bài học mà mn chỉ dạy, em lúc đó rất may mắn. Đến bây giờ, năm 17 tuổi cũng chỉ nhận ra bản thân em không hơn được ai, band IELTS chỉ gọi là phổ thông ở các trường đh top, điểm dgnl cũng k vượt trội hẳn, sat thì chẳng giỏi. Ai cũng phải trải qua nó, nhưng đối với em khá khó vì đêm nào em cũng phải gồng mình để học, để lao đầu vào con chữ, để thay đổi tương lai, để sống ở một đất nước mới... nhưng khó thật chị ạ"
r4-0309,26/7/2021 3 năm rồi mỗi lúc mệt mỏi áp lực trong công việc thì mình hay vào nghe anh pew talk show như này thôi lại thêm động lực. 😪
r4-0310,Những người bị ton thương tâm lý bệnh trầm cảm hiện nay nhất là những bạn trẻ và các anh chị đồng trang lứa tuổi như con và những người già lớn tuổi cô đơn ít có con cháu gần gũi bên cạnh sẽ chia họ rất là cần đến sự chua lành với những vết thương bên trong tâm hồn để xoa dịu những nỗi đau khổ bên trong quá khứ và hiện tại đó thầy ạ a Di Đà Phật
r4-0311,"Hay. B có thể cách để ko cô đơn cụ thể dc ko. Ví dụ mình là ng hướng nội, tuổi thơ nhiều mặc cảm tự ti về ngoại hình thì làm sao ko bị cô đơn"
r4-0312,Thây ơi con mang cản bệnh hiẻm ngheo nên co nghe thây giang co hêt sơ chết ròi cam ơn thãy chuc thây nhiều sứ c khoe
r4-0313,""" Trong cuộc sống ,chắc hẳn mỗi chúng ta sẽ từng rơi vào lúc tuyệt vọng và xin bản thân đừng khóc vì những kết quả không mong muốn . Nhưng bạn à ! ""Cứ sai đi vì cuộc đời cho phép ! "" """
r4-0314,"Mình gặp 1 vấn đề nhỏ nhưng cảm thấy nó rất to. Vì mình thấy nó ảnh hưởng tới mọi mặt cuộc sống của mình cũng như người thân xung quanh. Có điều dù điều đó đang hiện diện rõ ràng, mọi người vẫn lờ nó đi,mình muốn được đi khám 1 cách nghiêm túc. Nhưng chả ai quan tâm,( có lẽ phí chữa trị đắt quá chăng?) Dù mọi thứ họ đang làm khiến mình khó chịu và đau khổ hơn cho hiện tại và tương lai sau này. Nhưng họ vẫn luôn nói con k sao đâu, con k sao cả, là con tự nghĩ vậy, con ảo tưởng thôi, con toàn nói dối, làm quá.....Có lẽ vậy, họ vẫn hay cảm thấy tôi giả tạo."
r4-0315,Cảm giác của của trầm cảm không hề dễ chịu ai vượt qua được đều là những người mạnh mẽ
r4-0316,"Thành thật mà nói lúc cảm thấy tuyệt vọng thì câu nói mà mình không muốn nghe là ""sẽ ổn thôi"".Nhưng khi trãi qua được rồi thì quả thật nó ổn thật,nhưng chỉ là tạm thời ngắn hạn thôi,một ngày nào đó nó cũng lại là lí do khiến mình thất vọng:))"
r4-0317,"Đừng đặt quá nhiều yêu cầu và mục tiêu, làm hết mình nghe thiên mệnh và hài lòng những cái mình có hiện tại thôi, bản chất con người là đố kỵ tham lam ích kỷ, nhờ có giáo dục( bắt nguồn từ tôn giáo) mà các chuẩn mục đạo đức dần giới hạn những tính cách đó giúp ta sống tốt hơn, xã hội trật tự hơn, ngày nay do sức sản xuất cao hon nên ta có nhiều thời gian để suy nghĩ về những chuyện ngoài nhu cầu cơ bản (ăn, ở, mặc, tình dục) dẫn đến những yêu cầu tự áp đặt rồi bị áp đặt dẫn đến quá kỳ vọng vào tương lai, khi mà tương lại k còn đáp ứng dc rồi sinh ra thất vọng chán chường bế tắc và cuối cùng trầm cảm, mình lớn lên trong gia đình nghèo suốt ngày nghe chửi rồi lúc nhỏ còn bị lạm dụng tình dục. Rồi lớn lên càng ra xã hội thì vấn đề tâm lý lại càng nhiều,lúc nhỏ chỉ lo làm sao có cơm ăn nên chuyện gì cũng nhịn và không suy nghĩ nhiều, càng lớn khi có tg và góc nhìn đa chiều hơn thì sự so sánh cũng nhiều dẫn tới suy nghĩ nhiều hơn và mình đã rơi vào trầm cảm. Sau đó mình đi nhiều tìm hiểu nhiều rồi đối diện vs kẻ lạm dụng mình lúc nhỏ và chia sẻ vs gia đình về việc đánh đập và chửi rủa vô cớ lúc nhỏ, khi kinh tế ổn hơn và cởi bỏ dc các định kiến vàng chấp nhận quá khứ thì trầm cảm không còn là vấn đề, đến chết còn không sợ thì sao phải sợ sống."
r4-0318,"Chị ơi,em đã từng có một người bạn rất thân, tên là đan như.Em với cậu ấy chơi với nhau từ lúc 3 tuổi đến năm lớp 3.Một tình bạn năm năm tưởng sẽ mãi bên nhau nhưng cho đến năm lớp 3, cậu ấy đáng ghét lắm.Nào là cấm em chơi với người bạn ấy ghét, cấm em nhìn vào các bạn khác,…. Sự việc thật quá đáng, đến một ngày, em nói với bạn ấy rằng, thôi đi, chấm dứt tình bạn này đi.Thế rồi , năm lớp 4 , cậu ấy chuyển trường.Em biết lời nói đó cũng làm tổn thương cậu ấy mà, nhưng chính em cũng là kẻ bị tổn thương mà.Cũng năm ấy, lớp em rất ghét một bạn tên là Thảo Ngân,em bao che cho cậu ấy, rồi cuối cùng cũng bị tẩy chay luôn.Mọi người nói em ngây thơ, mọi người nói em ham tiền mà cho cậu ấy chép bài, nhưng em thực sự chỉ muốn tha thứ cho cậu ấy thôi. ác quên, lớp em ghét bạn ấy, vì bận ấy học dốt, hay khoe khoang, hay bóc phét, còn nói bố tớ đã đi gặp tổng thống Mỹ và được tặng kẹo Mentos.Và rồi, em nhận ra sự áp lực khi làm bạn thân của cậu ấy, rồi em nói răng , tớ không muốn làm bạn thân cậu nữa tớ thấy áp lực quá.Thế bạn ấy lại suy ra đủ kiểu rằng em nói vậy chỉ để bao che rằng em không hề thích chơi với bạn ấy.Dần dần, em cùng cả lớp ăn tí bạn ấy luôn, nhưng mà là trong âm thầm,Chúng em giả vờ là bạn tốt của nhau, nhưng thật ra chỉ là giả tạo, làm thế chỉ để tìm hiểu thêm những tật xấu của bạn ấy mà thôi, câu chuyện của em đã kết thúc rồi ạ"
r4-0319,"Con cũng mới trải qua biến cố cũng vì cái tôi quá lớn mà con lại luôn cho rằng đó là con người thật của mình, vì muốn khẳng định bản thân mà con mắc 1 sai lầm quá lớn. Bây giờ con thấy tất cả tiền tài danh vọng con đều không cần vì nó ko khiến con thật sự hạnh phúc .Cũng có 2 con người tồn tại bên trong con như thầy lúc trước, 1 nửa muốn an phận, 1 nửa muốn bứt phá. Nhưng con đã sai rồi, đọc sách rất nhiều hiểu biết nhiều đôi khi lại làm cho mình ảo tưởng vì áp dụng không đúng, cảm ơn thầy vì postcard này con sẽ cố gắng đứng lên sau vấp ngã thương đau này..."
r4-0320,Tôi đang trong hoàn cảnh như này sắp ra toà nhưng bọn đàn bà lẳng lơ lăng loàn nó đang tình yêu quấn nhau nó ko tỉnh ngộ ra đc đâu. Vì tôi đã cố nói nói rất nhiều nhưng nó vẫn dứt áo ra đi
r4-0321,Xã hội càng phát triển thì trầm cảm càng nhiều cơm áo gạo tiền
r4-0322,"... Con tim em thay lòng Để niềm đau thay bao mặn nồng Bước chân anh đi về Chẳng còn ai mong Được dăm 2 3 năm ròng Để giờ nghe tin em đi theo chồng Nước mắt hòa tiếng đau người đành sao Bao ngày trông mong, ngóng đợi Giờ về thì không ai chờ Giọt buồn rơi xuống Đưa tay giấu đi vội vàng Đem niềm tin ra phương xa Trái tim gửi gắm quê nhà Giờ về đây lấy Em đem vứt cho người ta Cô đơn dành cho ai đây Bao nhiêu tương tư tàn hoa phai Cứ nghĩ là Sẽ giữ mãi được hình bóng Bao nhiêu lần đã hi vọng Về nơi dấu yêu ban đầu Chẳng âu lo bên nhau Hát vang câu hò Đêm thâu lại lo âu Không sao đâu, chia tay chẳng đau lâu Phải chăng em đem tình yêu Cho người khác 12 bến nước đục trong Đời em sẽ vui nhiều không Hay là nước mắt ướt mi lưng tròng Vì tương lai Anh phải cố gắng lao lực Để người nương vai Đối với anh thì sao cực Vì thương ai Bao đêm dài anh thao thức Để nỗi đau vương lại Giờ tim này đau nhức Lời ngọt ngào người từng trao Như những chất độc không màu Thấm vào máu, sâu vào não Giết chết tế bào, sao không đau Bông hoa xinh ngày xưa Vì người ra đi mà lụy tàn Trời xanh kéo đầy mây mưa Như tiếc tình mình đã li tan Buông sợi tơ Chia tay tàn phai giấc mơ Có chăng là mơ Một lý do anh sẽ thôi mong chờ Làm người thay đổi Vì em là ai trong lòng tôi Mà mang niềm đau bao ngày qua Vậy là coi như ta mất nhau rồi Cô đơn dành cho ai đây Bao nhiêu tương tư tàn hoa phai Cứ nghĩ là Sẽ giữ mãi được hình bóng Bao nhiêu lần đã hi vọng Về nơi dấu yêu ban đầu Chẳng âu lo bên nhau Hát vang câu hò Đêm thâu lại lo âu Không sao đâu, chia tay chẳng đau lâu Phải chăng em đem tình yêu Cho người khác 12 bến nước đục trong Đời em sẽ vui nhiều không Hay là nước mắt ướt mi lưng tròng"
r4-0323,Mỗi lúc mình suy nghĩ tiêu cực và gặp bế tắc trong cuộc sống thì mình luôn tìm đến những bài giảng của Thầy để tìm hướng giải quyết vấn đề mình đang gặp phải. Cám ơn thầy nhiều ạ.
r4-0324,"cảm ơn ad, thú thật mình là nạn nhân của bệnh này từ nhiều năm nay và lắm lúc cũng khổ vì nó"
r4-0325,"T uống thuốc chống trầm cảm mỗi tối, dạng lỏng, 2 lon, thường là Tiger Platinum..."
r4-0326,"Cảm ơn postcad của bạn. Mình đang điều trị tâm lý, lúc này mình đang bị lạc. Khi cần, có một giọng nói vang lên trong đầu thực sự rất dễ chịu."
r4-0327,"Em cũng là người nhút nhát ạ. Ít giao tiếp với m.n và thường xuyên từ bỏ những hoạt động ngoại khoá dù biết nó sẽ có ích cho cái tính này của mình. Giờ xem video của chị đã giúp em hiểu được phần nào, cảm ơn chị nhiều ạ 🙆🙆"
r4-0328,"Beautyfully spoken about trauma but when she will begin talking about occupational burnout: Burn-out is included in the 11th Revision of the International Classification of Diseases (ICD-11) as an occupational phenomenon. It is not classified as a medical condition. It is described in the chapter: ‘Factors influencing health status or contact with health services’ – which includes reasons for which people contact health services but that are not classed as illnesses or health conditions. Burn-out is defined in ICD-11 as follows: “Burn-out is a syndrome conceptualized as resulting from chronic workplace stress that has not been successfully managed. It is characterized by three dimensions: feelings of energy depletion or exhaustion; increased mental distance from one’s job, or feelings of negativism or cynicism related to one's job; and reduced professional efficacy. Burn-out refers specifically to phenomena in the occupational context and should not be applied to describe experiences in other areas of life.” Burn-out was also included in ICD-10, in the same category as in ICD-11, but the definition is now more detailed. The World Health Organization is about to embark on the development of evidence-based guidelines on mental well-being in the workplace."
r4-0329,"Các bạn của mình khi hỏi cậu cảm nhận thế nào về tớ.Mọi người bạn của mình ai cx nói rằng cậu hoạt bát, hướng ngoại và tích cực. Nhưng chỉ có mình ms hiểu được rằng, bên trong mình tiêu cực thế nào, mình ngưỡng mộ các bạn vì có cha mẹ vui vẻ,hiền lành,ít la mắng con vội vàng. Gặp mọi người mình luôn tích cực nhưng đó chỉ là vỏ bọc để che đậy hàng tá nỗi đau trong con người mình. Chỉ những vc nhỏ thôi nhưng cha mẹ cứ phải lm to lên,những vc đã trôi qua lâu r nhưng khi tức giận họ lại lôi ra để chửi mắng mình. Mình cảm thấy thật ko công bằng khi ba ko bao h lm vc nhà, nhưng cứ suốt ngày la mắng bắt ép mình lm, cứ tưởng mẹ sẽ đứng về phía mình nhưng lại ko.. khó tả nhưng cảm xúc ấy. Luôn bắt ép mình học tập, cả về nghề nghiệp sau này cx phải bắt theo ý của họ.Hai chữ ""ba mẹ"" mình ko muốn nhăc đến.mình căm phẫn đến mức nhìu lúc ko muốn gọi họ là bame. Chỉ muốn hét lên rằng các người có cho tôi yên ko hả... nhưng mình chỉ bt im lặng. Hoàn toàn nghẹt thở, mình luôn tự dặn lòng 1 khi lớn học đại học, đi lm kiếm đc tiền. Mình sẽ ko quay lại căn nhà đó nxa.. mọi người có thể nói tôi bồng bột, bất hiếu.. nhưng mọi người vĩnh viễn ko thể hiểu rằng tôi đã vụn vỡ và tuyệt vọng ra sao..."
r4-0330,"Mình đã trở thành sinh viên được 3 tháng, mình phải làm quen với cuộc sống tự lập, phải làm quen với môi trường mới, cách học mới, những con người mới và phải học cách hòa hợp với một người bạn cùng phòng. Mọi thứ khiến mình rơi vào trạng thái căng thẳng trong suốt thời gian dài. Nhưng khi nghe được câu chuyện này mình thấy rằng ai rồi cũng cần trải qua những khó khăn để trưởng thành, và mình chỉ nên giữ lấy ước mơ của mình làm điểm sáng duy nhất để sống và học tập thật tốt. Cảm ơn bạn rất nhiều."
r4-0331,"Kinh khủng quá troi đất oi, nghe muốn chết,"
