row_id,text
r4-0000,Ca si Minh thuy hat rat hay giong phat am rat.chuan co hat rat xuat sac giong co.rat manh giong ca si y phuong o Ben my cam on co chuc co duoc nhieu suc khoe gia dinh hanh phuc
r4-0001,"Thật sự mình đã đồng cảm, hiểu rõ hơn với chứng trầm cảm sau video này của anh Trí, mong các bạn bình an và hồi phục qua lại cuộc sống đầy bình an!"
r4-0002,"haha chào mn, 1 năm qua thì thì thì....mình vẫn chưa có gì thay đổi nhiều. Mình đang làm sinh viên và mất kha khá nhiều gốc. Alright, và mình cảm thấy rất tiêu cực vì cảm thấy năng lực, chiến lược nhóm, bla bla so fail. Nhưng theo mình nếu ta nhìn nhận lại vẫn chưa đủ, nổ lực vẫn chưa đủ, mà thay đổi thì có thể nhe haha. Bây giờ thì nếu có 2 khái niệm giữa thành công và thất bại thì mình không nghĩ mình thất bại nữa, mà là thành công và có thêm 1 bài học (""nhớ đời haha"") sẽ là 1 quá trình siu dài để thay đổi và cảm ơn anh Trí đúc kết từ những kinh nghiệm cho em và mọi người có cách nhìn khác trong công việc, học hành và cả cuộc đời này. Thank anh chai nhìu lắm ;))"
r4-0003,mv cam dong nhan van khien long tro nen thanh than cam on tgia da dua den 1 bai hat rat hay
r4-0004,"Hallo anh, chào mọi người, mình 96 tức là đang 24 tuổi, trước khi xem clip, mình không nghĩ mình đang trong 1 cuộc khủng hoảng, chưa xác định rõ kẻ địch của bản thân mình đang phải đối mặt là gì, nhưng giờ thì rõ rồi. Kẻ địch có sự hỗ trợ từ sự yêu thương của gia đình, bó buộc bản thân mình trong vòng an toàn, nhưng điều đó chi càng làm mình muốn vượt qua bung ra, chính trong mình cũng cảm thấy có sự bất hiếu khi không nghe theo định hướng sống cuộc sống mà gia đình mong muốn. Nhưng đó là cái giá mình chấp nhận trả để có được 1 ngày mai tốt hơn, 1 con người khác được gia đình ghi nhận, và gặt hái được nhiều thành quả, cống hiến có ích làm đẹp cho đời. Cảm ơn anh Trí."
r4-0005,"I dropped out of school the summer after my sophomore year because I was going to be held back. Not for failure to pass my classes, I was in honors classes, but because I had issues with *specifically* the vice principal. He didn't like that I'd ask why I was in trouble(I genuinely didn't understand why I was in trouble most of the time) so he would suspend me for 2-3 days every time I went to his office because I was ""disrespectful"". Due to suspensions, I was having to make up absences in detention. Two months before the end of the school year, he suspended me from campus(attended an alternative school) for the remainder of the year which also meant I wasn't allowed on campus to make up absences. Rather than going back to school I got a job and a year later, at 17, I moved away from home and rented my own 2 bedroom house in a different state. I never thought about the build up of stress leading to me dropping out but now that you mention it... It very likely could've been burnout."
r4-0006,"vậy mà vẫn có những người(đặc biệt là thế hệ 7x,6x) lại cho bệnh trầm cảm là bệnh điên rồi tránh xa họ vì nghĩ rằng mình có thể bị họ làm hại hay gây thương tích cho mình."
r4-0007,"Quỳnh từng chia sẻ rằng tuổi thơ của m ko êm đẹp, nhìn bên ngoài đầy đủ vật chất nhưng bên trong gia đình ba mẹ Q ko hạnh phúc và Q cũng ít nhiều bị ảnh hưởng và sang chấn tuổi thơ. Mình đang trên hành trình tự chữa lành trauma cũng hơn 2 năm rồi nhưng việc chấp nhận và bao dung cho những vòng lặp và sang chấn thế hệ vô cùng khó khăn với m. Tip thứ 9 Q có đề cập đến Tề Gia, bên trong m từng có giọng nói m phải vượt qua việc này, m phải tha thứ cho ba mẹ, giải hòa với ông bà tổ tiên thì m mới thành công dc, nếu đến ba mẹ mà m ko thể bao dung dc thì m cũng chẳng thể giúp dc ai. Q có thể chia sẻ làm cách nào để m có thể handle những trauma hok? Cảm ơn Q đã chia sẻ 🎉❤"
r4-0008,"Em cảm ơn anh, em sẽ cố gắng luyện tập để vượt qua những khó khăn hiện tại của bản thân."
r4-0009,Con nam mo a di đa phat concam on thay a nhing loi thay daycon hieu va co gang tu tap moi ngay con chi mong thay mai manh khoe đe gíang phap giup đoi a
r4-0010,Thầy rất thấu hiểu những người trầm cảm như chúng con .rất tiếc o đc thầy trực tiếp tư vấn và điều trị .
r4-0011,"Mình cũng từng bị trầm cảm, mà nhờ chạy bộ liên tục trong 4 năm, nên hiện giờ mình đỡ 70 - 80 %. Hầu như cuộc sống trở lại bình thường. Trầm cảm chủ yếu là hên xui, do gene di truyền của gia đình, cho nên các bạn đừng đổ thừa cuộc sống, bùa ngãi, bị thư. Và quan trọng hơn là đừng tìm đến tôn giáo, vì nó có thể làm bệnh nặng hơn. Thể thao là liều thuốc tốt nhất, chỉ có mình cứu mình, không trời phật nào cứu cả. Hi vọng chút kinh nghiệm góp phần nào đó giúp các bạn."
r4-0012,"I would have liked a last piece about recovering from established long term burnout. This is the hardest, because the preventative measures probably still apply, but they take on the quality of more things you “are supposed to be doing” — more demands. My one criticism of the piece is that I think limiting burnout to work factors creates an incomplete picture. Personal demands can definitely play a role. Single moms is probably the most often cited, though in my case an elderly parent was the biggest factor. The reason I got served this clip is that long term burnout is a big topic at the moment on the neurodivergent channels, ADHD and autism. Neurodivergence adds some tricky variables; it certainly can make you more vulnerable to burnout, and certain neurodivergent traits strongly resemble the symptoms of burnout, which makes untangling what is a result of what that much harder. Not least because some of the traits that resemble burnout may in fact come from experiencing the causes of burnout throughout all areas of a neurodivergent person’s life. These days, this type of ongoing stress is often misattributed as trauma, and I appreciate that this piece talks about stress as a root. I do feel a need to clarify one last thing about that, however: burnout as an outcome is distinguishable from stress, but it flows from persistent stress. If you are trying to preempt burnout, it’s very important not to fall into looking at your situation and going “it’s just stress.” There’s nothing “just” about stress. No one can live a stress free life, just as no one can avoid being exposed to any carcinogens. But too much of either too constantly is likely to lead to health problems, and in the case of stress, those problems are often mental health related. Alas, the concerns often get applied only to whether you have a heart attack or a stroke. But many of us can tell you that breakdowns can be debilitating too. Persistent stress does damage to all systems, especially the prefrontal cortex. It is long past time for business and society to stop pretending that “what does not kill us makes us stronger.”"
r4-0013,"Bac si co the dang tai nhg bai bang tieng anh cho gioi tre coi dc o, toi muon cho con trai toi coi trang mang cua bac si Mà no o Hieu tieng viet Cam on bac si"
r4-0014,em bị tam than kho lam muón chét cũng ko được
r4-0015,người trầm cảm có cái nét giống như có mây đen ở trên đầu :D nếu ai có 1 chuyện gì đó rất thầm kín hoặc quan trọng cần phải giữ bí mật khả năng cao sẽ bị trầm cảm giống như giấu đi bộ mặt thật của bản thân chẳng hạn.
r4-0016,"mình thuộc cộng đồng lgbt từ nhỏ lúc mình còn chưa nhận thức được thì tính cách của mình đã được bộc lộ ra ngoài theo 1 cách tự nhiên khi ấy mình rất hay bị những lời nói trêu chọc, miệt thị lúc đấy mình khá buồn nhưng không thể lm gì hơn vì đó là con người thật của mình. Dần lớn lên mình đã ý thức hơn và bỏ ngoài tai không còn quan tâm đến những lời nói ấy nữa nhưng lờ đi nhưng lời nói ấy từ người ngoài đã là khá khó giờ đây mình còn phải cố gắng bỏ qua những lời phán xét về ngoại hình, tính cách từ chính những người thân. Mình rất khó chịu và buồn nhiều nhưng cách duy nhất mình có thể lm là im lặng, âm thầm buồn rồi thôi. Nhiều lúc mình nghĩ tính cách mình k như thế, bình thường như bao người thì hay biết mấy. Mình thật sự rất mệt"
r4-0017,Cũng có vài trường hợp mà trẻ nhỏ hiểu chuyện nhưng lại mang bệnh trầm cảm trong người mà ko ai hay biết
r4-0018,Mình cũng là một đứa trẻ ở trong một gia đình độc hại và vào lúc mình đang cảm thấy không hề ổn cảm ơn Vì sao thế nhỉ! đã giúp mình bình tĩnh lại và có thể tiếp tục bước tiếp
r4-0019,"Kênh này để khiến nx snghi tiêu cực càng tiêu cực hơn, khiến cho ng nghe chỉ muốn tự thuơg lấy bản thân mà khóc. Thay vì vậy, sao ko xem nx kênh về cách phát triển bản thân. Tại sao phải xem kênh để tự tủi thân, thấy bản thân tội nghiệp, NỄU BẠN THẤT VỌNG VỀ BẢN THÂN, BẠN VẪN CÓ TỨ CHI, VẪN LÀM NÊN CHUYỆN NẾU CẢI THIỆN BẢN THÂN,NGỪNG LƯỚT ĐIỆN THOẠI VÀ LÀM NX ĐIỀU TỐT HƠN ĐI.tôi đã từng xem nx vid như này và khóc hết buổi tối. Đoán xem,nó giúp đc j, nó giúp tôi tự thấy tủi thân mà khóc cả đêm rồi ngày hôm sau lại như v, chả có j khác và tốt đẹp hơn. Rồi tôi chuyển sang xem nx vid cải thiện bản thân, tôi bắt đầu tập gym, thân hình đẹp hơn và lúc ấy chẳng còn giọt nc mắt, chả cần an ủi mà vẫn có cuộc sống tốt hơn. Thay vì xem để thấy tủi thân, thấy bản thân tệ thế nào THÌ HÃY CẢI THIỆN NÓ, DÁM ĐỐI MẶT ĐI"
r4-0020,"trước 27:21 một chút. đột nhiên nghe đến đoạn phải tìm lại bản thân làm em thấy chạnh lòng thiệt khi nghĩ về bản thân. Rồi sự khác biệt làm mình lấp liếm đi những bản chất thật sự của chính mình. Đến một lúc tưởng nó là bản thân thật... rồi khi ánh đèn sân khấu tắt đi, em đã cảm tưởng mình như đứng giữa một giao lộ rộng lớn, không còn ai chăm chú theo dõi mình, em không biết có điều đó rất kỳ cục, rất sai nhưng nghĩ mãi chẳng ra. Cho đến khi em tìm được một câu hỏi phù hợp, tại sao? Tại sao mình phải như vậy? Tại sao có người có một nơi quen thuộc? Tại sao họ lại từ chối người khác? Tại sao người ta lại không nghĩ đến cảm nhận của mình? Tại sao họ không nghĩ giống mình? Rồi một ngày nọ, chắc phải sau 7 năm liên tục với nhiều sự bắt chước và cố ép mình vào một chiếc khung không thuộc về mình. Em chợt nghĩ. Từ khi nhỏ, mình đã mơ ước về điều gì nhỉ? Em ước mơ có thể sáng chế một tấm màn lọc khí đặt trực tiếp vào bô xe máy cho người dân, làm cách nào mà nó vừa thay đổi được quy mô lớn, vừa thuyết phục được người dân lấp đặt nó trong giai đoạn có tin tức nhà nước muốn loại bỏ những chiếc xe đã quá hạn sử dụng. Em đã ước mình có thể có một căn nhà trên chiếc đồi cao, chỉ mình em ở đó, nằm dài trên thảm cỏ dài xa tít tắp, thư thả nhìn từng áng mây trôi qua, rồi bỗng ngồi dậy, nhìn về phía sau, một căn nhà nhỏ đang chờ em trở lại. Em đã ước có thể gặp được một người, thường xuyên đón xe buýt tại một trạm, một khung giờ cố định, có một chỗ ngồi yêu thích riêng trên xe buýt, thích ngắm nhìn bầu trời. Và rồi, tất cả những thứ đó liệu em cần phải tìm kiếm tại những nơi thật xa? Từ một con người khác mà không phải chính mình? Em đã nghĩ rất lâu, đến lúc bản thân gần như gục ngã vì không biết mình cần phải làm gì khi những ước mơ lúc ấy đã được vui lấp quá lâu. Và tựa như khi chiếc hộp Pandora bật mở, những hỗn độn, sợ hãi, mất mát ùa đến, em cuộn mình trong cơn bão của trạng thái burn out, để rồi cuối con đường ấy, khi tất cả những thứ không phải bản thân, không thuộc về chính mình bị cuốn bay, tất cả rồi chỉ còn lại... hy vọng. Hy vọng từ những ước mơ, hy vọng từ bản thân, từ gia đình và tình thương. Em cảm thấy thật may mắn khi gặp được thất bại. Em cảm thấy may mắn khi còn có mẹ bên cạnh, còn những người yêu thương mình. Em cảm thấy biết ơn bản thân, khi đã mạnh mẽ, một lần nửa lại có thể quên đi và trở về với sự tích cực, rõ ràng và niềm tin. Mong ai đó vẫn đang trên chặng đường khó khăn, mò mẫn trong vô số sự lựa chọn không phải của mình. Các bạn không cô độc. Các bạn vẫn luôn có một điểm tựa vững chắc nhất để trở về. Hãy ôm lấy chính bản thân mình, đóng tất cả cửa sổ lại và tự hỏi, bạn muốn điều gì bừng nở trong giấc mơ của mình. Rồi chậm rãi mở mắt ra. Bạn sẽ thấy, gia đình luôn sẵn sàng bên cạnh, che chở bạn. Bạn sẽ thấy ai là người cảm thấy an toàn khi bên cạnh, ai thật lòng vì bạn mà quan tâm chân thành. Những thứ khác, hãy dừng bận tâm. Từ chiếc pin tắt nguồn, bạn sẽ trở thành người có năng lượng tuyệt vời nhất và thắp sáng thế giới xung quanh! Đừng từ bỏ chính mình, hy vọng và những người luôn yêu thương chúng ta. Thế giới là tấm gương, là niềm tin là sự mong đợi của chính bản thân mình! Hãy có trách nhiệm với những điều thuộc về bạn. Đó là cách duy nhất sẽ luôn vực bạn dậy từ bất cứ đâu. Không bao giờ là quá muộn cho hành trình tìm thấy và thấu hiểu chính mình, thấu hiểu thế giới này. Cố lên nhé"
r4-0021,rat cam on bac si bac si that thong minh tri tue vo thuong sieng nang chiu kho .thay bac si lam viec suot ma van vui cuoi nhin thay ma mac sieng lay luon.cac on bac si ♥.
r4-0022,"Chào ths bs Nguyễn Trung Nghĩa, con gái tôi bị trầm cảm xin đến khám ở bs được k ạ"
r4-0023,Toi ngam mat ong va dau xanh nau voi duong phen anh tu van qua tuyet voi nhung neu bi tieu duong tup2 co su dung duoc khg?
r4-0024,Mình cũng đang trải qua vấn đề về tinh thần và may mắn gặp dc vlog này. Cảm ơn Sky nhiều ❤
r4-0025,Cảm ơn chị ạ em được 5 điểm toán 🥲 và luôn luôn dằn vặt về bản thân nhờ có chị mà em mới cố gắng nhiều hơn nữa ạ
r4-0026,troi oi hoat canh bai hat phuong dung dien ta lam anh xuc dong roi nuoc mat em tuyet voi lam em oi huhu anh dang khoc ne em luon chuc em hanh phuc ben chong nhe
r4-0027,"Your info is always overly generous and covers the vastness of human experience - but atm I'm a one-horse pony show 😁so take this query from whence it comes. If I link this particular video to ""the mask of success"", I'm going to argue that in my world there are 2 aspects that may be more challenging when we cover burnout in high achieving ADHD - the dopamine burnout (already dysregulated and under-responsive to reward) and the resetting of the DMN (DMN is always on and boredom is distressing). This either suggests that we're prone to faster burnout under similar conditions, and/or our recovery needs to be different. The latter is something I'm testing in AI but was curious whether it made sense."
r4-0028,Chao buoi toi cam on bai hat hay xin cau chuc ban binh an hanh phuc may man cho toi tuyen vao tap nhac yeu am nhac cua toi❤
r4-0029,Minh da bi binh nay da may chuc nam roi .gan day minh gap mot cu soc nang .va minh kg muon gap ai .chi muon o mot minh .doi khi minh muon cham dut giai thoat de duoc binh ien.minh nghe qua chia se bac si .minh dang trong tinh trang do . Cam on bs rat nhieu .
r4-0030,Có một lần mình cãi nhau với mẹ mình về học tập lúc đó mẹ mình vì tức quá đã nói ra những rời khó nghe nhưng cái mình đau lòng nhất là mẹ mik bảo:” giá như cái lúc ta sinh m ra t bóp mũi cho m chết đi rồi” mình cố gắng làm tất cả khiến mẹ mình hài lòng nhưng cái mình nhận lại là gì mẹ mình đi nói với mọi người là “Con đấy là cái đứa hư thân mất nết nói nó làm gì” mình luôn lấy lí do làm cái cớ tại sao mẹ mình làm vậy là” do bố mình mất sớm mẹ mình một mình nuôi ba đứa con nên bà ấy cũng phải biết mệt chứ” nhưng mẹ ơi con cũng có cảm xúc mà
r4-0031,Nguoi nha em bi tam than phan liet dang kich dong thi uong thuoc gi xin bac sy tu van dum cam on bac sy
r4-0032,Tạ ơn chúa.con cảm ơn cha. Lạy chúa con biết con đang bị vết thương trong tâm hồn.lạy chúa xin hãy xót thương con và chữa lành giúp con ... Amen
r4-0033,Mẹ ơi. Con xin lỗi. Vì Con đã Làm Mẹ Tuyệt Vọng Rất Nhiều. Nhưng Con Hứa. Con sẽ cố gắng hết mình để ko làm Mẹ tuyệt vọng :(
r4-0034,"Toi cam thay tuyet voi khi chong toi luon yeu thuong toi , toi biet on hom nay bay tap yoga rat nang luong .toi biet on hom nay toi thay tinh lang hon"
r4-0035,"Cảm ơn video của bạn, mình chỉ nghe vài phút đầu thôi đã hiểu được vấn đề và bắt đầu mớ công việc được ngay trong khi trước đó đã mất cả buổi sáng không thể làm được gì. Hy vọng mình sẽ cố gắng điều chỉnh và rèn luyện tâm lý mình thường xuyên hơn."
r4-0036,"Khi người ta cô đơn, trái tim mong manh trở nên yếu mềm Cố sắt đá bên ngoài để che giấu khi con tim tổn thương ^^"
r4-0037,"Đến phút 13:56 mình nhận ra do thiếu ngủ nên mình mới sai nhiều lỗi ngớ ngẩn trong bài làm , mình cứ tưởng bản thân chủ quan nên lại càng học nhồi đến đêm khuya , giờ thì mình đã hiểu vì sao ...thật sự cảm ơn chiếc video này ❤"
r4-0038,Su huy sinh me rat lon nguoi thuong co cau:cong cha nhu nui thai son Nghia me nhu nuoc trong nguon chay ra Mot long the me kinh cha Cho tron chu hieu moi la dao con Va cam on chan thanh den nhung nguoi chien si da hi sinh thanh xuan de bao ve to quoc chung ta nhu ngay hom nay Mot video that y nghia Mai la tri ki cua oppa huy ido
r4-0039,"cảm ơn bạn đã cho mình 1 lần nỗ lực, đêm đó mình đã khóc khóc nhưng vì sợ làm ồn tới mọi người nên mình chỉ biết nhịn và r đã thiếp đi đến 4h sáng và mình đã nỗ lực và đã được đền đáp bằng những con điểm cao . Cảm ơn bạn đã truyền động lực cho mình, cảm ơn bạn rất nhiều❤❤❤"
r4-0040,Hết dậy thì hết trầm cảm rồi còn chút overthinking thôi=))
r4-0041,"Video rất hữu ích. Tôi có người nhà có dấu hiệu trầm cảm, nhưng cũng có ảo tưởng ảo giác. Người đó sẽ nổi điên nếu mình rủ anh ấy đi gặp bác sĩ. Xin bác sĩ Lu lời khuyên"
r4-0042,Hom nay minh ko con cach nao nua . Chi bat ap dung phan cua Thuy huong dan de minh tap moi ngay nhu the nao ah. Cam on Thuy
r4-0043,"Cam on loi phat da day,tu nay ve sau con se lam mot nguoi tot hon de cho gia dinh con khoe manh khong dau om benh tat va song hanh phuc ,con chi uoc nhu vay thoi con cam on nhieu lam ạ"
r4-0044,Nhung loi noi cua cha co doan tham thuy va thuc te xay ra trong cuoc song cua con nguoi da dem den cho nhau va ho da phai chiu dau kho gan het 3/4 cuoc song tran gian Thuong de ban cho ho cam on cha
r4-0045,"Mình bị mất ngủ,bs cho thuốc thiếu máu cục bộ vì mình khai có nhoi nhoi ở tim, với thuốc rôi loạn tâm thần, trầm cảm, còn một viên bốc vỏ nên không thấy tên, viên này nó nhỏ và dài, viên thuốc có khía chia ra làm bốn,moi lần uống thì bẻ ra một phần, vậy viên đó là thuốc gì bs,hay là viên bs đang nói"
r4-0046,"Bài này làm mình nhớ đến mình năm 18. Cũng 3 năm trôi qua rồi, chả hiểu sao khi nghe cảm xúc lại cuộn trào như thời điểm đó vậy. Năm đó, một người bạn mà mình yêu quý lựa chọn kết thúc cuộc đời ở tuổi 18. Và để lại trong mình sự dằn vặt khôn nguôi, mãi đến tận bây giờ, khi mình nghĩ mình đã chôn vùi nỗi đau đó thật sâu, thì bài này lại phát lên, và cũng lôi cả những ký ức cũ mà mình tưởng chừng đã quên đi mất một lần nữa phơi bày trước mắt. ""Tối em vội lên trên chuyến xe về nơi thiên đường"" ""Mắt em vội cay khi nhớ một người từng thương"" ""Em đừng khóc, nếu tình mình chưa thành hình hài"" ""Em đừng khóc, nếu mình hẹn không ngày gặp lại..."""
r4-0047,"Thật tâm cảm tạ ""lời khuyên"".. Xem bài, cảm nhận lời truyền..thấm sâu.. Trước nay như thể loạn đầu.. Bị điều khiển bởi các khâu mạng xoàng.. Cả ngày cảm xúc mơ màng.. Càng chơi, càng thấy hoang mang hướng đời.. Diễn tả khó hết bằng lời.. CẢM ƠN TÁC GIẢ MỘT LỜI THÀNH TÂM..❤️😊"
r4-0048,"2022 là một năm có nhiều thay đổi với mình, tới sinh sống một thành phố mới, làm quen với môi trường công việc mới, mình cũng chạy trốn bỏ lại sau lưng những điều buồn phiền ở nơi cũ. Mình vẫn cứ loay hoay xoay sở sống, học cách mở lòng với nơi đây. Quen với việc một mình, nhưng khi bài hát này vang lên, mình nghĩ rằng không chỉ riêng mình mà sẽ có rất nhiều người đều thấy bản thân mình đâu đó trong bài hát này. Nhiều khi tự ôm lấy chính bản thân mình, tự an ủi, động viên bản thân mình cũng đủ rồi...Cám ơn Kai, Min, GreyD"
r4-0049,"Cảm ơn chiếc podcast này của chị, cảm ơn vì đã giúp em tha thứ cho chính bản thân mình. Là một cô bé tuổi 15-16 mới bước vào cấp 3 nhưng đôi lúc em cảm thấy bản thân thật chông chênh với cuộc đời này, bản thân là ai, bản thân cần làm gì để tốt cho bản thân, tốt cho tương lai, liệu những nỗ lực của bản thân có xứng với một kết quả tốt hơn..."
r4-0050,"Cam on bac si da huong dan. Phuong phap hd xem lại. Noi ngan gon xuc tich , trong tam . Lap tu nhieu qua nen thay dai dong"
r4-0051,"Dù là gì đi nữa cũng là 2 chị em ruột,tại sao lại đến nông nỗi này,chắc chắn anh ta đã phải chịu quá nhiều ấm ức,quá nhiều sự bất công trong cái gd này lên sự uất ức vì quá nghiệt ngã mà đánh mất lý trí thế này"
